看过,2012-07-25 09:41:18,4.0,0,叙事型的拍摄，没有什么华丽的技巧，真实再现那段历史，结尾有些突兀
看过,2012-07-22 00:13:52,4.0,0,物伤其类，人同其心。本身同根生，相煎何太急。为什么世界要比我们想象中的复杂……看的我有些压抑
看过,2010-12-04 21:04:36,5.0,0,心尖的震撼与动容，靠近死亡才能表现最真实的人性。
看过,2011-08-22 12:44:31,5.0,0,"神作   “你甚至不是一个黑人，你是一个非洲人”   “我想如果人们看到这段录像，他们只会说：“哦，上帝，这真是太恐怖了”,然后继续他们的晚餐”"
看过,2016-07-09 08:55:50,4.0,0,希望更多人了解历史，并不是报以看热闹的心态。影片没有血淋淋的屠杀场面，而是用一个个手无寸铁民众的心里，来表现屠杀的场面。当你遇到困难多么希望，会有朋友伸出援手，如果没有你要独立承担灭顶之灾，心里的恐惧，绝望可想而知。在那一段时期，仿佛时间定格了，全世界都抛弃了那片黑土地
看过,2011-07-29 14:40:22,5.0,0,真正的历史不能被掩埋，只有看到真相，我们才能看到真实的自己，真正的人性
看过,2013-07-17 09:34:43,4.0,0,屠杀并不可怕，可怕的是对屠杀的漠视。事实上的卢旺达大屠杀比影像中更为残酷，保罗的人道主义情怀是令人敬佩的，但在大屠杀的洪流中仍显得是那样的无力。
看过,2013-12-03 12:22:19,2.0,0,几个高潮点，1两国总统同时被杀彻底引爆2只是接走外国人，同时又送来了孤儿们。卢旺达饭店的封闭空间。丈夫和妻子不是一个族人而是对立。在军阀 政治家 饭店董事中周旋。广播中不停的播报是很好的点。与辛德勒相比由于有他家庭描写的成分显得更加真实。他和家人最后还是去了原来的殖民地比利时。剧作
看过,2008-11-16 23:44:03,4.0,0,啥时候看的？New Haven？Netflix DVD？
看过,2013-05-08 20:35:57,5.0,0,感觸：1.三十年河東三十年河西，身在高位有可能反而粉身碎骨；2.人類有相輕的傳統，不論種族和文化；3.事不關己高高掛起
看过,2012-04-29 16:01:42,0,0,美国真是一个尴尬的国家，向有冲突的地区派兵，会被说成图谋不轨，争夺矿产。不派兵的话又会被指责对于屠杀视而不见，袖手旁观。不想想非洲人民手里的刀枪都是谁提供的，谁才是既得利益者！希望卢旺达地狱般的惨剧让无权力主动开枪的联合国吸取教训，起码维持短暂的和平，让大智慧的人有机会去化解仇恨
看过,2013-12-06 00:05:31,5.0,0,种族冲突引发的大屠杀总是让我们这些身处和平中的人感到无比的震颤。冲突与死亡面前的人性令人不忍直视。欲哭无泪的无助实在太残忍。上帝一定都在流泪。上帝一定对愚昧的人类感到悲哀。但是好在诸神常在，在舍弃自己拯救众生。无数次祈求世界和平，远离纷争。不要再有100万具尸体。\音乐很棒。
看过,2012-12-18 02:14:15,4.0,0,这不是一部我原先以为的文艺片，这是历史片。演员打动我，导演没有要赚观众眼泪的意思，不煽情，很真实。这部片看一遍就够了，因为我也是属于看到战争疾苦会说一句：“啊，好可怜啊！”，然后继续该干嘛干嘛的那类人。我不过是惭愧罢了，不想再惭愧第二次。
看过,2009-04-07 21:08:21,4.0,0,Why are people so cruel?Hatred... Insanity...
看过,2011-12-09 20:39:00,4.0,0,战争灾难，我们需要和平的世界。
看过,2009-09-04 01:01:48,4.0,0,比血腥和残暴更可怕的是冷漠与麻木
看过,2012-10-08 02:14:52,4.0,0,列維說，白人懷疑黑人是否為野獸的同時，黑人也在懷疑白人是不是神。有時候覺得人類真是愚昧的動物，觀眾眼中毫無差異的一群人，卻被局外人的一句判詞，何況原本就是殖民者利用少數民族統制多數民族慣用的伎倆，造就了胡圖與圖西數十年的相互屠戮，生靈何辜？既得利益者沒有切膚之痛時永遠事不關己。
看过,2012-12-13 08:24:29,0,0,#每晚一部电影#  积攒了太多不敢触碰的电影，下定决心要一部一部看下去了，虽然很累心，看完用了好久才平静下来，人性善恶交织极其复杂，但是究竟是怎么样的仇恨能让人们屠杀上百万人，种族在他们眼里到底是什么
看过,2016-07-25 23:45:57,5.0,1,当人性恶的一面被释放出来时，就如洪水决堤一发不可收拾。本是同根生的同种同族，拿起屠刀却毫不手软。卢旺达大屠杀发生在文明高度发达的当今社会是世界的一种巨大的悲哀，但是从历史长河的角度看，有大量清楚的事实去揭露这骇人的恐怖，让我们世人谨记，这又无疑是不幸中的万幸。愿丧钟永不再鸣！
看过,2014-02-17 21:55:14,5.0,0,人们会对着电视机说，天啊，好恐怖，然后继续享有晚餐！大雨中唱起的那首童谣戳中的泪点的原来不是我一个人。
看过,2009-01-30 00:30:10,4.0,0,总会有一个这样的人物，他们会尽全力挽救人类的那些可悲和那些可耻，他们叫辛德勒，他们叫卢斯赛伯吉纳。
看过,2009-02-18 12:58:02,5.0,0,种族间的矛盾个人的难以作为、忧虑。
看过,2012-12-01 14:12:38,4.0,0,面对这样的灾难，过多的言辞会是无力的，我们也许看完两小时的电影说，这太糟糕了，然后继续生活，但是我相信，这场灾难的反思会留在我们心中，让我们会不断成长，改变了自己，也就改变了世界。
看过,2013-08-29 16:47:15,5.0,0,你以為拍下的東西就會有人看，如此就有人關心這兒的情況？我想不，他們會邊看電視邊說：『天哪，那真恐怖！』然後繼續吃晚飯。
看过,2011-02-07 13:31:33,3.0,0,"我看完这部影片，我只会想说：“哦，上帝，这真是太恐怖了，战争太可怕.”,然后继续看我的电影。"
看过,2010-05-24 14:19:44,5.0,0,种族屠杀，多可笑又多现实的话题，我们要尊重每一个民族，我们要爱每一个民族，把自己的民族自豪感无限降低，就是对世界和平的最大贡献。片子一开始，靠鼻子宽度来分辨种族，更显示了种族本身就是一件并不是那么绝对的事儿。
看过,2010-01-08 21:08:05,5.0,0,很有辛德勒的名单的感觉，也是看着难受的电影，也是比较经典的！
看过,2010-11-29 00:36:07,4.0,0,一边是屠杀 一边是冷漠 你能说哪边更可怕吗？
看过,2009-08-11 21:42:27,4.0,0,"不要以为我们很安全，这个世界随时陷入集体的疯狂；
不要以为我们很危险，这个世界总会被那些善良拯救；"
看过,2012-09-12 15:18:47,3.0,0,“你以為拍下的東西就會有人看，如此就有人關心這兒的情況？我想不，他們會邊看電視邊說：‘天哪，那真恐怖！’然後繼續吃晚飯。”
看过,2010-07-16 13:13:23,4.0,0,谁会把印尼排华这样的事情拍成电影呢。。。！！！！
看过,2011-05-13 00:19:39,5.0,0,感谢你们拍下这些镜头，让全世界知道这里发生了什么。可是你知道河蟹这种力量比发生的这些事情更让人恐怖吗?
看过,2013-09-23 15:10:21,5.0,0,"《卢旺达饭店》说起卢旺达这个国家,脑海里浮现的只有两个词—大屠杀,难民营。但纵使你看到的的黑人种族的自相残杀,深层次根源还是在西方。本片称得上是<辛德勒的名单>非洲版,庇护便是拯救,对于这些活在炼狱中的人们,同情和怜悯都显得一文不值。唐钱德尔的精彩表演让我深深的喜欢上了他。"
看过,2012-01-09 23:12:45,3.0,0,如果《生命如歌》讲述的是逃亡的故事，那么此片就是在讲述捍卫和坚守——the oasis in desert.只是对于这个饭店本身刻画得还不够丰满。
看过,2013-07-05 20:23:37,5.0,0,通过饭店经理保罗在大屠杀中的经历，来纪念和反思人性中永恒的东西。虽然没有对大屠杀全景式的再现，却用深刻的心理描画使得观众的心灵受到同等的冲击。电影并非单纯的赞扬保罗，而是深沉的纪念普通人在灭绝人性的灾难中散发出的光辉，不仅仅是保罗。电影成功的做到了不忘记历史的目的.但这十年里，发
看过,2009-06-15 11:32:00,4.0,0,惨绝人寰的非洲，种族屠杀
看过,2009-04-30 14:11:29,5.0,0,"Africa, a place abandoned by God..."
看过,2012-08-10 18:51:48,5.0,0,族群之间的仇恨实在太可怕了，明明能亲如手足地生活，但是无知和贪婪却让彼此互相杀戮。主角简直跟神一样，实在太感人了。
看过,2009-02-06 23:42:37,4.0,0,很好的诠释了战争中的人性，有时候亲情，爱情，责任胜过了一切，甚至是生命。
看过,2011-09-24 21:39:38,5.0,0,我只願意做一隻擋在惡人屠殺生靈道路上的一只螞蟻
看过,2011-05-31 12:59:48,5.0,0,还能说些什么呢，静静的看吧，它会给你一些思考的！！！
看过,2016-07-21 19:04:34,5.0,0,卢旺达版[辛德勒的名单]，但保罗•卢斯赛伯吉纳遭受的危难和风险比辛德勒大不少。影片时刻让人揪心，沉痛感贯穿始终，片尾曲有情感升华作用。| “我认为如果人们看到这些录像，他们会说：‘噢，上帝，太恐怖了’，然后便继续享用他们的晚餐。“（9.0/10）
看过,2012-07-27 22:09:28,4.0,0,对不起，因为“天哪，那真恐怖！然後继续吃晚飯。”
看过,2011-10-29 11:17:33,5.0,0,民族的灾难只能由自己来终结，没有救世主
看过,2011-05-04 21:55:56,5.0,0,一部震撼心灵的经典电影！只求世间和平！拒绝战争！
看过,2011-04-20 17:23:14,5.0,0,几度落泪，为战争的罹难的人们。
看过,2011-11-19 01:15:01,4.0,2,非洲版《辛德勒的名单》，血腥的荼毒泯不去温暖的胸怀。当个体被世界遗忘时，一个人的良心就是和平。
看过,2011-08-25 07:23:40,5.0,0,又是种族屠杀，又是儿童，又是百万计条人命。这是一种苍凉，真实也是一种力量和呐喊。我相信辛德勒和保罗肯定是善良的白羊座，他们对无助的眼神是不会无动于衷的。片中童声响起，天使冲向了天堂，上帝却闭上了眼！
看过,2012-02-01 14:58:31,5.0,0,Oh my god，that's horrible.然后继续我们的晚餐
看过,2012-10-26 22:10:37,5.0,0,一部伟大的电影。非洲真乃最没有人性的洲。看完特别庆幸自己生活在天朝。但即便是地狱，你也能看到人性的光芒。世界上各地，各个民族，哪都有坏人，哪也都有好人。和平。
看过,2012-05-24 11:47:28,4.0,0,另一版本的辛德勒名单
看过,2012-02-02 23:54:28,4.0,0,当绝望恐惧与希望交织在一起， 心脏实在受不了。
看过,2014-01-29 14:16:45,5.0,0,沉重的电影，什么是胡图族？什么是图西族？是比利时人统治时期为了便于统治才区分的种族，就是看谁鼻子宽？谁个子高？一种令人可笑的政令，一个令人唏嘘的屠杀
看过,2013-07-20 23:39:19,4.0,0,2013-7-20 @尼积咖啡 和阿君一起看的电影。感动、残酷、几度看不下去。虽然比较辛德勒的名单还是差一些，已经很打动我。paul的坚持不放弃让我好难忘。
看过,2010-08-08 21:16:50,4.0,0,"当个人在生命与道义之间抉择时,不要轻言尊严有多重."
看过,2015-04-27 17:54:48,4.0,0,我们指着电视里的杀戮镜头说太恐怖了，然后便继续吃大餐。这是用金钱可以买来生命的地区，屠杀当前我们力求自保，凌驾于生命之上的任何政治行为都是荒谬的。确是“非洲辛德勒的名单”，技法不如前者，但于我比前者更能打动人。
看过,2012-12-31 20:32:27,4.0,0,millions voice那首曲配的真好...不过结尾开始唱的那段觉得整个电影的气氛都突然毁了................其实我在想最后他们那么开心的抱小孩的时候没有想想旁边那些没爹妈小孩的心情吗........而且谁尼玛想的翻译成饭店啊！饭你妹啊！！酒店啊！！简介也错的...
看过,2011-10-06 00:18:36,5.0,0,这应该是一部限制级的作品 因为其残忍与血腥程度不差于任何B级片 但愿这种写实的种族冲突能唤起国际人民尤其是发达国家民众的足够重视与关注 这个世界上不应该有被遗忘的角落
看过,2013-01-15 13:04:07,5.0,0,造物主最大的成就是创造了人类，而它最大的败笔是让人性中有罪恶的念头。屠杀是可怕的，而更可怕的，是对屠杀的漠视和纵容以及遗忘……片尾音乐响起，泪花依旧闪烁，我不禁又想起了Beyond的Amani:“权力与拥有的斗争，愚昧与偏见的争斗，若这两者争到最后怎会是和平？”
看过,2012-07-13 07:31:55,5.0,0,当我不想把一部电影当电影去评述时，它一定触动了我灵魂最深处的某样东西，当它能让我在人生最顺风顺水处动了想抛下一切去实践这份人生价值观塔尖的崇高理想时，我真的不想再去理会这是否是一个有编剧导演出品人的艺术作品。
看过,2011-10-12 11:55:00,4.0,0,一切灾难其实尚未发生 除非一切罪恶被镌刻成碑
看过,2009-10-07 01:07:55,5.0,0,非洲这块大陆的历史实在太多苦难了，我们在这跟日本，俄罗斯争二等公民，看犹太人和伊斯兰教徒的声张，非洲发生的事却是连句呼喊都听不到就消失在视线中了
看过,2011-07-22 16:56:00,0,0,生命在人性面前可以宝贵也可以随意作废····
看过,2011-02-13 15:41:34,5.0,0,如何去审视这个世界 这部影片值得一座小金人
看过,2011-09-18 16:34:41,4.0,0,非洲的辛德勒。那段传说中的音乐响起来的时候，飙泪啊。
看过,2010-06-26 17:26:57,4.0,0,没啥亮点，有点矫情。。。
看过,2008-12-14 21:41:50,3.0,0,冲击力不够，不知道为什么获奖，更多的是真实事件本身带给人们的触动，而不是电影。这让我想起前两天的梅兰芳，剧本和导演一般，靠现实中梅兰芳的影响力掩盖电影本身的缺陷。
看过,2012-11-19 14:33:24,5.0,1,中间和最后都哭死我，乱世之中没人可以独善其身，前提是如果你真是个人的话
看过,2011-03-20 11:43:47,4.0,1,仇恨永不停息，但坚韧总比它长
看过,2012-10-06 17:22:29,4.0,0,你以為拍下的東西就會有人看，如此就有人關心這兒的情況？我想不，他們會邊看電視邊說：『天哪，那真恐怖！』然後繼續吃晚飯。” 
看过,2013-08-01 16:23:27,5.0,0,终于看了这部电影，最难过是记者的一句话：观众会在晚餐时看到这个新闻说“哦多么残忍”，然后继续吃晚饭。 最可怕可悲的是冷漠和对残暴的不作为。
看过,2012-12-07 18:12:44,4.0,0,民族英雄么，我还是看不太出来这电影有什么好的？
看过,2013-10-19 14:14:27,4.0,0,足够好却没有打动我，说不出缺了什么。台词控：你以為拍下的東西就會有人看，如此就有人關心這兒的情況？我想不，他們會邊看電視邊說：『天哪，那真恐怖！』然後繼續吃晚飯。
看过,2009-11-30 07:03:31,4.0,0,在联合国人员撤退时。有一个镜头。车子里一个白种人抱着一只狗。这个时候突然发现。有些时候人连狗都不如！
看过,2014-01-16 23:02:52,4.0,0,题材取胜，但不知为什么我不喜欢看黑人的种族屠杀题材，喜欢看犹太人屠杀题材。题材值四星，就跟《熔炉》的题材本身就值五星一样，只要电影过得去就会感动一大批人。
看过,2012-02-13 18:22:01,5.0,0,“你以为拍下的东西就会有人看，如此就有人关心这儿的情況？我想不，他们会边看电视边说：『天哪，那真恐怖！』然后继续吃晚饭。”    
看过,2010-06-19 00:42:24,4.0,0,"作为大屠杀的十年之祭，作为一部向100万亡灵和人性基本尊严敬礼的影片，它也在诘问着：生命岂能贱于尘埃？！！
"
看过,2007-10-31 00:56:29,4.0,0,挺震撼的 以后不想多看此类题材了 让我忘掉世界的不好吧。。
看过,2012-10-19 22:46:11,5.0,1,我越来越相信人性本恶了。整部电影深深的悲凉感，那个国家没有希望了。
看过,2008-03-12 11:43:34,5.0,0,听到小天使们唱歌就哭了……
看过,2013-07-21 00:31:26,5.0,0,卢旺达的辛德勒的名单，更让人心悸的是半个世纪后还有如此惨绝人寰的人祸，汽车在维多利亚湖畔的尸横遍野上颤颤巍巍的前进后退，人心也随着像进了绞肉机，最崩溃的是牧师和嬷嬷带着孤儿们投奔西方军队才明白他们是来撤侨白人走黑人留，一个个白人与黑人生离死别的画面伴着童声合唱仿佛地域在人间。
看过,2012-06-10 18:11:07,5.0,0,无法停止的悲哀。人这么弱小，却这么复杂。
看过,2014-01-06 19:28:38,4.0,1,卢旺达版辛德勒，当个体被世界遗忘时，一个人的良心就是和平。
看过,2014-03-12 16:52:58,5.0,0,如果只能许一个愿望，那只能是希望世界和平；全片艺术性一般，也没特别讴歌谁批判什么，摄像机只是跟着paul视角，沿街走阿走，观察正发生的一切与人们的种种表情反应；现实是残酷的，paul做了他可以做的最多的事，而我们除了惋惜与同情，回过头一切如故。
看过,2010-05-31 23:35:47,4.0,0,拍的還是有些委婉了。大巴上的歐洲女人抱著狗的鏡頭很是諷刺，出現兩次【？】的兒童合唱很好聽很動人。這個世界真殘忍。還有。。。非洲英語是吐槽點= =
看过,2013-08-22 00:20:56,4.0,0,种族的敌视是最悲凉的人性的漠视~
看过,2011-05-27 09:58:40,5.0,0,神一样的配乐 眼泪不住往下掉
看过,2012-09-26 13:44:21,5.0,0,一百万，是死亡的数量，不论是宗教之分还是领土之争，都是自私狂妄之人发动战争的借口。喜欢看这些影片是为了让自己的内心得到触动，不该在庸俗的生活中活得太过安逸，世界还有战争，我们不该如此麻木
看过,2012-12-24 21:28:47,5.0,0,“你以為拍下的東西就會有人看，如此就有人關心這兒的情況？我想不，他們會邊看電視邊說：『天哪，那真恐怖！』然後繼續吃晚飯。”
看过,2013-12-29 23:14:36,5.0,0,5555555555555555555555555555555555555555555555555555555555555555555555555555555555QAQ
看过,2011-03-31 12:45:05,4.0,0,保罗犹如上帝般庇护这些难民，饭店犹如沙漠中的绿洲。这是一部传记类电影，记录了非洲种族仇杀，武装暴力，以及联合国无作为。希望了解历史的朋友可以看看，因为毫无娱乐性。
看过,2009-12-08 10:57:16,4.0,0,人性的種種，總能為這個世界帶來些許真實。
看过,2008-11-06 22:29:46,5.0,0,被屠戮的和被拯救的同在。历史翻开掩埋反复。世界另一端的悲哀。
看过,2009-12-25 16:01:31,5.0,0,这种电影看完就是一阵心酸啊..让我在去天津的高速公路上抱着笔记本看完的..下车都有点晕了..
看过,2015-02-25 20:56:24,5.0,0,影片的震撼人心之处在于反映了真实的历史，而且距离我们如此之近，本来同一个种族但是却在殖民者的简单区分之下互相仇杀，最为难忘的台词是，why not? We are half way there......主角以一种独特的方式保护自己的家人和同事，如此的勇敢。
看过,2014-01-18 18:57:59,3.0,1,可能是看惯了剧情奇妙、画面震撼的电影，纪录片般表现手法平铺直叙，即便内涵深刻发人深省，在我看来还是还是不足够的
看过,2014-01-05 23:23:26,5.0,0,当难民们坐车穿过被枪射击的胡图族民兵时 响起了恢弘的音乐 这种对比告诉我 其实任何的战争都没有赢家 战争也从来没有happy ending
看过,2012-06-20 12:07:28,4.0,0,同胞杀同胞的行为，实在让人匪夷所思，但在历史长河，又是比比皆是
看过,2009-11-02 08:21:04,4.0,0,"在来自巴勒斯坦的男人说完其家乡的境遇之后才想起来片里男记者说的话的意义
"
看过,2013-07-06 19:48:40,4.0,0,尽管我能感觉到大刀砍到身上那种声音，却感觉不到那种痛苦；就像我能感觉到恐怖，却感觉不到悲伤。
