看过,2014-01-03 23:01:12,4.0,0,不知道八十年代初的那些海上特效镜头是如何完成的，密封环境的氛围与经典惊悚片那种不大一样却窒息依旧，演技亦是非常出彩，镜头美学也恰好。只是剧情些许无力，结局些许无语。感觉收尾草草。
看过,2011-10-24 13:04:07,4.0,0,虽说已经和史诗很近了.............但这绝不是1941年底的德军....绝不是！！..........导演想 通过此片宣传反战的思想很重了，，，但是，，
看过,2014-08-31 19:35:47,3.0,0,看的三个小时版，我只是觉得折磨人，我觉得要是小说倒是会很有意思！
看过,2013-08-30 17:40:13,5.0,0,故事棒，运景，配乐神，演员出色，无可挑剔，就是时间略长
看过,2011-05-02 16:16:35,5.0,0,经典，确实经典。。这个导演剪辑版已经很不错了，如果是五小时版很有可能过于鸡肋
看过,2016-12-06 01:02:26,4.0,1,前面太沉闷了，看到英国人的货船，就想用鱼雷炸，看到英国人的驱逐舰就玩命的潜水，甩开英舰又浮出来，来来回回，折腾，拖沓。鱼雷真贵啊，一个就25K马克！高潮在最后几十分钟，好不容易从海底升上来，死里逃生，上岸了，又被炸死了，悲催，潜艇也沉了，这个作家命真大！
看过,2011-06-05 21:46:11,5.0,0,我看过的最优秀的一部战争片。
看过,2010-06-05 00:27:50,5.0,1,这艘潜艇命真苦 一苦接一苦 让人揪着心从头看到尾。。。
看过,2010-07-19 14:25:14,4.0,1,此片真是太写实了，终于看完了，好痛苦~
看过,2016-04-06 21:50:21,5.0,1,在逼仄狭窄幽暗封闭的空间里闪传腾挪293分钟，不是恐怖片胜似恐怖片。
看过,2016-06-10 11:02:16,4.0,0,看的是208分钟的版本，虽然对结尾有一定心理准备，但还是觉得很残酷
看过,2015-01-29 14:36:33,5.0,0,导剪版已撸 Das.Boot.-.Uncut.TV-Version.Disc1-2.1985.DUAL.COMPLETE.BLURAY-TRexHD-PTP
看过,2010-01-30 20:53:01,4.0,2,超长的战争经典，4小时52分钟
看过,2011-10-24 00:36:24,3.0,0,这个年代的感觉 三星可能不够客观
看过,2010-10-12 03:16:03,4.0,0,美丽人生的小孩肯定没看过这部片，坦克没什么好期待的
看过,2013-03-02 22:03:53,5.0,0,一部令导演不朽的作品，狭小空间里运转自如，故事舒缓有致，293分钟，太牛逼了，伟大的战争片
看过,2011-04-15 10:09:50,4.0,0,"让我犹豫在四星与五星之间的作品~ 
"
看过,2011-06-27 15:59:56,3.0,0,数次走神。非军事爱好者，比较无聊。什么封闭空间、压抑氛围、……一概没感觉到。结尾都死掉倒是挺宿命的
看过,2015-03-19 14:48:27,5.0,0,观众仿佛成为了潜艇中的一员，他们高兴，我们也兴高采烈；他们遭遇危险，我们也度日如年。最后他们赢得了海上的胜利，却输在了自己的家园上。悲剧···
看过,2010-07-18 22:04:16,5.0,0,5个小时，终于让我看完了。无愧最好的潜艇片。。
看过,2011-07-10 16:24:48,4.0,0,二战背景，德国潜艇，真实而又不真实，海底的感觉怎样呢？dark。历经万难，冲破重重险阻，一路走来，返回港口，却遭受出航以来最重的打击
看过,2010-11-13 16:16:25,4.0,0,人家只是想回家。。。太长了
看过,2012-03-02 14:19:04,4.0,0,从德国视角看潜艇战...
看过,2010-11-20 10:35:49,5.0,0,看的290分钟的版本。可以说是最细腻真实的潜艇片了吧。5小时的版本略显冗长，可能3个半小时的版本会比较紧凑点。
看过,2007-08-05 05:23:09,5.0,0,"4.5 stars. tension, realistic method. "
看过,2018-01-26 23:47:07,5.0,0,从纳粹德国的视点来展示海军潜艇士兵在二战期间的生存状态。底层士兵永远是战争最大的牺牲者，作为普通人的一面，他们有对死亡的恐惧，对亲人的思念和对家庭生活的向往。潜水仓内逼窘狭长的空间环境，运动镜头快速贯穿仓与仓之间造成的紧迫感，让影片在气氛和情绪营造上堪称一流，而结局更是出乎意料。
看过,2013-08-25 23:31:03,4.0,0,整部都很不错，尤其人物的刻画，但还是有立场的
看过,2013-05-29 01:40:18,5.0,0,为毛看过之后，觉得现在所谓大片神马的都是浮云。
看过,2008-05-24 21:20:24,5.0,0,背景：二战期间，1941年一艘德国U型潜艇的一次出航 | IMDb Top 250: #72
看过,2012-09-23 21:02:44,4.0,0,很平淡的故事情节，却扣人心弦！最后的结局真让人意想不到~
看过,2012-02-07 11:12:48,4.0,0,真的好长长长长长长长长啊！
看过,2011-03-28 21:32:42,5.0,0,外国人的战争片儿，中国那叫玩游戏
看过,2017-09-24 00:04:07,4.0,1,导演剪辑版，8.5分，纳粹视角的战争片，太长，稀释了大多数紧张压迫感，特效也过时，但结局太狠了，加1分
看过,2012-10-30 16:05:43,3.0,0,5小时导演最终剪辑版，我只能说真的好长啊
看过,2010-11-03 21:35:44,4.0,0,在战争片里算是比较独树一帜的。。。有空再去看看五小时完整版。。。
看过,2012-02-26 16:51:48,5.0,0,也许是描写德国U型潜艇最写实的一部电影了。有出航前的狂欢，有未遭遇目标前的焦急等待，有躲避敌人时的谨慎小心，有对敌作战时的激动，有遭遇险情时的濒临绝望。直到最后，回到港口，却又遭遇不测。战争不仅仅毁掉人的肉体，同样毁灭的是人在精神上的信念。
看过,2011-08-04 21:45:35,4.0,0,看的是导演剪辑版。整个片子冗长而压抑沉闷和黑暗。这是从另一个视角来看二战中的德国。也算的上是一部经典的影片。战争永远都是残酷的。
看过,2012-03-21 07:46:21,0,0,反正这部片当年我是没看完，班上有个男生居然看完了！三个小时诶！德语电影诶！固定的封闭场景诶！我果然是个没有毅力的人。
看过,2017-08-14 16:34:19,5.0,0,这才是战争真正的残酷与无情，对于大部分官兵而言，鲜活生命在无尽的等待、期盼中被与日消耗，才是恐怖的真理。密闭空间的守望和绝望，归国登陆后的喜悦与消陨，反差如此明显，才更觉得无常和冷酷啊。
看过,2012-05-26 19:14:23,5.0,1,可能是最好的潜艇片
看过,2012-09-08 13:57:04,5.0,1,战争有的，这部片里都有了。钦佩德国人的冷静与自省。这不仅是德国人的自省，更是人类对战争的反省。战争中没有胜利者，赢的只有战争本身。强力推荐，不容错过的传世之作。
看过,2012-04-16 23:45:34,5.0,0,从u571里可以看到很多此片的影子 作为现代潜艇片的鼻祖 他的伟大或许不止是前无古人 恐怕更是后无来者了。
看过,2010-10-18 00:20:57,5.0,0,太精彩了！！3个半小时，真过瘾@@
看过,2016-12-11 16:34:28,5.0,0,"与“突突突”直接死亡的表现战争残酷方式相反。本片通过表现军人们在潜艇里面枯燥重复艰苦危险的日常生活，从另外的角度表现了战争的残酷。
前一种如果是动态的，这一种可以算是静态的。"
看过,2011-12-30 04:59:45,5.0,0,绝对的潜艇战经典影片。。。估计无法超越了
看过,2014-11-09 00:27:41,5.0,0,从德军角度诠释二战的影片。平实收敛、深沉动人。在战争面前每个人都是那么无力，无论如何抗争都逃脱不了命运冰冷沉重的一击。
看过,2013-11-22 12:05:52,4.0,0,比八股文和好莱坞大片来得真实。潜艇真不容易，那么小一个罐子里塞几十号人，当年条件比现在还差，U艇依旧英勇地和英美海军展开远洋争夺战。
看过,2010-12-26 20:00:23,3.0,0,最后潜艇真正浮起来的时候，还是蛮开心的……
看过,2013-11-05 23:52:42,4.0,0,结尾的20分钟提供了两次情绪转折，第一次是属于好莱坞的英雄主义的，第二次是暗合了理想中历史的发展规律的。所以这部3个半小时一直聚焦于纳粹海军的电影才能受到奥斯卡的青睐。当然，它在船舱之内的各种气氛营造和技术支持确实也很牛。
看过,2010-01-19 15:54:58,5.0,0,Uncut 293min
看过,2007-09-02 12:44:21,3.0,1,沉闷冗长，还不如看U571
看过,2014-03-16 21:58:55,4.0,0,我看的是三个多小时的导演剪辑版，觉得就够长了，没想到个还5个小时的未剪辑版。
看过,2011-10-05 21:35:56,5.0,0,影片结尾，U潜艇没有沉没在直布罗陀的海底，历经千辛万苦抵达军港，却遭空袭击沉，这是一种宿命，不是靠一两个人的果敢、冷静能够挽回的，这不是黑色幽默，也不是冷笑话，这是悲剧！
看过,2010-01-15 01:50:44,5.0,0,史上最好的潜艇电影，没有之一
看过,2015-07-10 10:29:03,4.0,0,这样的结局，就是《地心引力》的另一面，但并不仅仅是为了反类型片。那支可恢弘可悲怆的调子，我该会有好长一阵子不会忘了。
看过,2012-02-01 22:38:25,3.0,0,如果到他们返航结束后，不来那么段轰炸，还可以给四颗星，来了那个轰炸，感觉前面的一切都没了意义
看过,2015-04-29 14:10:08,5.0,0,https://movie.douban.com/review/7458382/
看过,2010-05-20 01:32:38,2.0,0,老电影的悲哀。
看过,2012-11-28 22:27:27,5.0,0,非常精彩，男人味十足，德国人恐惧下的理智和冷静，英德军事较量时的心理较量，海洋、夕阳、风暴，残酷的美在这一切中诞生！
看过,2008-04-24 12:44:00,5.0,0,好像是我看过的最长的电影
看过,2013-12-27 07:05:50,4.0,0,战争是残酷的，任何鼓吹战争的军国主义者、大国沙文主义者、独裁者、某些无耻文人都应该受到军事法庭的审判！认识真实的世界除了有一个有判断力的好脑子以外，多听听处于社会机器运转核心位置上肩负“责任”的人的感悟，这才是靠谱人生！
看过,2011-10-23 01:48:10,5.0,0,最讽刺的莫过于千辛万苦躲过了敌人的攻击，最后却沉在了自家的港口。
看过,2014-03-31 12:57:22,3.0,0,回程时再照照片，获奖最多的是酒鬼。类似狙击这种让观众屏气凝神的。回港沉没。
看过,2013-01-30 07:21:27,5.0,0,一个花了三个小时来描述如何威武的海军被空军三分钟击败的故事
看过,2011-06-08 14:45:52,3.0,0,真正的经历大风大浪，却在阴沟里翻船。影片太长了，压缩到2小时左右会好些。
看过,2012-08-14 21:32:30,5.0,1,将近四个小时后，我妈对我说：当初没让你上海军舰艇学校是正确的。╮(╯_╰)╭我以为她要说过于危险。她目不斜视的看着屏幕说：你一顿就会吃掉舰上两三人的伙食，大副会气死了·········我已无力吐槽，只有面壁的份儿了。
看过,2010-12-18 00:17:01,5.0,0,虽电影《从海底出击》有3个半小时，却并不无聊。整个故事都围绕一个狭窄的潜艇舱叙述，它们期盼着敌舰来打发无聊的潜艇生活，而真正面对战争时又显得那么的恐惧，但每个人依然勇敢顽强的战斗。凭借着意志煎熬得以重生，却消逝在荣归的港口。影片没有华丽的战斗，却是更真实的战争刻画。
看过,2010-11-18 20:35:20,4.0,0,我个人的感觉是没有猎杀U571紧凑。
看过,2008-01-28 14:56:04,4.0,1,配乐很像Rammstein的mein Herz brennt~~
看过,2011-12-20 10:06:51,5.0,1,这部影片对人性的刻画，达到了其他影片难以超越的高度，什么叫“叶公好龙”、“听天由命”？“存在”与“活着”的差别在哪里？本片会叫你领教这些。在大自然的生存法则面前，人都不过是一群可怜虫而已。
看过,2012-11-13 21:48:12,5.0,1,如此真实又带感的反战片，而非卖特效的战争片，让人体验到了生与死的搏斗，男人的勇气与担当，原声很棒，结尾经典。
看过,2012-10-07 18:42:25,5.0,0,以U-96上的德军为视点，从人性上讲述战争对人的影响。几乎都发生在潜艇的封闭空间，但是由于节奏的高超把握以及剧情设置的精准，纵然是近四小时（导演剪辑最终版应该是5小时）的影片长度，也并不会觉得乏味。相反此片实在精彩。之后要观摩下五小时版本。
看过,2011-10-19 10:36:17,4.0,1,德国最好的战争片！！
看过,2011-07-06 09:36:42,4.0,0,"没点体力还真看不完, 真实, 但故事不出彩"
看过,2011-07-29 15:10:51,4.0,0,配乐、最后的空袭镜头以及整个寓言式的结尾都颇为精彩。德版蓝光。四星半。
看过,2013-12-27 12:39:23,5.0,0,战争片经典中的经典。战争中没有幸存者。
看过,2016-10-12 14:23:58,5.0,1,没有战争场面的宏大调度，一艘潜艇，一群士兵的出生入死，狭小污浊空间里身体和心理的双重折磨，无助，孤独，和绝望，人格和意志的伟大坚守，但战争的残酷性在于躲的过惊涛骇浪里的千难万险，却躲不过凯旋声里的“温柔一刀”。
看过,2012-04-02 16:55:12,5.0,0,真实，郁闷，三小时版本
看过,2014-03-16 18:23:00,5.0,0,缜密，严谨，冷酷，悲凉，绝望到家，从出征开始到最后的下沉，希望只是绝望的插曲，改变不了最后的毁灭。战争的残酷，人只是战争中的一个元素，随时被毁灭。男人的坚韧不拔和坚强意志一直带领大家前进。
看过,2013-08-08 20:18:07,3.0,0,真实的战争，简单粗暴而又沉重的结局。
看过,2012-03-17 02:38:08,5.0,0,"潜水艇日志，历经无数磨难确倒在了家门口。
ps：5个小时，观影第一长片"
看过,2011-01-30 02:03:58,5.0,0,深水炸弹根本就是纸老虎。。。德国造的潜艇要多结实啊
看过,2011-11-20 12:33:18,5.0,0,"小时候在正大剧场看过一次,现在又再看了一次.震撼不比当年差"
看过,2013-11-12 20:44:43,5.0,0,这部电影还是不错的，一口气看完也不觉得累，而且看的津津有味，也只有外国人才能拍出来
看过,2012-08-04 15:11:06,4.0,0,最富盛名的潜艇电影。
看过,2013-03-24 16:45:21,4.0,0,3个小时的片，结尾为什么被飞机击沉？
看过,2014-02-27 19:46:05,5.0,0,本片从二战中非正义的一方讲述，德潜艇入海，遇风暴，战敌舰，硬闯死亡峡谷，惊险伴随渐升的水压喷薄，人性的光辉在希望的强撑下闪耀，然光明来临之时，却也是黑暗笼罩的一刻，战争的残酷，不分敌我，希望化为失望，一切美好黯然无光，这该是多么严厉的讽刺！
看过,2015-05-21 07:31:02,4.0,0,看的3个半小时导演剪辑版。作为女观众有点看不进去，影片惊悚效果做的很好，反战观点也很明确。战争是艰苦、枯燥、残忍的，战士随时站立于生死边缘，无论你是侵略方还是被侵略方。最终法西斯主义如潜艇沉没，带着那些邪恶、固执、愚忠一同灭亡。
看过,2014-08-26 12:48:53,5.0,1,五个小时，看过的最长的电影，没有一分钟的不耐烦。
看过,2012-11-17 23:44:06,0,0,没法打分，因为看到一个小时的时候我就睡着了╮(╯▽╰)╭既然是男人片子，对不起，看不下去了，因为我是妹纸╭￣3￣
看过,2006-05-28 19:22:23,5.0,0,看一半睡着了。。。
看过,2012-05-24 20:35:06,4.0,0,回顾经典电影中。。。
看过,2015-01-07 21:48:36,5.0,0,看了两天终于看完了216分钟的导演剪辑版，不敢想象看完整版是什么心情。漫长是肯定的，因为难得有这么长时的电影作品，不过情节真的惊心动魄，男人关于成长和责任的态度的场面描写很多也很壮观。看得人心情沉重，最后潜艇浮起的时候所有船员还有观众都欢呼了，在绝望中寻求希望就是这样酣畅淋漓的感觉
看过,2014-07-18 05:22:51,3.0,0,293分钟的片长只能拿来当电视剧看了。开头部分吐槽片，全体人员各种不满。中间部分折磨片，水下生活各种苦闷。最后才是高潮。拍得挺单调的各种开小差
看过,2013-03-07 13:20:57,4.0,0,你千方百计想离开那个阴暗逼仄的潜水艇，离开你最能保护自己生命的地方。一一离开，就那么容易地死掉，之前展现出来的所有英雄史诗般的壮阔都变成了一滩污泥。
看过,2014-04-12 16:04:34,5.0,0,逐乎于水，没归于土，终无着处。p.s.:209分版本。
看过,2013-08-03 16:25:43,5.0,0,真实的战争。我就知道最后还得沉没。
看过,2009-05-01 20:11:05,5.0,0,确实很赞，虽然对我来说它太长了
看过,2010-12-26 06:59:33,5.0,0,"虽然是三十年前的电影了,看着却很震撼."
看过,2016-05-28 14:47:23,5.0,0,这是一部太经典的战争片。写实冷静，很少掺杂个人色彩。长篇幅如实描写，代入感极强。一艘远洋的潜艇，所有人的命运就寄在这薄薄一层防护甲上。驱逐舰的追杀过程，让我们和船员们一样心惊胆颤。它如此抓住战争的精髓，枯燥、艰苦、做出自己并不喜欢的生死抉择。到头来又是为了什么的冥思。
