看过,2010-06-24 02:43:41,4.0,0,没有黑泽明另外几部那么有感觉
看过,2015-05-04 11:43:11,5.0,0,黑泽明的巅峰之作，艺术性典范，对此后的其他电影大师影响深远！
看过,2012-07-09 20:15:22,5.0,0,“山，已经倒了。武田家完了。”
看过,2013-12-07 16:22:36,4.0,0,看得出，服饰、盔甲、器具考究，场面宏大，对色彩用到极致，画面华丽之极。“风、林、火、山”武田信玄的替身影子武士的故事。
看过,2011-12-05 19:16:33,5.0,0,这部是黑泽明第一部彩色电影，色彩绚丽让人惊叹，特别在影武者信玄梦境中那段。整部片从情节到演员表演都很抓人。
看过,2013-07-13 21:19:10,4.0,0,人生一梦五十年，猛士豪侠思暮年。风林火山依旧在，奈何山倒败如焉。
看过,2009-12-26 03:22:25,4.0,0,角度不错，色彩绚丽，谱儿摆得有模有样的
看过,2010-09-02 16:28:10,4.0,0,作为80年的片子 非常不错
看过,2011-03-28 12:01:31,5.0,0,嘖嘖，同樣是三個小時，有起有伏有高潮才算是電影吧！不過啊，結尾戰敗的場景忒長了也……
看过,2008-09-03 17:11:17,3.0,0,这是我看过黑泽明的电影当中，最无趣的一部。
看过,2017-06-13 12:04:30,5.0,0,电影，场面、光线、剧情、服装、道具都顶配版，就是鬼子的思维——就那么轴！
看过,2006-08-05 16:00:39,3.0,0,★★★☆ [CCTV] 挺早看得了，好像不是很喜欢。
看过,2011-04-14 09:50:51,5.0,0,一个家族的灭亡，乱世，成败原来只在一线之间。
看过,2010-07-30 22:33:11,5.0,0,像仲代达矢这样的演员真不多
看过,2014-06-30 17:20:58,4.0,0,小黑啊，不这么墨迹就是五星了。演技真麻痹牛X，看看国产，都是一群装逼的站位，演狗是狗演B是B，高。还有，真的不招新的小妾来几发么。
看过,2017-02-24 10:14:03,4.0,0,用三个小时去塑造一个死去的人，牛逼了，偏冗长，特别是最后的结局，太长了，张力不足，前面还是很好看的
看过,2013-07-05 16:55:44,5.0,0,黑泽明为世界展示的是日本电影与日本文化的深度和宽度，同时也表达出自己深刻的情怀和认知。在战争场面的拍摄极具史诗气质，宛如一道凄凉的风景，完爆许多中国片靠特效和群架堆砌出来的所谓战争。不过三个小时版的看完真心累倒是……
看过,2011-01-17 11:52:51,5.0,0,偉大! 偉大! 天才! 天才! 天才導演的偉大之作! 這才是電影啊!
看过,2017-04-17 15:25:53,5.0,0,最省钱的大场面电影，相比某张的千军万马人海战的电影可要省钱多了，但是塑造的紧张激烈的战争氛围确有过之而无不及，还有演员的演技简直都太神了，不懂日本过去的历史，光记人名都有些吃力，开头看的晕晕的，越后来越精彩，另外最好配合弹幕看，有些弹幕太好笑了。
看过,2013-02-05 13:01:58,5.0,0,庄重，悲壮，简洁，利落，形式感强，语言贫乏如我，也只好找一串形容词来形容我的观后感。一直在思考什么是好电影，<影武者>算是一个很好的范例。黑泽明的电影给人的感觉是什么？——疾如风，徐如林，侵略如火，不动如山。
看过,2017-10-27 21:05:00,5.0,1,这部经典之作，每个人都有自己的看法与关注点。这部电影关于山寨的探讨，在我看来十分精妙。山寨的好坏，在于它是否对进步发展产生正面意义。
看过,2010-09-01 09:24:58,5.0,0,20100901 3rd
看过,2010-08-24 16:47:38,5.0,0,火枪的出现终结了冷兵器时代，但无法终结武士的精神。
看过,2017-03-29 17:11:03,5.0,0,战争史诗、一个家族的覆灭、一个历史大悲剧。武田信玄对织田信长和德川家康的那场长筱合战的象征化，冷兵器对热兵器，旧的势力与新兴的势力，黑泽明用来象征逝去的时代和武士道精神。风火林的覆灭和山的动摇。电影通过一个影武者的角度去看个人与时代，这种衰落特别感人。大师作品。
看过,2012-06-19 08:21:20,5.0,0,似乎有bug
看过,2010-10-07 02:30:32,5.0,0,很耐看，超级棒的视听语言
看过,2012-10-07 16:24:00,3.0,0,本尊在，影子才会在。山动了，就要灭。洋人传教士医生这个时候竟然就开始进入日本了。为之后的殖民打下基础。
看过,2010-11-05 09:58:14,4.0,0,不管任何国家，对于那种光荣赴死的人总是很感动
看过,2010-05-09 19:46:14,3.0,0,不知道我是不是把这电影当成了今天的电影来看。好几次我都忍不住想睡觉。
看过,2011-05-28 03:05:55,5.0,0,我居然对里面的人物事件不模糊。我真是个历史盲。这是一部神奇的电影。好拉轰的战争比那些四维三D给力多了～看完这部电影我越发觉得我要了解日本战国文化～我靠～有没有出息联内战都搞不清楚的人居然去了解日本战国～～
看过,2015-05-14 21:56:23,5.0,0,战争的史诗 ，格局之大超出想象；人物刻画细腻，影武者的神态描写更是淋漓尽致
看过,2009-04-18 15:35:18,3.0,0,"我看不懂黑泽明。。。。无论是影武者还是罗生门。。。好吧我放弃了。。。
"
看过,2009-02-02 14:39:38,5.0,0,比《乱》好看，剪影式的战争场面很强大
看过,2016-11-26 16:10:21,5.0,0,有一种获得权力的方式，是你长得很像某人，或者被赋予和某人的接近性。但注定不能长久。纷繁的历史找一个小切入点来拍很有意思，我们的三国为什么就只拍出了《赤壁》…
看过,2011-12-30 00:33:21,4.0,0,疾如风，徐如林，侵掠如火，不动如山
看过,2016-05-22 20:51:48,3.0,1,场面确实很宏大，问题是拍的太拖沓，一个叙事场面起码3分钟，造成整片太闷太漫长
看过,2012-07-09 15:35:29,3.0,0,看完本片就一个想法，黑泽明导演当时一定非常非常费钱。
看过,2015-11-22 00:44:01,3.0,0,太长了 关于影子的题材还是海女和世奇里影子武士的短片表现更深刻 这电影只在场景美术上表现不错 没有更深刻的价值
看过,2017-09-05 09:03:20,5.0,0,没有三船敏郎，仲代达矢才得以放出光芒。。。为残酷结局痛惜的同时，也感受到深深的宿命感。。。
看过,2011-05-10 11:06:50,4.0,0,味道正，舞台感十足，风林火山，只是最后战败镜头太长了
看过,2012-12-01 21:15:39,4.0,0,故事虽是虚构的，却如同真的再现了每个人物的特点；战争的场面，尤其气势逼人，也是黑泽明大师的拿手之处。
看过,2011-11-12 20:01:39,4.0,0,叫我明白 不动如山 的力量的电影 其实不反感那时电影缓缓展开由窄入宽的模式的 但结尾处吧镜头确实有点狗血
看过,2012-03-26 22:22:52,4.0,0,画面色彩极赞，描绘战争的剪影与逆光的暖调，开场真身信玄后那个轮廓清晰的影子。武田军的长矛和骑兵被火枪队击败也隐射黑泽明自身旧的传统不被认可。主题更是站到了黑泽明早期作品的反面，不承认个人主义，影武者丢掉反抗与个人价值并为家族牺牲的过程，或许是黑泽明五年不能拍片，低谷中的反思与变化
看过,2017-06-06 22:00:35,0,0,张艺谋一定没少看黑泽明
看过,2011-04-21 01:11:38,5.0,0,我的心里，也在编织一个不同于桑原水菜的暗战国，有暴烈的爱和血泪牺牲。
看过,2011-06-11 17:10:18,4.0,0,还是最喜欢七武士
看过,2012-08-14 22:37:58,4.0,0,仲代的表情总是让我想笑啊。。。电影里有句字幕“那替身怎么办！”加大加红，被吓了一跳。
看过,2013-04-28 12:58:18,5.0,0,3个小时的电影，不知不觉很快就流淌过去。PS，确实对于很多学电影的人来讲是教科书一般的电影。
看过,2010-02-09 14:04:15,4.0,0,疾如风，徐如林，侵略如火，不动如山 
看过,2015-05-09 14:22:34,5.0,0,一部为《乱》预演的厚重史诗之作。片中大片阴郁的色彩让人印象深刻，看黑泽的电影总是感叹他对于视觉艺术的领悟和电影语言、构图的本能真是登峰造极。仲代达矢演的几乎完美，但我暗自想换做当年的三船话，不知会如何~~
看过,2018-02-10 16:08:16,5.0,0,充满仪式感和悲壮感的武士电影。对日本历史向来不太了解，此片成功地激起了我对日本战国历史的好奇心~依然很佩服黑泽明的色彩美学，场景调度和对人物形象的塑造。最后的战场戏是我看过的战争电影里最震撼的，虽然没有直接呈现激烈的战斗场面，但是通过配乐、枪声和战败后的长镜头达到更好的烘托效果。
看过,2012-02-10 18:37:44,5.0,0,おヤま向おやがださま致敬的一部片子，确实很长，因为一个娓娓道来的故事，是不能概括成只言片语的
看过,2017-05-22 22:35:54,5.0,0,怎么可能没看过 影武者？！
看过,2011-08-15 21:15:11,4.0,0,不知不覺就看完了 中間夢中那段很浮世繪風不是嘛美感十足 
看过,2018-02-21 11:33:30,5.0,0,"感覺真的是放了他跟他哥哥的故事進去，還是印證了所有故事都必須跟作者本人有密切連繫才能成立。
而開放性的描述戰國令人充滿想像，每個觀眾都能自己下定義，包括我。
看的時候忍不住想如果是三船來演會怎樣，想了一下覺得仲代達矢好像還是比較適合。"
看过,2016-08-29 15:33:07,5.0,0,影子依附本体而生当本体没了，影子的存在也就没了意义，片子末尾已经被放逐出去的影子武士捡起长矛在一堆尸体中间冲向敌人，壮烈无比，他的归宿大概也只能是这样了吧。
看过,2015-06-25 17:07:54,3.0,0,枯燥 乏味 拖沓 一如既往的讨厌黑泽明 仲代达矢好好的一个大帅哥 硬是被弄成了老妖怪
看过,2010-10-23 13:38:28,5.0,0,所谓的武田家族帝国只是一个一戳即灭的幻影罢了，它早就沦为一座机器，无休止的运作，对其他一切都漠不关心。而这之间所抹杀掉的人性，却早已不可挽回了。
看过,2011-05-25 20:59:15,5.0,0,"一个聪明人最可怜最可悲的是与一个比自己更聪明强大的人为敌
他败给的是时代"
看过,2016-01-30 20:11:42,4.0,0,形式与表演出彩。影武士在水中叩拜（武田附体），草丛中呐喊（武田悲悯），水中死亡（武田离去）
看过,2017-09-01 18:55:57,5.0,0,没有了英雄，只剩下悲壮，因为影子武士只是本尊的影子，做英雄的替身，并不意味着真能成为英雄，你所有的关于力挽狂澜的期盼最终只能沦为一声为之扼腕的叹息，武士阶级的梦幻泡沫一触即破，一人亡，则一朝衰。
看过,2013-10-07 11:40:44,5.0,0,仲代达矢真神人也。黑泽明真男人。
看过,2011-03-21 19:49:48,5.0,0,最后那场长蓧之战，其艺术水准之高，大写意的情绪之臻入化境，古装战争场面而具有非凡感染力的，世间几无人能出其右。
看过,2016-03-13 21:44:01,4.0,0,开场长达六分钟的固定机位长镜头堪称大巧若拙，后面紧跟着一组12个高速奔跑移动镜头，全都是牵一发而动全身的场景调度，其中一个镜头还用了长焦镜头来增强动感，前后一张一弛，对比强烈，展现出极大的镜语张力。后面两个战争场面影武者和武田胜赖身后战旗上字一直是反着的，也象征着他们“镜”的身份。
看过,2010-07-30 16:12:03,4.0,0,最震撼的地方还是影武者被驱逐的场景吧。虽然主角是武田家，但还是欣赏信长殿哇，那段人间五十年唱的啧啧。。还有一点惊奇，《太阁4》的人设造型简直是向本片致敬的说。
看过,2013-11-02 21:17:52,4.0,0,记得以前就已经看过这部片子，今天倒是完完整整地看了一遍。我倒是很好奇，如果影武者能够一直都小心翼翼地扮演下去，不出纰漏，然后隐居再安然传位给胜赖或者信胜，历史会怎样。。。
看过,2010-05-25 14:51:46,5.0,0,看了之后很难过很难过很难过，因为大义，因为各种人物的大义，所以明白每一个人物的心情。每一秒都会觉得受到感触。
看过,2008-01-22 23:54:45,5.0,1,替身 身份  1.16G
看过,2012-03-01 22:25:14,4.0,0,信玄自己也动了啊...
看过,2006-12-07 23:00:46,5.0,0,音乐极其出色。一部缓慢叙述但凝重的史诗。没错，这就是日本人拍出来的史诗片。中国人什么时候能有一部自己的像样的史诗片？
看过,2012-09-03 23:39:10,5.0,0,在战国时期金戈铁马的厚重怆凉背景下，一个影武士矛盾奔突的细腻内心世界无可抑制的流淌出来，我是谁？
看过,2016-07-31 23:36:41,5.0,0,剖开乱的莎翁情怀，影武者跟乱完全就是伯仲之间，虽然我觉得日本的几个大名水平不过如此，但是黑泽明导演的表现真是让人感到艺术顶端带来的赏心悦目
看过,2011-06-01 09:30:43,4.0,0,终于是 忘记了自己
看过,2008-11-25 06:54:03,5.0,0,没有了本尊，影子也就没有意义
看过,2017-06-28 08:55:35,3.0,0,个人认为这部电影在黑泽明的作品当中算不得顶级优秀，跟七武士和罗生门差的很多，而且最主要的是黑泽明式的哲学思考在电影中并没体现出来，从这点来说甚至不如那部披着日本外衣的莎翁悲剧《乱》
看过,2008-05-02 12:35:54,4.0,0,不如《乱》啊！
看过,2014-06-02 23:12:53,4.0,1,梦境比《梦》还惊艳。黑泽明真是导演界色彩感最好的大导。
看过,2011-10-06 23:05:16,5.0,0,其疾如风，其徐如林，侵掠如火，不动如山
看过,2018-02-08 23:29:02,5.0,0,慢慢慢的片子，不知道自己怎么坚持下来的，也不知道为什么好多年过去了，还是记得很清楚... ...也许这就是黑泽明的魅力吧
看过,2010-03-26 19:46:33,5.0,0,很感人的电影 
看过,2009-04-12 12:09:07,4.0,0,节奏缓慢的大气。。。我喜欢那厮的小聪明
看过,2012-06-07 06:44:02,4.0,0,太文艺了……难以欣赏
看过,2007-07-09 14:44:29,5.0,0,人的威严小于微笑。
看过,2016-02-10 01:46:36,4.0,0,在那个黄昏，薄暮飘移，将军的本阵显露山头；跟着一夜恶战，左左右右敌踪不断，身边的武士逐个仆倒；待敌将被惊走，手下纷纷扰扰之际，将军断喝不动如山，便当哥的change完成(2/3点)。可惜冗长。可惜最后的大战，有风林火山却气势不足。钱不够么。10年后的天与地，有场面却再无意境，沦落成团体操了
看过,2008-12-18 20:32:34,3.0,0,——人性，“服从”还是“选择”
看过,2010-02-01 09:37:14,4.0,0,一部没有呈现剑术的武士电影。道尽了小人物的喜怒哀乐。又及，原来风林火山不是风魔小次郎的刀……
看过,2005-12-16 17:05:18,3.0,0,大二看的很“认真”的黑泽明作品。ps：打三星纯粹是因为年代久远……
看过,2015-07-04 23:56:39,5.0,1,这种史诗类电影拍成这样，其迷人之处皆在余韵。故事流动冷静而克制，镜头也多是阔大恢宏。最后一幕，将故事无限拉长。黑泽明在里面野心不小，影武者，虚假被安放于真实的位置上，最终与真实牵连。
看过,2011-04-30 15:43:06,5.0,0,"疾如風,靜如林,烈如火,定如山."
看过,2018-02-24 20:47:14,1.0,0,从来不喜欢黑泽明导演的作品，尽管他的电影评分很高，依然难以抵挡我的睡意。他们的发型真丑，还不如剃光了呢。那个年代的枪上弹速度、射速慢，精度低，射程近，不能连发，没有夜视瞄具，但是适合防守。用这样的武器在黑夜还能打中目标太厉害了。为什么没有血缘关系的人会长得这么像？为什么女人没眉毛
看过,2009-09-09 15:41:53,4.0,0,"难得能被历史剧感动,而且还是日本的电影...  黑泽明的人物一向个性独特,让人记忆犹新..."
看过,2017-08-13 12:49:51,5.0,0,分三次看完，也是服了我自己了，最近培训天天熬夜，不好过呀
看过,2010-12-18 19:13:24,5.0,0,果然深谙《孙子兵法》啊
看过,2010-09-13 16:32:36,4.0,0,黑泽明的电影总是这么“字正腔圆”
看过,2013-03-02 20:03:42,5.0,0,金棕榈大奖！片子历史厚重感十足，五星
看过,2016-08-22 15:42:44,4.0,0,总体来说无什么大bug，就是有点拖沓~人物的塑造还是挺深刻，全篇基调偏悲剧。影子武士最开始出场的时候，镜头较远，看不清，近了才发现这个人骨子里是个悲剧人物，被人利用却投入真感情~
看过,2013-03-18 00:07:33,5.0,0,武田胜赖这个傻逼！！！！！！！！！！！！
看过,2013-11-30 23:11:32,5.0,0,不间断的看三小时完全没有审美疲劳  黑泽明在艺术与商业中把握的恰到好处 黑泽明吃透了日本的国民性 大道无形的融合在角色上  日本人的羞耻感以及忠君意识在每个角色上都表现得淋漓尽致 话剧性的舞台设计 大偏色摄影 武田家在无领袖下可以说是被日式精神推动着向前迈进的 影子武士身上的国民性彰显无遗
看过,2017-05-29 14:16:14,4.0,0,可惜当时的特技水平做不到，马中枪的镜头，这部分的缺失，对于战争的残酷表达还是不够，但可以导演在很努力地拍摄了，万马奔腾，有感于马匹的优良品种，日本人养马也到了工匠精神的境界么？
看过,2012-05-25 23:05:52,4.0,1,镜头和色彩运用炉火纯青，乱世中狰狞显得力道十足  黑泽明的电影也只有黑泽明才能超越自己。
