看过,2012-02-08 02:31:56,4.0,54,兵帅妞儿靓哭的时候都得露个沟主旋律这么拍才有人看
看过,2007-05-16 00:55:37,3.0,64,护士姐姐爱难民～美国大兵作肉盾
看过,2017-03-25 13:38:25,3.0,42,许多惨绝人寰的事情之所以会发生，是因为善良人们的不作为。
看过,2017-03-25 13:35:12,4.0,29,人道主义的胜利，整体还是紧张刺激的，女主表现不错。但可以拍得更好。
看过,2008-07-28 16:00:39,1.0,57,医生是个瓜的
看过,2017-03-26 10:40:15,1.0,21,越来越讨厌这种美国英雄主义，而事实是美国为了维护自己世界第一的地位到处散播恐怖。
看过,2010-08-14 18:30:38,3.0,21,我就喜欢看我家威利斯扮演上帝时一副沉醉的样子
看过,2017-03-25 01:39:51,4.0,21,"还不错的电影
值得观看"
看过,2017-03-25 19:56:52,3.0,18,血腥的战争 种族间肆意杀戮 和美国式英雄主义 明显的主角光环 有些地方过分煽情了
看过,2017-03-26 08:10:08,3.0,7,起初欠缺了最重要的動機：一個崇高，能打動人，讓海豹部隊願意奮勇執行任務的動機。 這次，海豹部隊，有明確的目標，有強而有能力的領導者，也有一個拯救村民的崇高使命責任。即使寡不敵眾，但最後成功了。
看过,2017-03-25 17:11:03,3.0,23,不是很好看，没感觉
看过,2017-09-02 22:35:30,3.0,11,战狼2美帝版故事原型。
看过,2017-03-25 09:54:40,4.0,16,美国的英雄主义
看过,2017-03-25 15:12:00,4.0,16,愤怒无法解决任何问题。在一切面前，生命往往大过一切
看过,2017-03-25 17:15:51,4.0,18,一般吧，三星给女神，太美了
看过,2017-03-25 12:14:11,3.0,12,还行吧，能看的进去，比较喜欢女主
看过,2017-03-25 10:18:59,3.0,11,这部片子中人性的渲染比较出彩
看过,2010-01-21 22:35:29,2.0,0,美国人这回补救地球改救贫困国家了，莫妮卡就算风里爬雨里泡也无法挽救自己。
看过,2012-08-07 23:15:12,4.0,0,主题很好，人类主旋律，但是剧情有些干，你们说这是个人英雄主义也好，是大美利坚主义也罢，我认为个人英雄主义上升到集体个人英雄主义还有人性的觉醒才是最重要的。不管是谁都有可能这么做，虽然这个世界依然有很多恶人。
看过,2012-10-13 23:08:02,3.0,0,和后来法国人拍的＂特种部队＂如出一辙，人道和拯救感化了士兵，但相比对武器和战术的展示，那个转化就成了剧情需要的摆设，而无实际功能。相对而言，法国片更单薄一些，这部主演的疲惫沧桑感，预设了合理性。
看过,2014-05-20 20:44:44,4.0,0,高潮尽在后30分钟枪战，多给一星，前面只是上校的心路转变历程。尼日利亚叛乱，布鲁斯奉命率队去营救美国医生，假装要带难民逃走，已坐上飞机后又折回；护送途中看到种族清洗而出手；发现叛军跟踪信号而来，为了追杀总统儿子，经过激烈厮杀终于等来后援。PS：女神莫妮卡贝鲁奇没有认出来，一点不美
看过,2009-05-15 12:37:07,3.0,0,"人性在如此血腥的战争里显得多么极端...
崇高抑或卑微...甚至泯灭人性的...
生命的价值在惨绝人寰的杀缪前显得如此脆弱...

依旧喜欢Bruce"
看过,2012-08-14 02:36:57,2.0,0,前半部份还装了下专业，尼玛越到后面越显示出水得不行的军事场面，而且每个演员都是面谱化的，亏你们都是专业演员啊，感觉就跟勇者行动那堆真兵哥念台词没两样啊，唯一的亮点就是重口味场面并不畏惧拍了出来
看过,2010-06-14 13:24:53,4.0,0,"A美国宪兵个人英雄主义的又一宣泄；
B莱娜除了对仁慈的阐释外，只有抱头喊叫，其实，这很真实；
C依旧是一个残忍的国度，有人，也有大量的畜生；有泪，更有无尽的真爱；
D当年幼的孩子扑向母亲，所有的磨难与牺牲都被赋予了更崇高的意义，尽管这样的画面看过无数次，但这次依旧为之动容。"
看过,2008-01-22 15:35:36,3.0,0,Tears.Of.The.Sun.2003.HDRip.XviD-TLF
看过,2011-12-15 10:55:44,3.0,0,"上帝离开了非洲？！然后美国大兵来了。就像BW在里面所说的那样，我已经不知道做什么是正确的什么是错误的了。在那里，人变成了evil，给予当地最可怕地袭击，珍惜自己现今的生活，为那些水深火热的人祈祷吧。 
"
看过,2010-07-29 23:04:16,4.0,0,在战争中，每一个对立方都认为自己是在为自己的信仰国家和人民而战。而以任何名义存在的战争都是荒谬的。 好莱坞再次弘扬美国大兵的人道主义救世精神。其实布鲁斯什么都不做，只要端枪一站就够救世主了。爱的就是他的不死之身。
看过,2012-04-18 13:07:53,4.0,0,"当善良袖手旁观时，就成全了邪恶的胜利----爱德蒙.柏克
The only thing nessary for the triumph of evil is for good man to do nothing.--------Edmund Burke "
看过,2010-10-17 19:17:46,0,0,其實現在很少能看到太陽淚、黑鷹墜落這種主旋律了，倒是那種在象牙塔里想當然的二流反戰片一大堆。美國的處境真是尷尬，總之吃力不討好，面對非洲這灘渾水，援助干預就等著被描述成“侵略別國”、“世界警察”，不干涉又被罵成“不作為”。索馬里、盧旺達都是先例。哪像天朝，無事一身輕，管你昏天黑地
看过,2008-04-13 21:49:19,3.0,0,投影。老布又出现了。我发现他的片我都几乎看遍了。所以觉得很乏味。不死硬汉加美女的故事。看点是海豹突击队员。发现自己有进步了。贝鲁奇的第一个出场特写，带着口罩，我只花了不到三秒就认出了她。其实她还是更适合演花瓶。
看过,2017-03-25 19:47:30,3.0,7,稍微有点小血腥
看过,2011-10-14 16:55:02,3.0,0,上帝离开了非洲？！然后美国大兵来了。就像BW在里面所说的那样，我已经不知道做什么是正确的什么是错误的了。在那里，人变成了evil，给予当地最可怕地袭击，珍惜自己现今的生活，为那些水深火热的人祈祷吧。
看过,2005-10-15 04:08:39,0,0,Action/Sci-Fi/Thriller/Suspence/Crime Drama
看过,2015-07-27 16:59:25,1.0,1,一位亲属盛赞了此美帝上帝视角荷尔蒙爆表满足中年男性对丛林/热血/正义/战斗意淫的一片，称看过十遍，看来家庭成员中的男性都是直的不能再直的直男.
看过,2012-01-17 16:05:03,3.0,0,很符合美国在那个时间段所宣扬的国际形象和人文精神。虽然角色符号化，故事扁平化，但布鲁斯威利斯的个人魅力还是给影片增色不少。
看过,2011-12-29 22:28:45,3.0,2,邪恶获胜的唯一条件就是，善良保持沉默。我在想，如果上尉不调转那直升机，结果将很简单。但是出于人道，——美国英雄主义救世的人道——我们选择了正确的哪怕是牺牲的路。布鲁斯还是太帅了，老成更有味道。贝鲁奇，果然我是为了她更添上一星。
看过,2012-08-23 07:37:21,4.0,0,这片本身没什么问题，是部好片。但是，结合美国佬自身，经常借着“正义”的名义对一些国家进行军事打击，这就让人无语了。正义会被滥用，但是真理不会。借着正义的名义消灭真理，这是悲哀的地方。还好在此片中看到人道主义，这是真理！
看过,2017-03-25 20:51:14,4.0,4,人道主义的胜利吗？只要是战争又哪有绝对的胜利
看过,2008-09-29 13:53:51,3.0,0,"又是一部有关非洲种族之间屠杀与拯救的故事~
可以看看~
看到女主角就让我先起了西西里的美丽传说..和她美丽的身材..
我承认我很色.."
看过,2006-11-20 12:47:26,4.0,0,故事本身很不错 除了紧张的战斗场面之外 美国人标榜的人性关怀也还是蛮温暖的 只是Monica Belluc的低胸衬衣显得不太真实 哈哈
看过,2011-09-27 01:52:36,2.0,3,题材摆在这里，但拍得极其之干巴巴，都不是不过不失，而是很空洞……
看过,2009-02-01 16:43:48,3.0,0,文宣味道比较浓。很多技术动作有不符合Seal的规律，有硬伤。比如众多队员以半自动火力并排推进，遇到大规模冲突，Seal也不会这样的。不过，演员的军人味道还是能让人信服。
看过,2017-03-25 16:17:03,4.0,6,不错，题材喜欢
看过,2009-12-25 13:20:47,5.0,0,这是我没有字幕，裸看的第一部电影，播放时间很长，但是相当耐看和好看。
看过,2008-02-18 19:09:26,2.0,0,2007.8.8 见过这么烂的screenplay....Monica Bellucci演技也好烂
看过,2014-03-14 20:27:08,5.0,0,The only thing necessary for the Triumph of Evil is For Good Men to do Nothing.
看过,2005-08-09 23:50:40,2.0,8,"美国片退步的可以,玩什么煽情"
看过,2012-07-08 01:53:23,3.0,0,1、有些电影像ETS的阅读一样，行文有结构，读个段首段尾就知道内容...2、在这种悲壮的电影里总要有些没事乱嚎，只会不顾情况大发善心的姑娘来验证.“不怕神一样的对手，只怕猪一样的队友”这个真理...3、其实我是和平派。战争只是政治的延伸，没有平民的决定权，但总祸害平民。没有那场战争是对的。
看过,2012-07-07 21:10:30,3.0,0,被封面给骗了，娱乐性很弱，不火爆，枪战戏很少，主要是反战和歌颂美军的乐于助人
看过,2013-10-17 11:23:27,3.0,0,美国大兵拯救护士姐姐顺便帮助下非洲人民，不过动作元素还是让人看得很爽，片尾字幕倒还算是让全篇没有流于英雄主义宣泄。事实上，归根结底，非洲的动乱冲突是跟欧美国家的殖民行为分不开的。
看过,2010-01-20 01:33:24,3.0,0,The only thing necessary for the triumph of evil is good men to do nothing
看过,2011-11-18 15:35:20,3.0,0,这是部树立美军世界警察光辉形象的好片子，不得不佩服美国人的宣传手段，真实不做作，我们天国应该学习啊
看过,2013-04-04 11:46:14,4.0,1,人物正常，故事正常，画面正常，节奏正常……各方面无比正常的一部美国主旋律军事题材电影，值得作为同类电影的标杆看待，有更好的，也有更糟的。
看过,2008-10-18 12:23:58,3.0,0,其实我想说，这部片子挺烂的……难道是美国人民和非洲人民伟大友谊的宣传片么？最后那个结局……还真是主旋律……
看过,2012-05-09 00:17:13,3.0,2,Bruce Willis最后一声叹息，唉，为兄弟生，为女人死。。。
看过,2011-07-11 14:20:02,4.0,0,战争片里中把女人描写的如此愚蠢？Monica·Bellucci 仍旧花瓶？整个故事还算流畅，描写种族屠杀的情景拿捏的不错，不显过分煽情。典型美国英雄的故事，现实总没如此完美
看过,2010-10-11 10:54:36,4.0,0,道德与职业操守的选择，眼泪洒给被放弃的服从命令的天职，眼泪洒给为拯救难民牺牲的军人，眼泪洒给人性的光辉
看过,2012-01-21 17:11:48,3.0,0,很普世，于是也算很主旋律了。美式英雄本来很好，何必再要歌功颂德。作为战争片不真诚，作为英雄片不纯粹。
看过,2007-06-21 00:17:33,4.0,1," Bruce Willis的片子自然不能错过，从他虎胆龙威开始就知道这位好莱坞大牌的，而对于此片早就有所耳闻了，一直没有下载的机会，终于，影视帝国出了，我下了，再看了
片子实在是美国化，非洲的一场种族屠杀米国人实在看不下去，就保护需要营救的一美国医生带的难民，甚至到最后不惜自己的生命了。看这片的时候我竟然不自觉的想到国内拍的战争片，拍的八路，解放军等等，他们也是以百姓的利益第一，自己的生命都不要去保护他们。一想到这些就汗啊，何必这么煽情呢，那叫一个装b。装b就显示出片子的不真实性了，我就不信了米国大兵能"
看过,2017-03-25 15:31:50,3.0,13,一般，不是很喜欢
看过,2008-10-03 22:35:28,5.0,0,2008.10.3，跟老婆一起看的，相当经典的战争题材的影片，宣扬美国一贯的国际人道主义和所谓的民主，靠。。。
看过,2008-07-22 13:16:15,4.0,0,这是男人的责任 Bruce Willis使我给四星 还有Monica·Bellucci那句it is my people
看过,2008-10-18 23:25:32,3.0,0,God left Africa...但是在所有类似关于非洲的影片里，美国人总是把自己定位在了GOD的角色上，也难怪，好莱坞拍的呗。
看过,2011-03-06 12:10:54,3.0,0,一大早起来居然就看了个这么猛的战争片，太有冲击感了。the only thing necessary for the triumph of evil is for good men to do nothing.英雄将热血洒满战场，怎能不叫人沸腾。
看过,2011-08-03 23:50:15,3.0,0,战争的场面调度十分出色，只是整个剧情显得薄弱，想表达的东西也是被表达过一遍又一遍的。
看过,2010-10-14 14:53:47,3.0,0,认为塑造约等于零 明明就那么几个队员 还那么吝惜胶卷几乎一点他们的性格也没交代 故事是个好故事 怕的差了点 配乐比较新鲜 还不错
看过,2012-10-04 23:13:55,3.0,0,感谢美军给我们尼日利亚人民带来自由。哎。
看过,2013-10-28 14:42:35,2.0,0,垃圾导演层次不够还想玩什么严肃主题，内容空洞无力，剧情拖沓的要死，演员连句像样的台词都没有，莫妮卡贝鲁奇从头到尾基本一句:NO！ 而且导演显然把鞭炮都放在最后杀青时一起点了。毫无疑问这是迄今为止看过最烂的美国战争片！
看过,2008-06-04 13:51:01,3.0,0,帅哥都死光光 就为了那美女和老男人...。 （虽然这部戏外我也很喜欢他们的...)靠牺牲来弘扬的英雄主义 哎....
看过,2009-10-31 14:52:02,4.0,0,The evil get the triumph during you confusing what worth fighting for.
看过,2011-07-10 17:35:20,3.0,0,莫妮卡，贝鲁奇果然更适合演情色片。布鲁斯，威利斯果然一直板着脸，从头到尾没有笑过。美国大兵果然是人性主义的象征。嗯嗯……
看过,2017-05-16 19:19:56,3.0,1,主题很主旋律，太理想主义了。故意煽情让人心烦。种族战争确实很惨，不过你们这么干缺少效率和职业精神啊，反而会让更多人白死。重要情报不提前说，感情用事，事件发生了，信息交流时居然用“信不信任”来决定告不告诉你，你他妈几岁啊？！知道什么叫战略吗？
看过,2010-04-07 23:46:31,5.0,0,看完迷恋上了老威那两条法令纹~~哈哈哈！！！不过非洲真是可怜又可怕的地方……莫妮卡的老公我一直不清楚是谁，不过我觉得她和老威这种硬汉挺般配的
看过,2009-07-10 15:57:43,4.0,0,几年前在姐姐家对着豪华屏幕看的碟子 只道是物是人非欲语休啊
看过,2012-06-20 19:17:34,3.0,0,美式爆米花，右派的样板戏。虽然实际上在那块被现代文明遗忘的大陆上，每天都有以民族的，国家的还是神的名义在种族屠杀，政变屠杀，异端残杀。但我很怀疑美国人是否愿意像影片中那样，付出如此大的代价去拯救这些人。
看过,2009-12-29 00:09:00,4.0,0,每次看见这种类似《战火屠城》、《第一滴血4》之类的电影，就很感慨，想起了去过的曾经被红色高棉血洗过的柬埔寨。这类影片（越战除外）如果出现美国大兵总是展示美国国际警察的力量，让人感觉如果没有国际警察，是否就真的是一件好事呢？
看过,2009-12-23 23:18:21,3.0,1,美国的“主旋律”片啊......我就不明白了，救死扶伤的医生总是要露出大半个胸脯呢？！（虽然我是看的很.....咳咳）PS，早知道队长会和医生搞上......
看过,2012-02-16 17:13:40,3.0,0,贝鲁奇做了一次非常不讨好的花瓶。情节发展到后面确实了无新意，这些大兵能救出受难者，最后也是出于对同类遭遇不该遭遇的对待而出手，又是勇往直前的美国精神。当然，我是冲着老布才看的。
看过,2017-03-25 22:57:27,4.0,12,还可以，挺喜欢女主的
看过,2011-01-14 17:27:47,3.0,0,还行吧能活出来超过战争的物理实现
看过,2009-09-24 17:57:36,4.0,0,"一直都在崩   到最后都没来得及泻出来~~
    我更情愿贝姐做花瓶~~"
看过,2011-05-23 01:28:15,3.0,0,无聊，不撸死整个一刘皇叔.........
看过,2014-03-15 22:55:51,3.0,0,Tears.of.the.Sun.2003.Theatrical.Cut.1080p.Blu-ray.Remux.MPEG-2.LPCM.5.1-KRaLiMaRKo
看过,2011-05-31 11:41:04,3.0,0,失眠看到凌晨3点。故事不错，但拍得真不咋地。多一颗星给迷人的老男人和老女人。
看过,2011-04-02 14:20:23,3.0,0,非洲人民的苦难，种族屠杀，战火燎原。在一望无际的原始深林，什么是人性，人类又能怎样？动感而独特的音乐，值得同情可怜的人们，期盼黎明的太阳
看过,2012-07-16 22:04:59,4.0,0,终于好好看完了一次，很不错。话说心里的历程从一开始的不理解到慢慢的理解，人类之间的互相尊重的底线。
看过,2010-06-23 15:48:46,3.0,0,用一句话总结，这是他们的战争，关我毛事
看过,2011-11-19 14:37:46,3.0,0,美国大兵拯救非洲难民。剧情是俗套的，人性是光辉的，女主是花瓶的，男主……布鲁斯威利斯演的还是不错的~ 突击队员都好帅！女神果然是女神，就算在脏兮兮的丛林里素面朝天衣衫褴褛满脸泥泞莫妮卡贝鲁奇也还是女神！突袭村庄那场拍的干净利落！哈！那个叛军的副手是Spartacus里的Oenomaus！
看过,2010-09-21 02:00:13,5.0,0,这部电影已经不仅仅是责任道德的层面，更多的是对人性的思考。好。
看过,2012-09-04 20:39:06,2.0,0,"动作场面火爆,但美国人在这部电影里自大得让我恶心."
看过,2013-02-22 23:18:07,4.0,0,女神跑非洲丛林去了，木看头啊
看过,2017-03-25 20:48:23,2.0,13,不喜，牵强附会
看过,2010-01-21 11:25:36,3.0,0,小规模战争却营造出了大战的感觉，在撤退途中的细枝末节刻画出了面对战争时，军人内心的变化，一次次的拷问，一次次的选择，发人深省。
看过,2010-09-30 15:53:53,3.0,0,又是一部美国干涉他国内政的大片，为了几个他国屁民和大头兵， 美国出动的2架战斗机和3架直升机。
看过,2011-07-27 09:56:25,3.0,0,如果不救那些人又不道德，救了死伤太重。
看过,2012-08-03 09:34:15,4.0,0,虽然大凡开端总是女人感性的拖后腿破坏计划，但是结局也大凡是因为这份感性而感人。美国大兵的侠肝义胆化骨柔情，无论看多少主旋律战争片都一样震慑人心啊~更别提还一个个都帅的不能行。。。
看过,2011-05-23 11:57:24,3.0,0,原本想睡前看个火爆战争片再爽爽睡一觉 可看的比《黑鹰坠落》还压抑 当然剧情没的说 充分表现了战争下人性的脆弱与坚强 而老美也再一次成功扮演世界警察 祝警察同志越来越强大 早日迈出太阳系 统治全宇宙
看过,2010-03-26 14:41:06,3.0,0,邪恶之所以胜利，因为善良的人们无所作为  （悖论出现了，面对邪恶无所作为的人们，还是善良的吗？
看过,2009-08-18 13:06:35,4.0,0,"喜欢里面の激战，很真实，可以学到很多作战知识...      
顺便说一下，那个美国女医生是傻B~~
结尾点睛：邪恶胜利的唯一关键：就是好人任其横行！（埃德蒙-柏克）  中国如此腐败也是这个原因！"
看过,2011-03-03 18:14:50,4.0,0,想当年看得我和我三姨热血沸腾
