看过,2017-11-27 17:37:58,4.0,0,美丽，感伤，渴望和平
看过,2009-12-24 23:14:55,4.0,0,人民之间本无仇恨，统治者的教化让他们产生了仇恨，从此也就失去了安静和平的生活
看过,2015-05-25 21:01:57,5.0,0,怎会有人真的想打仗？无非是为了别的，自由、和平、尊严，或别的有的没的
看过,2015-06-16 21:24:31,4.0,0,温暖动人
看过,2008-03-22 04:38:02,5.0,0,很爱....
看过,2015-09-03 16:05:53,0,0,纪念和平的日子应该看看这个片子。在温情的映照下才显得战争格外的残酷。
看过,2015-01-04 21:53:33,4.0,0,战场上的圣诞快乐~
看过,2012-01-05 15:36:36,5.0,0,神的大爱是不分国家不分种族的，耶稣替我们是在十字架上，不是为了让我们互相残杀的，而是为要我们过幸福的生活。
看过,2012-01-14 00:11:14,4.0,0,那些和你一起喝酒打牌，踢球聊天的人，无论之前你多么讨厌，之后还能向他们开枪么？不能。因为大家都是人。理性的文明的人
看过,2007-10-21 18:43:47,4.0,0,没见过这么浪漫的战争片，其实几乎算不得是战争片了
看过,2017-02-12 21:55:33,3.0,0,Diane Kruger!
看过,2014-04-14 22:12:54,5.0,0,"201404142212
3.0+2.0☆
QVOD"
看过,2017-01-22 22:35:31,3.0,0,大概没看那么多战争影片之前看这部会更感动。三个军官们好帅，丹尼尔布鲁赫最帅！
看过,2011-01-25 14:19:59,0,0,也许仅仅能够出现在欧洲
看过,2011-04-10 19:23:41,3.0,0,刚学法语那会儿看的，当时苏菲坐我旁边
看过,2014-12-31 14:52:57,5.0,0,I'M Dreaming Of Home
看过,2013-03-11 01:02:48,4.0,0,圣诞的时候和老李看的；好正经的氛围
看过,2012-10-10 04:18:07,3.0,0,故事好
看过,2017-05-17 14:00:33,3.0,0,反战电影
看过,2014-01-23 01:39:50,5.0,0,点到名的都好看，麻利昂男票和前妻也好看，坏蛋二号当年极嫩，还是艹兄狂魔……
看过,2008-08-16 19:47:14,0,0,另一种真实的战争
看过,2010-07-26 20:28:09,4.0,0,干嘛要打仗呢
看过,2012-01-13 22:57:12,5.0,1,今晚看了《圣诞快乐》，又名今夜无战事，改编自真实故事，一部很特别很伟大的战争片。它告诉你谁在战场，以及什么是人；它温暖浪漫而又悲情讽刺，感人至深却不催人泪下，它只会让你陷入沉思难以回神。
看过,2014-05-03 21:40:55,4.0,1,丹尼的语言能力和法德的军装简直太苏！我大苏格兰简直土爆了！但是！我们有风笛！！【苏德刚会面不睬法，法自己冲上来的时候有种“德国你不准抢我百年基友的既视感【是苏格兰不是英国【其实还是很伤感的。
看过,2012-08-26 01:22:02,4.0,0,以我们的文化背景看完了应该只觉得还好。在天主教/基督教通知了两千多年的西方世界，这样的精神力量超越一切，超越我们所能想象的。实际上，战争就是大国之间抢玩具的家家酒啊，但小百姓就注定是炮灰。
看过,2017-12-25 23:55:34,4.0,0,太温暖了 战士们圣诞快乐
看过,2016-12-26 01:30:23,5.0,0,作为战争片，已经不能要求更多，圣诞快乐......
看过,2016-10-28 02:59:54,4.0,0,战争中的人性闪光。即便是战争将人们变成敌人，但是人类还是渴望爱与自由。不知不觉，这些前线的人们因为爱走到了一起，只是为了聚在一起度过圣诞。不过影片的剧情方面有问题，三段故事显得有些虎头蛇尾，故事中的主角都没有从一而终，描写的十分马虎。有些情感转折点强调的不足，厌战情绪铺垫不足
看过,2015-11-14 22:23:17,5.0,0,没有恢弘场面，没有刻意煽情，这是一部感人的战争题材影片。
看过,2011-10-13 17:47:23,5.0,1,整片集合了英法德3国的精英，才子兼帅哥 — 吉约普卡内，【再见列宁】的小伙，【尽情游戏】的怪大叔，【跳出我天地】的爸爸，戴安克鲁格……！
看过,2015-01-03 22:12:58,5.0,0,只为温馨~
看过,2017-01-23 00:11:53,5.0,0,这怕是我看过的最可爱的战争片了。都快过年了，本想找些欢快氛围的电影，没想到昨天才看了战争片今天又继续了。只是没想到反战题材的电影还能这样拍，拍得如此儿戏还看得这么津津有味，要知道稍有不慎就和国产战争片一样拍成神剧了。当然这电影也有让人犯尴尬症的时候，譬如那两个歌手在一起的时候··
看过,2011-07-28 11:39:38,4.0,0,还是好的。只是战争片总是让人不适。
看过,2012-12-20 13:19:31,4.0,0,音乐和信仰的力量能融化一切
看过,2012-07-20 20:46:32,5.0,0,受黄建宏同学之邀，与天明同学一起去中国艺术影院看的。战场上有这样的温馨，想都不敢想
看过,2016-12-13 19:39:05,5.0,0,平实的电影，一开始让我略略有些不耐烦，但是随着剧情深入，仿佛是一波又一波的浅浅波浪，看到他们踢足球时，我不禁泪流满面
看过,2017-09-07 23:22:42,4.0,0,只有没经历过战争的人才会向往战争
看过,2009-04-11 20:22:27,5.0,0,世界要是没有战争该多好
看过,2015-05-31 23:49:58,4.0,0,《圣诞快乐》根据第一次世界大战时真实事件改编，西线前线的法英德三国战士平安夜在音乐的感召下纷纷放下武器走出战壕一共庆祝圣诞。尽管语言不通，无论是敌人还是朋友都紧紧拥抱，交换美酒和巧克力，但是天一亮大家又要回到各自的战壕尽一切力量要将对面战壕里面的人杀死……这正是本片最虐心的地方
看过,2015-12-28 00:41:23,4.0,0,只有经历一线战争的人，才会对和平有如此真诚的渴望。
看过,2014-11-16 23:19:51,4.0,0,论一群败家的军官是多坑战争经费啊、。
看过,2016-12-28 11:29:37,3.0,0,平安夜看的，很温暖。一战里的人文关怀还在，现在恐怕都是延误战机的大忌。惊讶他们互相邀请去对方战壕躲避。
看过,2013-12-29 23:58:09,5.0,0,如果这个世界每个人都是非暴力主义者。/人来世上就是来犯罪再赎罪的。/最重要的，友谊地久天长！ /这个世界上不存在真正的敌人。
看过,2011-04-16 22:25:48,4.0,0,抗过了前三分之一，后边儿还不错的~
看过,2016-04-02 00:18:00,3.0,0,"细细一想，人类用了一个世纪才草草解决了个人与国家的矛盾问题。
现在的问题是个人与资本的问题了。"
看过,2010-12-22 01:02:10,5.0,0,伟大的作品
看过,2010-04-28 10:41:31,4.0,0,这战打的太和谐了
看过,2011-08-21 10:07:50,4.0,0,真诚的人性
看过,2007-07-30 23:57:27,4.0,0,感动
看过,2011-05-08 14:40:10,4.0,0,至今看过的最文艺最温情的战争片，反战的视角很独到。这种事情估计历史上不可能发生第二次。Christian Carion看来是我最喜欢的法国导演。Guillaume Canet军人打扮相当的帅气。
看过,2013-06-10 08:20:20,4.0,0,term paper of history 德军犹太裔指挥官无疑是命运最悲惨的，在一战结束后，随之而来的就是二战，而犹太人所要经历的不仅仅是从战场上带来的痛苦...
看过,2015-03-14 04:06:31,5.0,0,喜欢叙事手法和这个传奇般的故事 自然而不刻意地戳泪点
看过,2014-05-26 20:49:20,4.0,0,几个月前跟随学校的projet一战百年后重走战壕时并无太多的感觉，可能过于遥远吧，但今天看完电影，闭上眼都是那些弯弯曲曲的走道，铁丝网和阴暗的洞穴，战争越荒谬，小人物普通的情感便显得越动人。
看过,2014-02-02 14:00:08,4.0,0,身在和平的情况下，而不是硝烟弥漫的战壕里，我们是会一起喝咖啡的老朋友，谈论各自的母亲、妻子和孩子，谈论邻家的猫。只是战争，让我们身不由己。
看过,2016-07-17 17:37:31,3.0,0,丹尼尔布鲁赫那个时候就是德军青年军官专业户了0.0不过这欧盟献礼片拍的不太好看
看过,2010-12-15 17:35:45,5.0,0,结局太伤感了
看过,2017-09-15 12:44:47,4.0,0,三刷...
看过,2013-11-30 18:42:23,3.0,0,呵呵，当时政经格局下一厢情愿的欧盟幻想，冗长拖沓，无聊浅薄得紧。
看过,2017-12-25 01:28:01,4.0,0,我相信看过电影的人，无一都会反思战争的可怕，这就足够了，战场是人类最大的坟墓，战争从没有赢家。在圣诞夜看这部电影，很应景和感动。2017-195
看过,2012-03-25 08:02:09,4.0,0,字幕不匹配，德语部分真纠结。。。
看过,2006-07-18 00:42:38,4.0,0,"不想对战争中的人性完全失望，就看看这部。
感人而不煽情。"
看过,2017-05-01 15:04:45,5.0,0,"Merry Christmas。
平安夜三军将领在夜色下聚在一起达成节前停战共识后剧情就开始温情欢脱而又紧张起来了…"
看过,2014-01-04 22:30:15,5.0,0,愿神的国降临，愿世界和平
看过,2012-12-25 20:58:15,4.0,0,Peace on earth
看过,2017-07-19 10:59:36,4.0,0,没有谁做错，只有战争该被谴责
看过,2012-01-13 23:23:54,5.0,0,相当不错，还需要再看一遍！有些地方没看懂
看过,2016-08-24 16:18:29,5.0,0,打得所有人都怀疑自我的战争
看过,2008-12-25 21:22:54,0,0,神父，我离你不远，可是，他们离你太远了啊
看过,2014-12-06 03:46:25,5.0,0,电影4星，Bist du bei mir 加一星
看过,2018-01-14 22:02:27,5.0,1,感人。今后要把这三种语言都学会！
看过,2011-12-05 01:51:33,3.0,0,整部片子给我一种滑稽感，就像吵架气到眼球充血，最后忘了为何而吵。
看过,2017-11-16 04:11:45,5.0,0,a good night around wood fire
看过,2015-09-23 23:41:56,5.0,0,还是那句话，如果没有战争，他们或许是朋友。   它不一定好，它不一定还原了当时的情景，但它确是一部有意义，有情感的电影。    8.6
看过,2018-01-15 23:25:31,5.0,0,很好看，欧洲人对战争的反思真的完全跟亚洲的不一样
看过,2016-12-08 00:28:21,4.0,0,为人性的光辉贺岁，这场战争中胜利属于每一个圣诞放下枪火的人，可爱的人
看过,2016-03-04 00:29:54,3.0,0,看了中文配音于是毁了一部好片…
看过,2016-12-31 05:30:22,4.0,0,懂了一个词“fraternize”. 拍得很轻可心里却挺重。
看过,2008-12-27 22:42:11,5.0,0,音乐的力量太强大了，摄影师的风格我非常喜欢，不喜欢战争片，但是喜欢这个片子，节日就是用来挂念和被挂念的日子
看过,2013-09-25 20:52:29,5.0,0,最好的反战片
看过,2016-12-25 00:40:40,4.0,0,每个人都很珍惜那一晚的宁静与祥和，三星半。
看过,2017-12-26 20:49:11,5.0,0,上帝创造是美好的和欢乐的。基于共同的基督教信仰和传统才迸发出了这种优秀的美德。片中圣诞过后开第一枪的是积极参战的，和无视上帝的救赎的，我觉得是很好的国家主义的影射。而且看看自由主义和人本主义对欧洲造成的伤害，两次世界大战。
看过,2017-10-13 20:37:51,4.0,0,白天炮火连天，晚上放下武器聚在一起过圣诞，次日早上又掩埋自己同胞的尸体。战争真的可笑，逼着一群本可以在一起说说笑笑的人兵戎相见。
看过,2017-04-24 01:12:41,4.0,0,催人泪下扼腕叹息的一场战争。
看过,2016-01-18 23:48:10,3.0,0,可以，为了圣诞节
看过,2018-02-14 23:41:49,5.0,0,那时候的战争都如此美丽！孙子兵法有点惭愧…
看过,2013-06-22 20:12:52,5.0,0,"戰爭是政客引發, 軍人只是砲灰, 本片鼓吹和平反戰"
看过,2013-11-17 22:38:27,4.0,0,所有战争都是反人性的。在感动于那一个温情复苏的圣诞夜的同时又不能不想到，这一天过后，人们仍不得不重新拿起枪支垒起工事，杀人，或者被杀，哪怕他曾与你共享过香槟，共唱过宁静的平安夜曲。
看过,2012-12-11 22:36:52,4.0,0,Guillaume Canet控【捂脸 【虽然故事有点中学语文书的感觉但是还挺感动的
看过,2014-12-04 13:59:14,5.0,0,看的是国语配音版，好像把德国某位王子的名字翻成了“阿卜杜拉”。。。
看过,2014-01-31 20:57:37,5.0,0,战争是人类最卑劣的品质表象。讽刺的是和平要用战争来换取。
看过,2011-09-14 12:44:35,3.0,0,昨天看了部电影，中文名应该叫今夜无战事。从头到尾都是体现的过于理想化的战争里偶然出现的和平个人觉得不错。基于故事是真实事件改编的就不多批判。只是突然觉得如果是昆汀拍，中间那一段和平肯定会被他弄出点什么来，那一枪就开出去了，然后。。既然是昆汀就不知道会有什么然后哈哈哈。。
看过,2014-04-27 22:57:54,4.0,0,战争本身的残酷无法阻碍人性深处温暖的流露。
看过,2013-01-22 23:37:51,4.0,1,我是一个喜欢看战争片的反战支持者，就是这么矛盾、这么简单。
看过,2012-04-09 16:39:41,4.0,0,偏文艺
看过,2011-01-03 12:14:46,3.0,0,不知怎么的，觉得那个年代的影像应该是黑白的，回忆就像褪色的旧相片。片子蛮感人的。
看过,2018-01-27 14:29:06,4.0,1,细节很多，印象特别深的是猫，咖啡和德国军官说自己的妻子是法国人。法语课看得断断续续不是很专注，然而明显是用心的片子，从宗教，战争，人性，冲突各个方面都探讨得很深刻。
看过,2013-10-27 12:03:27,4.0,0,最后的战争童话。旧时光里似乎不可能存在的事。
看过,2016-02-18 07:59:23,4.0,0,"对于长达几年的战争来说,一天的停战算不了什么,但就在这一天,所有的隔阂,仇恨都消失得无影无踪,这一刻,人与人之间的温暖,友爱,信任体现得淋漓尽致."
看过,2017-12-25 00:00:47,3.0,0,103年前的今天，苏格兰法国德国的士兵，在交战区，伴随着I'M Dreaming Of Home悠扬的音乐，走出战壕，走出铁丝网，庆祝圣诞，享受转瞬即逝的平静。这个极端的事例，更加让人反思战争，反思这一人类独有的行为，违背人性的事物。之后，这些军官都受到处分清算，但内心的火种一旦燃烧，那将燎原式不可阻
看过,2012-09-01 16:29:20,4.0,0,这个节奏实在吃不消，最伟大的永远是人性。PS：女主角有好多人的影子。
