看过,2017-01-08 22:15:02,4.0,0,这特效有点可惜啊。。
看过,2016-12-14 22:54:22,4.0,0,对于科幻迷来说是一部意外的惊喜，本来以为是B级片，但是却很精致，场景装备都很用心
看过,2018-02-19 15:49:12,4.0,0,好看
看过,2017-01-31 12:34:36,4.0,0,有点未来战争的感觉！
看过,2017-01-02 13:29:29,3.0,1,装备贼帅
看过,2016-12-28 23:59:07,4.0,0,流畅。
看过,2017-01-04 00:06:30,0,0,反正人类最后都是自己把自己给作死的
看过,2016-12-27 09:47:56,2.0,1,我实在看不出这片有在豆瓣得7分多的资格。
看过,2018-03-31 00:47:33,4.0,0,这个科幻片的理论基础比较牛逼，什么玻状态，搞得真有这么一回事似的……看得人喘不过来气，人死得比较猛，赢得很艰难。
看过,2016-12-14 23:15:51,5.0,0,好看的科幻动作电影~
看过,2017-03-08 15:00:14,3.0,0,逻辑还算严谨，可惜剧情略平淡了一点
看过,2016-12-29 07:42:00,0,0,啊。。。
看过,2016-12-13 06:51:34,2.0,0,编辑开了个天大的脑洞，要你解释呢，你又解释不清，男主这光环亮的，照耀众生，反正有他就够了，关键时刻他啥都能帮你解决。
看过,2017-02-10 23:03:41,4.0,0,讲道理这片子虽然没多少狠特效没多少大场面甚至连个角儿都没有。但是故事讲得很细很扎实，场景很还原很写实，结合时事还有那么点反战的立意。这样踏实挑题材踏实讲故事还多少勾起些反思的电影，值得褒奖，推荐。
看过,2017-01-19 15:21:16,4.0,0,玻色爱因斯坦凝聚态
看过,2016-12-13 23:09:27,3.0,0,科幻
看过,2016-12-13 23:54:59,3.0,0,没有什么是科学解释不了的，前有代码解释奇异博士魔法，现在有3D打印凝聚态解释鬼魂，将来会不会用脑电波来解释意志力？科学教万岁！
看过,2017-11-09 07:28:57,3.0,0,勉强
看过,2017-06-18 02:08:23,4.0,0,脑洞大开的科幻与灵异结合之作，很好的宣扬了人道主义跟反战精神，活体实验真的太可怕。
看过,2016-12-19 23:53:39,4.0,0,Netflix业界良心
看过,2017-02-24 15:17:30,3.0,0,一部剧本生产线上下来的老套电影，整体给人的感觉更像是电视电影，不推荐观看。如果不是它的悬念捂得还算好，单靠特效会让人提早失去兴趣，尽管它特效并不算很差。这部科幻战争片有着一个不错的设定，科学术语大部分人都听不懂，但是它在电影中的表现很清楚，可惜的是有一个平庸的故事。
看过,2016-12-14 00:26:42,4.0,0,太多BUG以外，还是挺有诚意的。凝聚态3D打印够未来感的！还有牛逼的理工科男主月薪得多高啊！
看过,2017-02-01 15:45:35,3.0,0,新武器失控
看过,2017-11-16 01:38:37,4.0,0,完成度不赖，别人家的网大
看过,2017-06-11 14:28:50,4.0,1,冷门佳作，作为科幻片，理论支持还是很重要的
看过,2016-12-14 23:42:46,3.0,0,一部被科幻外衣包裹的反战电影。
看过,2017-02-09 11:13:24,3.0,0,何必这么麻烦，把钱烧掉不是更快
看过,2016-12-21 23:13:28,3.0,0,人类创造想象，工业光魔使想象具象化，本片则做到用科学解释想象——即使包着一个老套的情节框架，但内在逻辑的丰富让Netflix这部小成本的软科幻电影走了一条相对扎实的路线。处在未来的背景下，却有着金属和能量的怀旧质感。
看过,2017-06-26 22:40:10,3.0,0,很适合做成科幻射击游戏，拍成电影有些无趣，虽然战争场面，特效服装枪支道具都不错，科技也算近未来，但是敌人实在太强，总有一种无解的感觉，完全没有势均力敌的意思，所以打斗再激烈也只让人觉得只是延缓死亡，无用功。
看过,2017-07-30 22:51:45,5.0,0,从一开始的超自然表象，平稳回归到科幻本质，各种理论解释基本让人信服，这部电影算是优秀的正面教材。最怕看到那些挖了个大坑自己又填不上的耍流氓片子。
看过,2017-02-11 18:29:00,5.0,0,关于意识和身体关系的科幻片，意识是否可以移植到聚合态（？）材料的身体中被控制和利用，实在是个充满想象力的课题，如果是，鬼魂和不可解释的现象是否多了科学的解释，眼睛对光谱的可视区间以及“看”是视觉在大脑中的意识反应的心理学知识想起来很有意思。
看过,2017-02-05 00:17:17,2.0,0,总有一种游戏即视感
看过,2017-01-11 21:34:21,5.0,0,完全被震撼到，这么好的骗子啊，装逼的太多
看过,2017-01-14 23:01:08,4.0,0,感觉有点像FF…披着科幻外衣的反战电影，虽然设定有点鸡肋但创意很棒，如果做成游戏可玩性应该也很高
看过,2016-12-18 18:42:46,5.0,0,个人理解：这是真正的科幻片。有物理学依据，还出其不意，没有什么出名的演员，靠故事和画面取胜。赞一个。
看过,2016-12-19 17:31:12,5.0,1,有这么高的科技居然还输了
看过,2017-02-18 23:39:07,4.0,0,感觉还不错
看过,2017-03-16 15:06:27,3.0,0,我也不知道为什么突然就看了这部，就是，马马虎虎吧，不惊不喜
看过,2017-01-01 14:08:11,4.0,0,这才是剧情片应有的节奏呀。就是看套路，看着就是爽啊。不是恐怖片，并不吓人。
看过,2016-12-16 03:14:52,5.0,0,节奏紧张，行云流水～
看过,2016-12-13 20:44:22,4.0,0,很不错的科幻片，开始还以为是小成本鬼片。剧情有点意犹未尽。四星推荐。
看过,2017-01-11 23:45:53,3.0,0,只能说还行。
看过,2017-08-11 15:48:17,4.0,0,没有预告片？？？
看过,2016-12-17 13:32:18,4.0,0,创造一个全新的攻防领域，真棒╰(　´◔　ω　◔ `)╯
看过,2016-12-21 23:40:14,2.0,0,节奏把控的太差了，演员毫无演技，士兵毫无纪律
看过,2017-02-18 17:50:31,4.0,0,鬼怪怕雷电是这么解释的~~~~
看过,2016-12-13 20:26:03,4.0,1,构思真的很棒，情节也很紧凑，值得一看
看过,2016-12-18 04:38:28,2.0,0,居然用到了波色爱因斯坦凝聚，我也是醉了。。。大兵们撞上一团BEC应该瞬间变成渣渣
看过,2017-11-18 15:02:33,3.0,0,换汤不换药的片子，美帝一年能拍几百部，当脑子不想思考时候就看得轻松愉快了。
看过,2017-01-08 22:18:10,5.0,0,“我知道他们是什么了！”
看过,2016-12-15 22:36:47,3.0,0,剧情有点扯，不是指幽冥的设定，而是套路的不思进取。但它很好把握节奏，全程扣人心弦，紧抓住肾上腺。它很俗套，并不烂。
看过,2017-01-04 21:41:06,2.0,0,我还能说啥
看过,2016-12-30 16:07:51,4.0,0,意外地发现今年最好的科幻片。前半段很惊艳。
看过,2017-01-03 15:43:06,3.0,0,还是不错的。以为是反战，又以为是讨论鬼神，再然后纯物理知识大结构。总的说来，就是人类自己作死。没有太强的意识对立，只关注在人文层面，机械装置各种展现也算一亮点。但不知为何这片儿让我觉得有科幻味道，而且感到隐隐的恐慌，科幻即现在啊。
看过,2017-02-16 21:32:31,3.0,0,女主太难看了。
看过,2016-12-18 11:15:43,3.0,0,全片冷峻的末日感武器和道具都不错
看过,2016-12-30 23:46:42,4.0,0,别人家的网络电影。
看过,2016-12-16 19:32:58,5.0,0,题材较新颖，故事也不拖沓，虽然是老美一贯的自我英雄主义，但抛头颅洒热血让人肾上腺素升高。这片可以加入豆友的那些“无尿点电影推荐”LIst去。
看过,2017-01-05 09:44:41,3.0,0,世界观有很多言外之意没有详述，混沌和复杂性随着解谜的步骤慢慢展开。文本层面的解读空间是科幻电影需要解决的高阶问题，这部片子做出了一个比较有说服力的示范。
看过,2016-12-13 16:21:14,3.0,2,BUG实在太多。一个怪物就能把几十吨的坦克撞烂要有多大的质量，但是被直升机吹了就站不稳。既然能穿过普通的物质那他们怎么还能站在地上应该直接掉进地核去了。既然他们靠低温瞬间接触就能杀人说明他们的热传导性超级好他们在常温下暴露那么久不可能还保持低温。这些都是稍有理科常识的人就能看出的。
看过,2017-06-09 21:11:06,4.0,0,动作 场面都不错 情节也比较紧凑 不错
看过,2017-03-31 20:38:11,2.0,0,效果一般，设定毫无根据
看过,2016-12-20 13:30:51,4.0,0,默默无闻的突然看到这个片子，也算是个小惊喜了，动作场景故事都还做的不错
看过,2017-01-14 23:28:49,3.0,0,科幻元素彰显亮点，可惜剧情线略显单薄，人设也过于简单脸谱化……
看过,2017-04-16 00:00:27,4.0,0,还行吧，剧情挺老套的
看过,2017-01-10 09:14:42,3.0,0,我觉得一般，不管多么牛逼的设定，多么真实的科幻，多么惊悚的节奏，关键是要有个好编剧，人物刻画过于干瘪，没什么个性，打斗挺多，能吸引人看下去，只能算是及格片。
看过,2017-04-19 08:12:51,4.0,0,无形怪物秒杀美国大兵 技术宅男智取量产基地 美国大兵就是这世上最忙碌的军队，这一次面对现象级的黑科技溃不成军，被秒得毫无招架之力，不过他们领导很好的找到了男主这样的资深技术宅，连玻色爱因斯坦凝聚态都看得出来的人，最后的反攻胜利都是顺理成章的了。
看过,2017-03-31 01:35:46,3.0,0,三星半
看过,2016-12-21 11:40:43,4.0,0,科技感满满，是我喜欢的类型！
看过,2016-12-26 14:25:18,4.0,0,奈飞的发展真是不可思议。
看过,2017-01-21 18:05:20,1.0,0,道具应该也花了钱，几个电视剧熟面孔，但观感怎么就这么immature呢
看过,2016-12-24 23:33:26,2.0,0,辣鸡、一堆bug
看过,2017-03-05 16:42:14,4.0,0,一开始以为是外星生物，后来扯出了爱因斯坦凝聚态，3D打印，人的生死中间态，真是够前卫的。不过最后主角的回归人性及伦理彻底清除了这些技术。不算大片的科幻大片，没有尿点。
看过,2016-12-20 09:23:12,3.0,0,这算科幻还是算鬼片
看过,2017-03-31 22:14:00,3.0,0,有点意思的想法，然而前半程拍的太温吞吞了，后半程才开始好看一些些
看过,2017-01-09 05:54:40,1.0,0,一星给MacKenzie McHale，我是有多喜欢The Newsroom:)
看过,2016-12-23 16:40:12,4.0,2,没抱什么期待看的，反而出乎意料的觉得还可以，未来科技很炫酷
看过,2017-01-16 15:19:09,3.0,0,因为不是鬼片，只能中评。
看过,2016-12-28 22:58:30,3.0,0,感觉还是差一点点 整个科幻片的氛围是很不错的。
看过,2017-07-18 16:38:44,3.0,0,本来以为是科幻惊悚片，结果到最后变成了魔幻片。
看过,2016-12-16 11:12:03,3.0,0,挖的洞有点深，还好最后填了回去。
看过,2017-01-08 01:15:22,4.0,0,还不错
看过,2017-01-17 00:46:49,4.0,0,感觉有点像神秘博士里面解释鬼魂的那种感觉。设计赞。
看过,2016-12-21 23:10:42,3.0,0,非常非常一般
看过,2016-12-13 02:03:10,2.0,0,开脑洞也得按着基本法啊。
看过,2016-12-29 14:47:13,5.0,0,"是真的好。一开始以为现代化武器打魔鬼，后来发现是独裁国家发展的新型武器打民主国家军队，再后来发现是反思战争。
墨子非攻的思想，又恰到好处。
科幻题材，好看场面，主题又清晰深刻。"
看过,2016-12-22 15:32:36,3.0,0,非常真实的未来战争，三星半
看过,2017-02-01 11:09:29,3.0,0,481 七分以上的科幻片还是可以看，预算有限，战机坦克都是凑数，不过整体把握还行，有几分钟还颇有光晕军士长的感觉
看过,2017-04-24 11:26:12,4.0,0,幽冥   2017年3.4 恐怖的都是未知 说的哪个假设第一次听说“波色-爱因斯坦凝聚态”  科学的力量真强大，看来不只是化学改变世界。 3D打印，生产线。 解耦程序    科学无法回答所有问题。
看过,2016-12-29 21:55:20,4.0,0,有创意。道具和特效好棒。
看过,2017-02-26 13:37:36,4.0,0,游戏感很强 特效很好 科学道理解释很好 不过为什么幽灵能毁卡车啊 为什么活死人愿意当战争工具啊
看过,2017-06-27 20:42:01,3.0,0,脑洞挺大的，装备超级帅，很有点使命召唤的感觉。
看过,2016-12-21 21:10:04,3.0,0,俗套俗套俗套俗套俗套俗套俗套俗套俗套俗套俗套俗套俗套俗套俗套俗套俗套俗套俗套俗套
看过,2017-05-11 11:44:48,4.0,0,虽然叙事还是老套路，出彩之处在于“幽冥”的概念设置：玻色爱因斯坦凝聚态。感觉电影格调一下就提高，有木有？
看过,2017-01-01 18:56:32,0,0,有有趣的科幻设定和美学风格，其实完全是院线电影的格局。
看过,2017-01-05 16:08:37,3.0,0,玻色-爱因斯坦凝聚体。。。
看过,2016-12-29 23:57:21,3.0,0,主角一拍脑袋讲出玻色爱因斯坦凝聚的那一刻，全片立即沦陷为第三人称射击游戏。
看过,2016-12-21 21:28:03,4.0,0,接近结尾的科技质感塑造的很好
看过,2017-02-22 00:58:32,4.0,0,Netflix大法好啊！！！有剧情有场面更有节操！
看过,2016-12-31 12:09:20,3.0,0,科学的解释，有点玄～
