看过,2011-05-23 22:37:58,4.0,0,至少用的是日本演员，不用听无语的配音日语了。
看过,2014-05-21 23:10:14,4.0,0,拉贝、保罗、辛德勒等等这些伟大的人充分显示在战争面前人性的光辉，拉贝日记为我们南京大屠杀积累了珍贵的事实，拉贝对中国人民的帮助我们不应该忘记。
看过,2011-12-21 21:06:20,4.0,0,国际友人的人道主义精神令人肃然起敬。面对同一场战争，人和兽的差别立见分晓！张的角色设定有些尴尬，结尾很煽情，不知道是否符合史实；但总体来说，电影很平实，不做作。
看过,2011-12-15 22:30:35,4.0,1,噢，要毕业的时候看的电影了，我竟然没标记过。。辛德勒在拉贝面前都要稍逊一筹，这个电影商业运作不是很多，但故事本身便已经很感人了
看过,2010-12-13 12:14:04,5.0,0,各种感动，一个男人深沉的情怀。
看过,2010-02-15 18:35:47,3.0,0,我忘了为啥没看完最后那点
看过,2009-05-31 20:38:42,2.0,0,白瞎了好题材，导演没有力比多啊！
看过,2009-06-26 13:36:30,4.0,0,删节的公映版很奇怪
看过,2009-08-06 14:49:15,3.0,0,拉贝是主角，南京市背景，中国人是配角~~~
看过,2009-07-10 12:09:01,2.0,0,拉贝本人我给5星 至于这部电影就……
看过,2010-10-16 09:27:03,3.0,0,等下载而看了这部电影。不知道该怎样形容的中国人（都怎么了？），丧失了菊与刀的日本人......我不认为这能足够反映真实，也从不想知道真实。已经不想再看了。
看过,2011-09-28 21:07:24,4.0,0,"thank you,Mr.Rabe."
看过,2012-06-02 01:15:04,4.0,0,张静初那个角色太傻 主人公人生太倒霉
看过,2009-05-24 01:21:50,4.0,0,至少比南京好！拉贝不是英雄但确实值得尊敬。
看过,2017-02-15 21:44:07,4.0,1,这是段值得铭记的历史和英雄。也许一开始的拉贝不过是个想明哲保身的生意人，可是历史把这样一位商人推上了舞台。拉贝用他的智慧与担当，建立起了安全区，拯救了几十万的中国人民。战后的拉贝回国被纳粹视为叛党，又被政府视为纳粹，潦倒中死去，可是历史会还他一个公道，谁能说忘了这位英雄呢……
看过,2009-05-01 21:40:14,4.0,0,拉贝令人尊敬，但作为电影，他没有体现出应有的价值
看过,2010-01-23 21:53:47,3.0,0,。。。。。。。。。张静初真多余
看过,2009-06-03 08:38:05,4.0,0,个人不喜欢。还是南京南京拍的贴心一点。
看过,2009-05-21 03:38:43,4.0,0,无论如何都要感恩 (给小隆过生日 前门大观楼影院)
看过,2009-05-02 10:46:54,3.0,0,可能有些偏见吧，看不出好在哪里。。。。相反的，觉得有些夸张了如历史。。。。
看过,2011-01-18 17:37:34,4.0,0,用美国人的角度拍的抗战时期的电影 角度很新 那个阶段突然迸发出了一批这样的电影 莫非那时候又赶到什么周年了？？原谅我的政治时事思维吧。。。。
看过,2009-05-09 17:49:26,2.0,0,中国人在这部电影里是什么？布景吗？
看过,2009-04-11 17:08:55,3.0,0,第三视角，不管怎么说，感谢外国友人，他们已经尽力了。
看过,2012-01-02 16:32:56,4.0,0,扫了眼豆瓣上的影评，为个陆导掐起来了。事实真相到底是什么已经不那么重要了其实，重点是拉贝有没有帮助过我们？有，那不就结了。干嘛还去争论个不休呢。
看过,2009-06-05 22:09:42,4.0,0,坚决反战。无论30万这个数字是否属实，日军犯下的罪行都是不可饶恕的。学会感恩，如果连这样的人道主义救助都不知道感激的话，中国人也是无情的。
看过,2014-02-03 09:32:30,5.0,1,五年前去电影院看这片的情景历历在目。好像是观影次日，跟同学在拉贝故居门口一家面馆吃面时候谈到这部电影，很震撼。
看过,2012-08-10 19:36:34,4.0,0,南京大屠杀的场面并不多，最后结尾的那个场面似乎有些刻意。不过还挺震撼。
看过,2009-07-16 10:01:03,4.0,0,"一个德国人, 能够这样无私的帮助中国人, 还是比较感人的."
看过,2014-06-04 11:35:22,3.0,0,和《南京 南京》犯了同样的错误，视角有些混乱。每次看了和南京大屠杀有关的电影，都会被日本人恶心到。
看过,2009-06-03 14:50:50,3.0,0,中国人又被德国人救了一次
看过,2009-06-15 23:50:25,4.0,0,四星给的是这段历史和这个人；坐等完整版
看过,2009-08-19 10:17:01,5.0,0,让我们向拉贝致敬吧
看过,2011-12-21 23:47:22,3.0,0,對於拉貝和組織安全區的其他人的人道主義致敬。
看过,2009-05-07 09:26:14,4.0,0,前面不错，后面丢失故事目标
看过,2009-08-08 10:10:24,5.0,0,John Rabe和其他国际安全区的外国人都是手无寸铁的商人和文人，他们并没有国内政府的支持，但是日本人并不敢动他们以及他们保护的人，因为他们有强大的国家做后盾，而中国当时腐朽的政府却没有给人民这种心理优势。
看过,2009-05-30 11:09:29,3.0,1,事实再次证明，看电影千万不要看配音版！！
看过,2014-04-16 23:16:33,5.0,0,男主角很像一个朋友，作为南京人到现在才看这部片子，有点说不过去，一个希特勒纳粹的日本盟军德国人来揭露日军暴行，比一切都有说服力。还有一个陈姓美籍华裔女子因为一直揭露日军曾经的罪行，在美国一直遭到日本右翼分子恐吓，最后不得已36岁吞枪自杀。有种仇恨，是无法抹灭的！
看过,2013-04-23 22:46:34,4.0,0,在生命面前，无关国籍。
看过,2009-05-31 05:52:20,3.0,0,"应该让更多的中国人知道拉贝。
之前我为只知道南京大屠杀而不知道拉贝而感到羞耻。正如网友所说，中国人的不敢恩和日本人的不认罪一样可耻至极、"
看过,2010-02-07 15:07:52,0,0,thank you
看过,2009-10-13 17:33:27,3.0,0,中立，不知道有拉贝，某某忘记感恩？还是自己文盲？善恶平庸，历史只有见证人才知道。原来西门子那个时候就那么强大了。
看过,2009-06-01 14:54:03,5.0,0,还是那句话 中国人不感恩与日本人不认罪，一样都是可耻之极
看过,2012-01-02 12:29:14,3.0,0,你看德国人都比我国人民清楚：南京大屠杀的罪魁是朝香宫鸠彦王
看过,2009-11-24 21:23:56,3.0,0,拉贝也许是中国的辛德勒，但《拉贝日记》绝不是中国的《辛德勒的名单》。
看过,2010-01-29 19:46:02,5.0,0,这才是让人感动的艺术。
看过,2011-02-20 11:51:36,4.0,0,确实比南京南京好看多了
看过,2009-06-19 22:57:05,3.0,0,还可以，凑合看
看过,2009-05-31 14:39:49,3.0,0,中立的历史片中穿插突兀的爱情
看过,2010-02-12 10:40:43,3.0,0,无深度版战争片
看过,2010-07-24 17:28:24,3.0,0,不够精彩，不够深刻！有些情节不知所云。期待完整版
看过,2009-06-02 00:41:36,3.0,0,129 这破配音
看过,2009-06-19 19:01:07,3.0,0,台词不错啊，比LU某拍的好很多，为区别起见，陆X的降一星
看过,2013-09-18 20:07:35,3.0,0,好吧，我也认为张静初那个角色神烦。向拉贝先生致敬，结尾真的煽情的败笔。
看过,2009-12-12 22:54:47,4.0,0,如果一个人可以当一个好人，就已经很好了。P.S.中国人的国民性啊，完全缺失……我也不例外……
看过,2014-05-04 10:20:14,3.0,0,干嘛要给张静初 安排这么多不相干的无聊戏份
看过,2009-10-14 16:55:23,4.0,0,相亲相爱，不离不弃。从家庭的小爱，到对平民的大爱。拉贝是一个活生生的人。
看过,2009-05-29 00:51:03,3.0,0,在被人遗忘和穷困潦倒下死于柏林，很悲凉的叙述
看过,2014-07-28 15:39:36,0,0,柄本明演香川照之的上级将领。杉本哲太演拉贝去领司机张时的日本军官。所以我还是有点诧异的，看到这么多日剧熟脸出现在这部电影里，他们敢演这部片，还是很不错的。
看过,2009-04-30 23:59:52,4.0,0,没意思...砍脑袋那块儿挺操蛋的...
看过,2014-09-27 00:47:28,3.0,0,有时候战争就是这样，在你了解它以后，却又不知该说些什么，。
看过,2009-05-13 17:54:35,3.0,0,"太好莱坞化了……不过,多这些片子毕竟是好的,不要忘了这段历史."
看过,2011-12-15 18:54:41,4.0,0,本来很想给五星的~~但是~~为嘛好好的一部片子`要加个少女怀春的静初姐姐~~绝对的败笔~~·p.s.对我这样洗手间强迫症的人，好电影的定义就是能让我憋到看完所有的字幕..pps.从头哭到尾~朝香宫鸠彦！！！
看过,2010-05-08 21:00:50,3.0,0,不如南京南京那样震撼
看过,2012-03-18 11:11:13,4.0,0,四星给拉贝先生和当年的国际友人及电影本身，不能因为人性就给电影五星。
看过,2009-07-25 03:46:49,3.0,0,不如《南京！南京！》
看过,2017-12-25 01:36:57,4.0,0,对于大多数狭隘的国人来说，只要涉及南京的只一厢情愿的想看到两点：鬼子的屠杀和个别人的英雄主义，哪怕是杜撰的。就像大部分人都不知道反日最积极的韩国当年有多少人编制在侵华日军里；不知道圆明园毁于国人之手。自然也不会接受一个希特勒的信徒如何挽救“一小撮”中国人。
看过,2010-01-03 11:05:15,4.0,0,如果导演认为这部电影最大的卖点是真实，那也只不过是真实的一小部分。只是拉贝看到的，只是外国人的视角。所以我觉得情感在这部电影里占的比重太小了…接下来我要看南京南京对比一下。PS:这部电影把群演安排的是不是戏份太假了…在那个战火纷飞的年代，为什么拉贝走了和妻子拥抱的时候群演那么高兴
看过,2010-08-09 21:10:26,3.0,0,不喜欢张静初，无论演什么角色都是一副样子。
看过,2010-02-23 12:59:16,3.0,0,把一场大屠杀描绘成了拉贝一个人的胜利
看过,2009-08-08 23:17:13,3.0,0,拉贝和顾发生的事要看未删减版才行。。。目前两个小时版，我的理解是，顾为了多19个人的活路，不说话。。。
看过,2012-11-01 18:00:58,5.0,0,南京，多麼大的創口。這部電影是中國人的隱痛，德國人的誠意。至於日本人，油鹽不進好多年，丫最好別在中國呆著，沒准那個犄角旮旯就貓著個冤魂兒野鬼兒，不帶走幾個不安息啊~
看过,2010-01-05 12:43:31,4.0,0,和小日本没完，南京南京为嘛敢和这个片儿比，不是一个档次嘛。
看过,2012-12-24 09:20:39,4.0,0,相比南京！南京！电影传播的更是一种正能量..让人看到在南京屠杀事件当中令人温馨的一面
看过,2009-05-17 18:12:23,3.0,0,看完之后推荐 你还是去看看南京吧
看过,2017-03-18 16:01:31,5.0,1,铭记历史，尊重拉贝，敬佩香川照之
看过,2011-03-14 21:42:26,4.0,0,可以跟《南京南京》配套着看
看过,2010-12-11 19:26:40,5.0,0,这部电影最大的作用就是肯定了拉贝个人对于保护南京屠杀中无辜平民的作用而非纳粹;以及揭露出南京大屠杀真正的责任者朝香宫鸠彦而非松井石根
看过,2010-08-21 21:55:23,2.0,0,不错的人，不咋样的电影
看过,2009-11-14 14:44:35,4.0,1,片子中规中矩，但总还是缺少点厚重感。开头拉贝撑开纳粹旗让中国人躲到下面的时候很令人感动。任何事物都是有两面性的。就看你怎么看，就看你怎么用。
看过,2011-07-25 18:58:10,3.0,0,场面一般，以叙述为目的，可以了
看过,2009-12-23 11:24:35,4.0,0,国内公映版的配音太奇怪啦。。。——又一次唾弃现在的垃圾译制手法
看过,2009-07-25 18:45:22,4.0,0,我觉得比《南京，南京》好看~
看过,2012-01-15 20:52:49,4.0,0,作为外国人视角的影片，至少第三方视角让这部片子少了许多骂战，作为对那段历史的记录也是个不错的方式；剧中的出场人物很多，剧情的前后联系显得很不紧密，各色人物的不断穿插给人以略显凌乱的感觉，特别是张静初这条线，还莫名其妙的加入了一条感情线，不知道导演这是想表达什么
看过,2009-05-02 18:32:41,4.0,0,在荧幕矩阵的影厅看这个真像自己在战场上一样。
看过,2009-10-05 19:37:11,2.0,0,如果是在电影院看的出来我一定肉疼到哭
看过,2009-10-10 22:24:25,5.0,0,"很久没有一部平淡的电影能带给我触动了
但是不得不说这是一部好电影
很奇怪的视角，以一个并不忠诚的小纳粹党员的视角来看待日军侵华这个事情
矛盾却又合情理的情节安排
但是不得不说，约翰拉贝和那些多个国家的外国人们在中国这片大地上上演了另一个辛德勒的名单"
看过,2009-09-18 21:10:09,4.0,0,能在狗日下活着就够了。
看过,2009-10-02 03:36:06,4.0,0,片子一般，但拉贝不应该被遗忘，要懂得感恩！
看过,2009-05-01 21:21:10,3.0,0,真的很一般~
看过,2009-05-05 23:48:51,3.0,0,华谊的枪手果然强大~
看过,2009-04-30 00:11:21,4.0,0,我觉得比南京拍的好多了
看过,2012-01-23 21:47:20,5.0,0,嗯，哭了。拉贝的结局真的不好，但我觉得中国人真应该感谢他。
看过,2010-08-24 11:43:02,0,0,不是中国的角度，感觉是在褒扬外国。
看过,2009-06-05 01:10:43,4.0,0,纯粹的正面形象宣传片。
看过,2011-10-13 11:55:05,3.0,0,韵体看的 还不错 历史的 感慨着~~
看过,2009-05-08 01:33:45,3.0,0,配音好烂。太业余了
看过,2009-05-30 02:22:19,5.0,0,"因为看过南京南京，我给本片五颗星！
真实 的力量"
看过,2011-06-17 13:26:16,4.0,0,"真实,温暖，感动~~
"
看过,2010-05-15 15:46:45,3.0,0,比南京南京好看
看过,2009-06-21 19:50:06,1.0,1,从海报就能看出烂，看到40分钟我已经开始玩游戏了
