看过,2015-07-30 14:34:23,5.0,1565,含泪打5星，没办法，现在连煎饼侠捉妖记这种烂片都能过十亿了，大家撑住啊！不然中国电影这艘船真的就要沉了！！！遥想当年，外公李宗仁秘书，留在大陆，当一名小学老师，隐姓埋名，文革中被打断脊柱郁郁而终，程思远去了台湾，后来怎样，大家看到了......真希望外公坐上了那艘船！
看过,2015-07-30 21:49:44,2.0,630,严泽坤可真有钱，来来回回都多少次了呀！还每一次都是说走就走的航行。
看过,2015-07-30 21:59:06,5.0,693,以国产片的标准来看，这是一部良心之作。
看过,2015-07-31 15:28:09,3.0,538,比上部好。这一部几乎被重剪成了完整的新电影，几十分钟的前情回顾，也就意味着彻底放弃了上一部。仅凭感觉，金城武成为戏份最重的角色，而黄晓明仅在回忆中有几次闪现，也让影片不那么讨厌了。主线仍是大时代下的小人物，仍是难以把握的个人命运。过长的回忆不知是否所有人都能接受，船难也比较敷衍
看过,2015-07-30 21:40:04,4.0,422,那艘货船明明最惨好嘛
看过,2015-07-30 15:24:20,2.0,377,全亚洲最美的几张脸（不包括闹太套），拍出来这么个玩意儿。
看过,2015-07-29 17:01:48,3.0,313,这回船终于沉了，但这不是太平轮下，而是将上下混剪在一起的新太平轮。写意镜头挺美，三条人物线虽然冗长但吐槽角度看包袱还是比较狠的。比如：太平轮一张船票七十万人名币，女主为了买一张船票当了野鸡，在睡遍了全上海滩男人后，她闺蜜出现了告诉女主其实她多了一张船票，你要么？ #我要是女主我不能
看过,2015-07-31 19:08:51,3.0,216,哎呀我天，章子怡简直浪里白条
看过,2015-07-29 18:52:00,1.0,200,期望有多大失望就有多大。前一个小时的闪回， 是给没看过的观众准备的，但对于看过上部的观众那就是煎熬了。原本想表达的爱情，也在一次次零乱的剪辑中被冲散。金城武的最后一场戏，在表现手法上更是狗血肆意。片尾罗大佑一开嗓就如丧歌一般，让吴宇森空有的那颗史诗片的心，终葬送在自己手中。
看过,2015-07-30 13:12:19,3.0,203,对于没有看过上部的人，这部相对比较完整，章子怡的表演可圈可点，沉船实在太迅速敷衍，实难撑起电影最开始的噱头。群像描写有意图但导演心力不足，也比较粗糙。
看过,2015-07-31 16:18:15,5.0,194,章子怡金城武撑起整部太平轮 沉船大戏和落水戏情感渲染做的很棒 短短十几分钟的落水戏演员需要在水里泡多久！ 没有对表演事业的执着以及对角色真谛的理解是不可能做到的 下部的故事线清晰很多 于真戏剧张力十足 子怡表演教科书级别 院线排片希望对得起吴导良心之作
看过,2015-07-30 21:12:02,2.0,141,“等待，比离别还痛苦。” 轮船就像被忘了70分钟，突然想到了才接着拍；翻船戏比起《泰坦尼克号》简直戳瞎双眼；两岸儿女情长戏分分钟穿越到《对风说爱你》…一部都算不上电影的电影，拍成这样，还上下部不成、下部直接独立摆脱干系，好尴尬的剧情，好难堪的吴宇森。
看过,2015-07-30 22:08:40,3.0,173,还好，线索太多有些乱，在船上的时间太短，但在无聊喜剧霸占市场的情况下，宁愿看这部。ps.虽然教主在上一部挂掉了，但分分钟乱入。子怡和宋慧乔在片尾相见，恍惚间以为是宫二与张永成。另外，就算是金城武也是会过期诶，不知道什么不会过期。
看过,2015-07-30 08:52:00,1.0,153,下部居然这么久还不登船……
看过,2015-08-01 05:22:29,4.0,141,三星半，吴宇森这次是豁出去了，前半个小时的回顾意味着完全放弃上部，而将《彼岸》当成一部独立的电影，船难有看点但不是重点，重点是大时代下小人物与波浪的抗争，故事推进很快，剪辑太棒（老怪没署名）！人物刻画非常饱满，3D坑。有个大胆的想法，先有这部，再把上部作为前传，效果会更好
看过,2015-07-31 00:09:16,4.0,143,比想象中好，导演已尽力，值得尊重。考虑到市场上奇葩太多，这已经是有良心的片子了，觉得应该回馈给吴宇森正能量
看过,2015-07-30 07:55:44,2.0,102,比太平轮餐具还惨的是，电影太平轮居然还有下！这个节奏投资方都得跳河吧？
看过,2015-07-21 10:04:34,1.0,96,《太平轮2.彼岸》又名《普渡吴宇森》
看过,2015-07-28 18:00:36,5.0,94,我给金城武五星
看过,2015-07-31 02:53:30,2.0,75,“这个时代女人为这个家注定辗转奔逃”妓女、富人、士兵战火浮生，沉船特效国内算牛，但水里啰嗦，蝼蚁般存活人性美丑。首映，某记者发问咋看明天仅6%排片？吴宇森哭了，不吭声，佟大为也哭了，来一句不是13%吗，你看错了。主持人悲称大家都看《英雄本色》录像带长大，欠吴导演电影票钱，必须去看
看过,2015-07-30 23:01:29,3.0,65,太平，太正。太平轮的真正大背景是【逃】，不是什么战火浮生，寻找爱情亲情。很遗憾，在现有环境，把阿共当做大反派来写是不可能完成的任务。吴宇森脱离了语言和文化环境，必然会把浪漫煽情变成了纯粹背书。
看过,2015-07-31 18:59:20,4.0,87,虽有缺憾，封神足以，格外喜欢金城武的部分，他为了家庭参军，为了道义行医，为了弟弟只身赴沪，为了世人而葬身海底，他羡慕可以为理想而活的家人，却又不得不承担家人留下的重担，一个人扛起整个家，直到死的那一刻，他才真正为自己而死，为他所爱的人，足够了
看过,2015-07-30 23:41:47,4.0,92,"1.太平轮下，是爱情片，但不仅仅是爱情片，年度最佳华语影片之一
2.太平轮的故事告诉我们，千万不要超载，不要酒驾，学好游泳很重要！
3.慧乔很美，子怡很屌
4.黄晓明耍帅当演戏，金城武演戏像耍帅；
5.泰坦尼克号沉了，太平轮也沉了，所以“Tai”字开头的船，大家千万不要坐……"
看过,2015-07-31 02:18:55,5.0,77,不管怎样，这是一部很用心的电影，绝不是烂片，导演已经尽力了，整体质量比同档期的某些神马片子强太多。看这排片率，再没有好口碑的话，票房会扑街的很惨。三星半，冲着导演的态度及演员的敬业表演，还有能在大屏幕上看到金城武两小时的颜，果断五星。那些给一星的同志们到底什么心态？你行你上啊！
看过,2015-07-30 23:45:18,3.0,47,上集据说太烂没看过，这部则可说是精致的平庸。在大量烂片构成国产电影基数的时代，恐怕需要的正是多一些这样的平庸之作。当然，考虑到导演是吴宇森，这样的成绩单还是太难看了，但是总比陈凯歌要强啊。【飞扬影城高德】
看过,2015-07-30 20:12:33,5.0,70,捉妖怪大饼虾都能7分，吴宇森尼玛才三分多。告诉你们，我就要打五星！谁他妈让你们把那两个打那么高！靠！中国电影要完蛋了！
看过,2015-07-09 02:03:26,4.0,55,徐克重剪，妙手回春，加了旁白、删除冗繁，让故事流畅了，让人物生动了。男神金城武刻画人物入木三分，感情相当真挚动人，国际章的演技无可挑剔。整体画面美、配乐也入情。第一部很烂，第二部很赞！PS，谢谢徐老怪将烂演技剪辑为几乎0，第二部没了他，确实很棒。
看过,2015-07-30 23:58:05,1.0,39,撞船、落水的时候我才多少有点兴奋感，我是不是太丧心病狂了？看这片你很难不想起、并在心里对比泰坦尼克号，然后你就会得出这片在后者面前，就是一部幼稚园的作品。吴宇森晚节不保。
看过,2015-07-30 19:39:29,5.0,56,就看不惯那些打一星的，我就是传说中的五星专业户。
看过,2015-08-02 19:33:08,5.0,45,再怎么样这部电影也比煎饼侠好多了吧？像影志这种影评人简直恶心。
看过,2015-07-08 16:47:48,2.0,34,太平轮：逼案。陈凯歌吴宇森张艺谋纷纷交出了自己的烂片大作，能被期待的只剩徐老怪。
看过,2015-08-01 15:03:06,4.0,42,影片深刻厚重，它或许不是当下网生代年轻人喜欢的类型，但绝不失为一部好电影。影片情感浓郁隐忍，反思的创痛中闪烁着人性的光芒。演员表演扎实到位，众咖狂飙演技，每个表情都经得住推敲，异常过瘾。愿这情怀不被辜负，愿这真心不被辱没。
看过,2015-08-02 12:42:26,5.0,264,阿猫阿狗导演的垃圾片，都可以是五星。这部电影必须五星。
看过,2015-07-30 04:51:53,1.0,30,"这年头到了导演的作品都不能看的地步，特别是港台导演，知道颜值才是一切，剧情就他妈的屎，大陆就是钱多人傻。港台导演就他妈的在社会主义市场经济里面如鱼得水，欺骗观众，我宁愿看脑残的一副丑恶的嘴脸。真恶心
"
看过,2015-07-20 20:02:35,1.0,23,骗钱片
看过,2015-07-31 17:28:10,3.0,31,为什么当时不按一集去剪呢？哪怕你跟指环王似的，一集接近三小时，难道还讲不完你这个1949的离骚故事吗？？干嘛非要搞上下集，把观众涮一回呢？？这代价就是天时地利人和都失去啊！！！惨败的结局无法避免啊！！！可惜了这题材，可惜了吴老的情怀！
看过,2015-07-30 17:45:45,2.0,15,打三星以上是水军无误。我爸说他打五星。我很无奈，他说你不觉得呢些鸽子很好看么=_=
看过,2015-07-30 22:39:13,2.0,24,什么东西超载了都会沉。船也是，电影也是。
看过,2015-07-28 12:55:28,1.0,20,又是3D又是上下2部你说不是圈钱是什么！
看过,2015-08-01 14:09:28,5.0,27,好久没有过的眼泪决堤的感觉。
看过,2015-07-30 10:40:44,5.0,28,章子怡
看过,2015-08-01 22:07:09,5.0,30,这才是电影该有的感觉，看完之后还能回忆情节、感觉结尾有点急了、
看过,2015-07-30 23:47:47,1.0,19,这是吴宇森最为惊人的作品，预以将时代命运与爱情相融的乱世之恋，不过是将太平轮沦为了彻底的噱头，你更无法想象《太平轮·彼岸》居然能将上部的内容几乎原封不动的端上一碗冷饭，这不仅使多线交织的情感线索凌乱而让人煎熬，更开创了神作史的又一先河。
看过,2015-07-31 15:21:23,4.0,24,暑期档真正意义上的一部叫做电影的电影!
看过,2015-08-02 08:31:32,4.0,251,有人埋葬在旧时代的战场，有人就在仿佛触手可及的新时代，有人带着憧憬上了这艘幻灭的太平轮。这不是灾难片，是那个时代的自白。打动人心的，是情怀·历史·爱。ps当捉妖记都能破十亿票房而它的排片只有6%，好唏嘘
看过,2015-08-02 08:41:33,4.0,249,这真是个悲情的电影，无论从剧情、票房还是投资方小马奔腾和导演吴宇森，所以必须得到电影院去支持，更何况这确实是一部情节完整、场景震撼、演员投入绝非马震之类强奸观众的片子可比，吴导老了，再也拍不出英雄本色，金城武也不再是小鲜肉，但是对电影的理想和诚意我必须尊敬，这是我深爱过的港片……
看过,2015-07-30 09:39:02,1.0,122,史诗烂片
看过,2015-08-02 16:24:29,4.0,27,画面真是精致美妙，色彩是我个人非常喜欢的，剧情平淡了点，但我竟然没有想拿出手机（看国产片判断你是否入戏的唯一标准）。章子怡的表演真的戏剧张力十足，她的脸在大屏幕上看永远那么生动充满故事性，还有，我章的小腿穿裙子真是太好看了，陶醉。总体来说，是独立而完整的下部。
看过,2015-07-30 20:44:48,2.0,29,超过一小时的回忆精编让上集本就过饱和的铺垫变得意义全无，占下集一半戏份都不到的船戏更是空洞得可笑。吴宇森用屎一样的作品糊死了我的所有期待，可以从白名单直接踹进黑名单了。
看过,2015-07-30 20:41:31,4.0,19,超喜欢金城武！
看过,2015-07-30 23:43:38,3.0,19,1、配乐满意。2、沉船部分不好，但海上求生部分还行。3、章子怡表现很棒，俞飞鸿个人挺喜欢的。4、金城武故事很多，长泽显得单薄。5、结尾突然、莫名。6、重新剪辑后与上部存在不少重复，其实单独把这部作为正片即可，那大杂烩似的上部令人反感，且想表达太多往往什么都没做好。
看过,2015-08-02 19:47:58,4.0,20,说实在的，如果没有上，单独就出这一部，也就没有那么多人会有借口不去看。不过人家毕竟投了那么多钱，想拍成上下两部来回本也情有可原。总比那些根本没有投资，还拍成几部圈钱的小时代强。这片败在宣发，不应该拿“中国泰坦尼克号”做噱头。其他的，无论从剧情、表演、主题，都绝对值得一看。
看过,2015-08-02 11:52:23,5.0,252,自己看了一次，陪爸妈又看了一次。第二次观影并没有如坐针毡，而是体会到了这部电影在细节上的用心。国产电影经历了一个神奇的七月后，这部片子惊人拿了一个这样的分数，太不合理。评个五星吧。
看过,2015-07-31 01:25:58,4.0,18,比第一部好太多
看过,2015-08-01 18:57:02,4.0,20,全亚洲我觉得最美的一个男人和三个女人（此话未经仔细考虑）只是想来看颜的我的六十多软妹币也值了。再说这些美得我捂心口的脸演技也不差，章子怡真的很棒。我就是喜欢这么端庄做作的气氛嘛，破天荒想给四星。
看过,2015-08-01 16:45:04,4.0,14,吴宇森尽可能地将纷繁的线索和人物汇聚在这幅乱世浮生的画卷上，尽管剧作仍存很多硬伤，也让很多欲看灾难大片的观众大失所望，但它不论是工业水平还是情感厚度，都坚守了作为一部电影该有的准则。纵使电影是资本的产物，也绝不能让其底线让位于撕逼与马震，那才是集体审美的沦丧。
看过,2015-08-02 00:23:28,3.0,12,3.7星。没看过上部也不要紧，因为有大量闪回交待人物关系。闪回用的太多稍微有一点乱。下部居然演了一个多小时才正式上船，多次看到盈眶，被冠上中国泰坦尼克不算牵强。一部电影里如果有几个你欣赏的演员，这戏会好看很多，俞飞鸿不错，秦海璐演技略胜章子怡，男神金城武虽然老了但依然帅出全宇宙
看过,2015-07-30 23:34:53,3.0,11,不想让吴宇森太伤心...
看过,2015-07-29 12:09:54,2.0,97,史诗片不容易拍。但是下部依然很爱情。不知道大制作的大特效去哪了？我不是来看爱情的，干脆直接拍个文艺爱情片得了。
看过,2015-07-30 21:55:18,2.0,13,突然有给一星的冲动，剪成2部也忍了，也不能搞个1小时原封不动的剧情回顾吧。1小时剧情回顾之后船沉的真叫一个敷衍，鬼畜的背景音乐震的我心塞，就不说那些个让人嘴角抽搐的爱情戏码，就最后佟大为送笔记的戏码让我瘫坐在影院的座椅，无法面对我逝去的2个多小时的青春年华
看过,2015-07-30 16:32:38,1.0,11,看了上如果还去看下，你怪谁？
看过,2015-08-01 12:18:58,3.0,12,这电影在我看来最好的是配乐。小武哥依旧颜值担当 可惜没有学生戏没制服可看了XD 虽然对国际章无感但跟同片女演员比起来真的有演技这东西诶（特别是跟林保怡那场）前面跟上篇重复的部分太多了明显有注水感 PS：这电影比起爱情 最感动我的居然是秦海璐…
看过,2015-07-31 00:52:07,3.0,6,3.2/首映礼，相比上，剪辑少了吴氏蒙太奇多了徐氏伶俐干净，剧作少了战争美学多了爱的归宿。金城武和长泽雅美的爱终释怀，章子怡佟大为的爱终落地，宋慧乔的爱在延续。前面情绪铺垫脱节导致沉船部分张力不足而无法感染观众是直观的遗憾。中间结尾的几个点睛之笔也很棒，还是总觉上集加50min比下精彩。
看过,2015-08-10 14:45:23,4.0,11,特別欣赏章子怡超脱的气质和充满爆发力的表演，还有金城武那张能让时间凝固的脸。那个时代一些沉重的东西和动人的情义，吴宇森导演以舒服而流畅的方式表达了出來，比上自是有不足，但比下余太多，绝不该一天只有一两场的排片。
看过,2015-07-31 10:54:25,5.0,20,能够支撑他们活下去的是信念，是那份执着般的相信与勇敢。生不逢时的感情注定颠沛流离，女人们在那个年代所表现出的坚毅深入人心。而我们何其幸运
看过,2015-08-02 18:20:15,4.0,14,大氣磅礴，如果沒有上部拖沓的敘事依照下部剪輯來看，太平輪不會只拿7的排片拿每天1000萬不到的票房，有些事情不是一個人能決定的，不想談論這個市場也不想跟于冬那樣馬後炮，唯有心酸啊。
看过,2015-07-30 21:33:54,2.0,10,惊呆了，前50分钟有40分钟闪回上集情节和人物关系，那请问导演为什么要拍上集啊？为了让我这种两集都看的观众有双重日狗超值享受吗？合起来四个多小时一共只有15分钟在船上，沉完船还有15分钟卡大脸特写的海面求生把幸存客串明星再杀几个。三对情侣居然想象式HE成女权题材，碉堡。两星。
看过,2015-07-30 23:52:51,4.0,17,看了《太平轮：彼岸》最想要的是一个章子怡乘船随行宝，太能干了！生命力顽强，关键时刻能救大人，救小孩，救日记本。。。水性特别好，真是太有用了！＃看过上部的同学表示前面大半个小时的回忆杀太难熬，但没看过的同学可以直接看这一部了，恭喜恭喜＃
看过,2015-08-02 18:34:16,4.0,11,章子怡不容易呀
看过,2015-07-30 00:15:20,3.0,10,即使请了徐克来剪辑也无法挽救这么无力的故事
看过,2015-07-31 01:02:53,4.0,15,听说前四十分钟是上部回顾，正好让我补了前面剧情。不过看了前一小时真是可想而知上部有多难看…想讲的太多故事线杂乱，花了电影2/3的精力人物、承载却还是薄…只有沉船戏凭着看人性还能稍入戏。对章子怡和宋慧乔的爱是停不下来了。黄教主我就想一巴掌让他停止装逼。好吧看在片头有公司名字加一星。
看过,2015-08-02 20:09:10,4.0,11,一部国民时代群戏，几对人物的线索通过重新的剪辑显得更加清晰，主题也相对更突出。船难只是这部戏的噱头，真正的重点而是因船而结缘的有关海峡两岸的人们和那个动荡的社会。
看过,2015-08-07 10:22:02,3.0,5,这是面对1949的多方历史回顾，众多角色构成了从此岸到彼岸的The Crossing(英文片名)。将前集剧情压缩在前40分钟内，显得较为仓促；后半段力挽狂澜想表达历史洪流中个人命运的无常，与之后船难的戏码达成统一。两集取长补短合为三小时会更佳。
看过,2015-07-30 23:43:03,4.0,79,技巧都没问题，美轮美奂的大片规格，国内少见。但是叙事太平太淡，海难的重头戏铺陈不够，如果能从用力猛煽的悲欢离合情绪中抽离一点，讲讲时代背景，人情世故，甚至搞搞笑，或许能把灾难反衬得更有悲剧意味。
看过,2015-07-30 21:00:46,3.0,11,金城武老了。
看过,2015-07-18 09:05:39,1.0,13,章子怡越来越倒退，不忍直视。
看过,2015-08-01 18:31:42,3.0,7,比上一部好看 黄晓明戏份很少比较高兴
看过,2015-07-30 20:43:14,4.0,17,有一颗星是给罗大佑的音乐的；片子节奏慢，不是烂片，但与时代似乎有些格格不入；太平轮，既是历史也是隐喻；想起了东方之星……💔
看过,2015-07-31 00:07:55,2.0,12,红尘中的男女经历忧患，但依然死于红尘。剪辑依旧不给力，庞大的叙事，海量的素材， 犹如最重头的沉船戏一样混乱，悲情不来自生死，也依然没有动人的那一瞬。
看过,2015-08-02 08:50:40,4.0,239,泰坦尼克落水后好像没拍出人性中最肮脏的一面，太平轮倒是显露无疑。
看过,2015-08-02 23:12:56,4.0,7,这是一部非常正常且好看的成熟工业电影，不值得大惊小怪。对俺个人而言，观感就跟片子里1949年上海的一号歌星吴莺音的《郎如春日风》一样，是想要将所有线索编织成密实落网但匠气太浓的未遂野心，情形如同《喋血街头》，想说的太多，能说的太少，但还是那句话，这是如今一部难得的“正常”的中国电影
看过,2015-07-21 22:48:51,1.0,19,吃逼吴 又来了，快闪开。
看过,2015-07-30 21:13:13,3.0,5,有一半是上集回顾吧 masami的镜头对我来说不能更恐怖...ps 大嫂真全能...
看过,2015-07-31 17:23:46,0,6,有人非问我杨贵妃和太平轮有啥共同点，我急了回了一句：一个有隆基，一个有基隆 #红星太平洋#
看过,2015-07-26 12:22:58,3.0,11,因为《太平轮》里有金城武，所以，整个片子的格调都被提高了，因此。。。我很期待。
看过,2015-08-02 18:58:39,4.0,10,三星半 本来在看完上部后是完全不做期待的，纯粹因为强迫症必须看完下部觉得圆满遂去了，结果还觉得不错，败笔就在于可以一部讲清的事非得2部来圈钱。配乐不错是霓虹的，演技嘛国际章的确还是秒了 ，佟大为人设不错 ，略略有压抑 。这也是票房扑街的原因吧
看过,2015-07-30 21:37:33,2.0,13,坑逼大奸商 祝票房仆街
看过,2015-07-30 21:41:14,3.0,5,剧情太拖沓，不断地穿回上部剧情让人很出戏...能够感觉导演想刻画乱世下爱情的努力，但现在整个故事感觉即使没有太平轮这个背景也是成立的，所以反而有一种借太平轮事件造噱头的感觉...最后结局想借宋慧乔之口烘托乱世的主题，但因为前面群像刻画的无力，显得不痛不痒。为俞飞鸿、金城武加一星
看过,2015-07-30 22:10:15,3.0,8,花了半个多小时重复上部故事，前面看得略捉急。1小时18分钟后才开船，所以沉船绝对不是重点。明明讲的是乱世浮生这样一个有情怀的故事，却起了个以为是灾难大片的名字，怪不得观众不买账。但是真心觉得不难看，只是不适合现在碎片化快消化的文化。再次被金城桑帅哭，我是不折不扣脑残粉
看过,2015-08-01 16:32:21,4.0,8,如果一开始就是下部这一部上，不会是现在这个样子。上部是实在让人嫌弃，下部是实在让人动容。配乐是近5年华语电影里最好的吧，票房扑成这样太可惜。
看过,2015-08-01 09:34:37,2.0,7,一星给长泽雅美，一星给胶片摄影。其余都是渣渣，吴宇森拍的什么玩意儿啊，半集都是上部内容，死掉的黄晓明不断还魂，3D居然是用jpg做出来的电影我还是第一次看到···坑钱也要有个底线啊
看过,2015-08-01 15:54:04,1.0,9,华语电影界最有声望的一批人拍出的远超观众想象的烂片。其实我看之前已经不抱期望了，但是。。原本期待的海难戏大场面被拍的无比敷衍，只有令人惊诧的章子怡堪比奥运冠军的游泳技能。
看过,2015-10-06 20:45:06,2.0,5,5/10。比[三城记]还难看，大量杜撰的戏剧冲突导致滥用巧合，怀疑两片的编剧是互相抄袭，比如沉船那场戏，水底救美还遇见老冤家的桥段怎么都有。刻意联系起上部的闪回、重笔之处多到滥觞，极大妨碍了叙事的连贯性；难民争抢救生衣的冲乱场面合格，爱侣们痴情思念的模式渲染得肉麻，只剩主创在自我感动。
看过,2015-08-01 00:05:47,3.0,4,比上部好，因为剧情推进和相聚船难，命运的流转感出来了。音乐虽满，但岩代太郎的配乐太好听。金城武颜值演技双修，劝弟回家那场戏令人动容。电影浪漫、深情、却实在是老派，一切可感知却又一切无法代入，造成了整个项目现在的尴尬。当然，出于审美，我还是宁买船票勿买煎饼吧。
看过,2015-07-29 11:25:25,1.0,16,有1了居然还出2。。。
看过,2015-08-02 00:56:21,3.0,4,真大片·真史诗，比我想象的好得多，也远好过吴自己的伪大片伪史诗赤壁。吴野心过盛，其实就是顶着太平轮的名号拍大江大海，大切口反而应接不暇，高潮与收尾都草草，还不如单纯做船，小切口做大文章。但是，该提的点都提到了，词虽然过于直白，但有不少句写得相当精到，要是做成HBO式的迷你剧可能更佳
看过,2015-07-31 23:12:03,1.0,7,在没有黄晓明的前提下居然拍得如此之乏味，以致让人怀念起上部教主的墨镜……
看过,2015-08-03 09:25:42,3.0,3,重剪化腐朽为神奇，两部剪成一部，本来就应该这样。片名如果别聚焦在太平轮可能更好，海难只是一部分。谭飞老师说，吴宇森是在互联网时代仍旧一笔一划用毛笔写字的人。海鸥白鸽芒草大海，每一帧都那么唯美，扎实精湛的千人场面， 不卖噱头不炒作，这才是真正严肃大片应有的情怀和气度。
看过,2015-07-30 22:12:24,2.0,12,船大掉头难，吴导拍的史诗的能力捉襟见肘，群像虽然丰富，但大多苍白无力，疲于应付。不过那么大的投资，所在电影院一天只排了两个场次也确实把我惊到了，看来这巨额投资基本要打水漂了，吴氏大片在国内宣告彻底失败。
看过,2015-07-31 18:42:47,4.0,6,总体而言还可以~好于上部~回忆上部的同时出现一些上部没有的片段~徐克把黄教主的儿子剪掉了是吧？~我只想说干得漂亮！！！
