看过,2016-11-30 17:27:22,3.0,1204,你搞玛丽昂歌迪亚这样的对象不是给自己找不痛快么？应该搞幂幂baby甜甜这样的，你永远不用担心她会欺骗你，因为她们都没啥演技。
看过,2016-11-27 15:14:53,2.0,318,平铺直叙，难看到爆。布拉德·皮特接这片等于一下黑了自己两次（“无耻混蛋”+“史密斯夫妇”）。看着戏里毫无化学反应的两人，想到前阵子还传马良插足朱皮恋，我只想说造谣的人你的脸有那(+﹏﹏﹏﹏﹏+)么大！
看过,2016-11-29 20:02:07,3.0,291,很像是吴宇森的新片，主角是黄晓明和舒淇。
看过,2016-11-30 18:28:28,3.0,214,好好做皮特就这么难吗？为什么非要努力成美国黄晓明，谁逼你了，到底是谁逼的....#另外，为什么让马修·古迪扮丑出场不到2分钟，演一个伤残配角，天真的以为是Oscars Moment 吗！#
看过,2016-11-25 14:06:02,3.0,195,纯靠女主一人来撑的片子 皮特离个婚直接离成面瘫了 片子整个节奏一塌糊涂 多给一颗星是因为那幕黄沙满天的车震
看过,2016-11-23 05:53:01,3.0,177,皮叔的语言技能为零。魁北克口音表示这是它被黑得最惨的一次。卡萨布兰卡的一段拍那么长，是为了给之后Max的行动一个充分的动机。然当妻子是间谍的可能被提出后，人物内心的纠结和夫妻关系的紧张都没能跟进，难免就cliche了。冲刺不够，高潮就像草草收尾。好在景和衣服还有表演都良心。
看过,2016-11-30 20:49:36,3.0,258,这片子的评价真不该这么差
看过,2016-11-30 23:01:15,4.0,149,当钢琴前的玛丽安抬眼，隔壁三十几的陌生男人泣不成声。忽然就淡忘之前好些冗余、驳杂、急促和无理的地方，只记着这假戏真做的契合，记着触不可及的美丽远方，记着魁北瓜，记着我爱你。原来之所以世事顺畅，只是为了让身不由己的牺牲怆然天昏。马良演这类角色总是极出彩，皮特也是。三星半。
看过,2016-11-14 23:16:34,3.0,126,看完片除了“哦。”说不出来其它的。
看过,2016-11-30 15:10:34,3.0,117,法国梅婷拿了real梅婷的《父母爱情》剧本，结果拍到一半嫌弃婚姻太腻歪，直接领了盒饭走人。泽米吉斯前半段铺垫了那么多梗，最后都没用看得我有点着急。除了我马良君美到爆炸的置装（妆），皮特直爽傻的演技。我还是为公号狗们想了诸如《阿甘正传的导演在新片里告诉你现在指甲油流行什么色号》的标题。
看过,2016-11-15 01:59:05,4.0,124,【沙尘暴围剿住车中做爱的间谍鸳鸯】这一幕完全秒到我了！August Diehl 一出场思路就飞到《无耻混蛋》去了……罗伯特·泽米吉斯还是很强的，沉稳之中把悬疑节奏缓缓铺展。然而我不喜欢这个结局，太无味……确切地讲，我是讨厌这个结局。
看过,2016-12-11 10:59:39,3.0,80,我就想知道皮特拍这部片子脸做拉皮了么
看过,2016-11-30 17:26:52,2.0,101,平庸无趣，一路琼瑶苦情戏
看过,2016-10-31 17:04:14,4.0,79,影片呈现出的不仅是谍战，更多的是将感性的爱情融入理性的战争中
看过,2016-11-15 08:45:45,4.0,71,手法、内涵、氛围都非常老派，没有新事，但老派的美感可能正是导演的追求，包括展现玛丽昂这个女人的优雅又狡猾的美（有些神态竟神似《大西雅图帝国》的吉莲）。有些细节不错，皮特角色行为的可行性有待推敲，演技被比下去了！
看过,2016-11-14 22:06:46,4.0,91,@大光明首映礼，见到了布拉德皮特！我的小心脏到现在还在跳动。剧情没什么亮点，但皮特和歌迪亚太有个人魅力，眼睛根本舍不得眨，歌迪亚每一身衣服都仙到原地炸裂！
看过,2016-11-30 19:50:10,4.0,78,做事超专业，负责专业地亲自去查证真相，知道真相后只问一句你到底爱不爱我，然后做出一个很男人的选择，我爱Max这个角色！黑演技的，我就说一点，Max答应妻子第二天陪她和女儿度过最好的一天时转身下楼梯那个扭头努力克制住痛苦的表情有多动人！另外，复古大法好，太美，赞美服装部门。
看过,2016-12-01 00:40:19,4.0,86,意外好看。沙尘暴里啪啪啪、空袭战地中生娃儿。猜疑求真的一大段戏非常享受。皮特的角色总是一成不变，玛丽昂歌迪亚却美出新高度。请给服装设计师涨工资。
看过,2016-11-30 15:18:28,2.0,55,要不是因为玛丽昂我才不看这个，烂片我见过，但烂的这么呆板还真是活久见。
看过,2016-11-24 11:43:42,3.0,96,大构架里的故事实在太干了，而且神散的很。还是个典型的虎头蛇尾，前面轰轰烈烈的爱与战了一个钟头，最后越来越蔫。但是女神般存在的玛丽昂.歌迪亚实在是太美了，另外我怎么可能忘了黄沙漫天里的车震呢！
看过,2016-12-01 22:20:54,3.0,37,一部骂不出口的大闷片，要不是有两位大明星撑场，恐怕要闷死九万人了。到看见片尾演职员字幕的字体字号……天那，导演是有多老了。
看过,2016-11-30 23:41:06,3.0,30,360度无死角沙漠车震不可错过，年度性爱场景有力争夺者。
看过,2017-02-17 22:54:29,4.0,27,如果你曾经全心地爱过一个人，如果你曾经因为全心地爱一个人而勇敢过，甚至不惜与全世界为敌，你怎能不被感动？
看过,2016-11-30 18:53:41,3.0,17,哎呦，不要以为有一个凄美动人的结局就可以让人忽略这无比牵强的漂白女主的因由啊。勉勉强强能看吧，何况有帅哥美女，这么说也不对，应该说毕竟有帅哥美女所以这片勉强能看。
看过,2016-12-01 09:26:59,4.0,16,马良每款口红都美炸了！
看过,2016-12-03 18:33:21,5.0,36,分数不公平，片子还可以的
看过,2016-11-30 23:41:45,2.0,16,不知泽米司机咋拍这片，复古精美二战谍战，居然搞成沉闷乏味的苦情雷片。皮特疑神疑鬼，歌迪亚卖弄风骚，除了讯问珠宝商与眼盲病人、伦敦夜空袭、横扫德军分部，偶尔用爆炸与枪响刺激神经，其余一塌糊涂。车震是黄沙滚滚看不清的，敌人是不堪一击活靶子，第三帝国女特务是一枪爆头自杀，写遗书乱煽情的
看过,2017-03-04 11:01:21,3.0,10,这个时候就会知道英国病人有多好
看过,2016-12-04 15:20:42,3.0,8,中老年版史密斯夫妇，故事老套，剧情平平，没有什么反转和惊喜。皮特的光芒完全被歌迪亚的演技盖过。
看过,2016-11-28 16:39:10,3.0,21,服装出彩，剧情老套。马修 古迪为什么只扮演了一个出场不到三分钟的残疾人！
看过,2016-11-29 12:17:38,3.0,18,歌迪娅真是古典美人(花心)(花心)，剧情神马都是浮云。
看过,2016-11-30 22:25:55,3.0,11,整部片子除了两个主角以外基本没有其他配角的事，一场戏两场戏就给打发走，尤其卡潘的角色完全多余的还让观众分散注意力。卡萨布兰卡的部分拍的很有老片质感，但后半段马上软掉，镜头语言差评，完全没有悬疑气氛，一路苦情下去。
看过,2016-11-30 02:09:37,4.0,18,乱世儿女情，一眼万年深。
看过,2016-11-25 16:44:34,2.0,9,乏善可陈的一部二战片，两位主演之间毫无火花，尤其是布拉德皮特，整个演技尴尬。服装还行
看过,2016-10-31 16:41:08,5.0,50,布拉德皮特的又一力作啊，有皮特我就支持。感觉像二战时期的《史密斯夫妇》，一定很帅
看过,2016-11-30 07:03:51,2.0,11,2 果然皮特劈腿马良离婚茱莉的绯闻炒作的很是时机，要不然但凡看了这电影的谁会相信银幕上毫无化学反应的两人私底下已经暗结珠胎干柴烈火，不过抛出这种营销手段足见电影本身是多么没有亮点了。皮特最后哭戏还上了慢镜头，演技没飙出来，皱纹倒是挤得满脸都是，看得不能更清楚。
看过,2017-11-20 13:19:46,5.0,17,迷人的Marion
看过,2016-10-31 16:55:20,4.0,31,爱你，愿于信仰为敌 。这部谍战片在战争之外刻画的爱情与人性也非常动人
看过,2016-12-03 23:53:46,3.0,6,一直以为海报皮特在摸马良的胸器……
看过,2016-11-25 07:10:52,1.0,14,和余则成翠屏差了一万个史密斯夫妇。什么烂玩意。翠萍和余则成分离那一刹那千言万语化作无言的表演比他铺垫了全篇的牺牲震撼的多。简直是对女神的浪费
看过,2016-11-29 00:56:23,3.0,15,借谍战之名的爱情片。仅靠对颜值的喜爱撑起全场观影，因为故事确实很套路。
看过,2016-11-30 21:11:51,3.0,7,复古的二战片，布景撑全场。剧情有bug，皮特都那么威武神勇，还惧怕一个第三帝国特工……
看过,2016-11-30 15:28:36,3.0,12,高潮来得太早
看过,2016-11-30 19:17:04,4.0,22,"3.5,反战片，有几处精彩的片段，其它都比较老派；皮特只有帅，而玛丽昂的演技则可以用片中一个角色的台词：“她是整场晚会的焦点。”回来看豆瓣才发现还有马修·古迪参演，请问大帅哥你在哪？"
看过,2017-03-02 00:28:13,4.0,3,扯蛋，哪个间谍不会弹钢琴？！参考影片《尽管雪落》
看过,2017-02-26 19:38:10,3.0,5,女主这想钓男主的意图这么明显竟然都看不出来…………果然精虫上脑的时候各种投怀送抱都能解读成两情相悦，服气！
看过,2016-12-05 01:33:54,3.0,7,玛丽昂.歌迪亚，从不是我喜欢的女演员，从相貌和气质，而且总接一些诸如《两天一夜》和《锈与骨》这样的非残既苦电影，直让我相信她就是“法国梅婷”。不过论演技，她远强于对手戏的布拉德.皮特，让这部并无新意甚至有些粗糙的二战间谍片，有了情感逻辑成立的理由，甚至是让刻薄观众都结尾落泪的理由
看过,2017-02-19 23:12:43,2.0,3,坦白说是被皮特和玛丽昂因戏生爱的八卦骗进来的。只想说我呸！玛丽昂美得不可方物，皮特简直就是根丑木头，毫无火花好嘛。但不管怎样太喜欢沙尘暴中的车震。剧本结构问题？太平了。
看过,2016-12-04 12:32:10,3.0,4,第三部我马良在天朝放的电影，四十多岁的人呐这颜值，全片都靠我马良颜值撑起来，皮特全程无演技臭脸，看到最后有些心塞，想起了2010年三刷盗梦，转眼6年过去了。。
看过,2016-12-01 22:02:26,4.0,10,后半段问题确实相当大，从动机开始就出现纰漏；但非常惊喜地发现年过六旬的狂人泽米基斯在本片中居然展现出了此前他从未有过的自控力。
看过,2016-12-09 15:01:07,3.0,6,其实前面刺杀行动简单的让人就觉得太假，不能想象警惕性这样差的菜鸟特工居然能够活下来。看来老皮特的魅力不在，居然不能捕获老婆成为双面间谍，难怪离了。
看过,2016-12-08 07:53:35,2.0,9,马良表示，我一个人撑得好辛苦。
看过,2016-11-30 21:56:11,4.0,21,意外的喜欢，一部以间谍之名讲述爱情的剧情片，从头到尾都是浓浓的好莱坞黄金年代的味道，剧作扎实，叙事流畅，老导演的细腻和对细节的苛求一览无遗，让人想起去年的《间谍之桥》。
看过,2016-12-03 13:56:49,4.0,3,皮特演技有没有保证不知道，但是他挑片绝对有保证
看过,2016-11-30 13:17:53,3.0,7,一句话概括本片：“最后一个问题”、“爱过。”= =不管是演员还是剧情设定还是时代背景，感觉都是可以拍得更好的，但最终出来这么个干巴巴的成品真是浪费。
看过,2016-11-30 23:02:40,3.0,5,剧本无聊到爆炸！但是！后半部分发生在我每天回家都会路过每周末朋友圈都要发的hampstead！！！！然后看着二战时期被无数炮火空袭的伦敦夜空下的hampstead我真的！！没词儿了我！！！啊啊啊
看过,2017-02-11 19:49:29,4.0,1,人物造型很不錯，就是沒好好玩槍。
看过,2016-11-30 12:39:47,3.0,7,不负如来不负卿，此事古难全；本想致敬卡萨布兰卡，一不小心搞成了温情版史密斯夫妇，一黑到底才嗲；马良美似仙，皮特全程黑脸（是因为离婚了心不在焉吗，和女神无cp感）我家马修古迪到底哪里得罪导演啦（抓狂）！
看过,2016-11-30 15:56:56,3.0,2,皮特在电影里还是挺年轻的，没有很大高潮，没有太大悬念，平淡无味。
看过,2016-11-30 20:58:21,4.0,11,还是在同人文里了解的Lysander飞机在撤离敌后SOE特工和坠机飞行员行动中的功劳，本片里皮特提到他以前驾驶Lysander参加敌后行动，那他以前可能是138中队的(第一支专门成立为SOE执行任务的RAF中队)。不明白的点是，作为W/C他怎么能命令G/C去飞作战任务？
看过,2016-11-30 22:52:58,3.0,4,65/100 又一个“浮士德”类的故事，这类作品常常喜欢以男性视角来偷窥女性，一个看似完美却隐藏了秘密的女人，让人联想到了俄底浦斯情节（最终发现我们的母亲都不完美）。中国这类故事更是多如牛毛，新白娘子传奇、倩女幽魂等。影片制作精良，可也只能到这一步了，Robert Zemeckis一直在回春的路上...
看过,2017-03-05 17:28:01,3.0,4,玛丽昂太美了
看过,2016-11-30 19:44:52,2.0,1,一切都很无力，无论是调情还是暗杀。已经为什么Brad Pitt这么年轻。
看过,2017-04-02 09:06:06,3.0,5,是谁和我说皮特这里好帅的？！整张脸如图大了肉毒杆菌僵硬的不得了全程面瘫从头到尾。歌迪亚演技与服装设计撑起全片，整部电影节奏缓慢沉闷，唯有在后半场接近结局时才让人不禁屏住呼吸。国仇家恨面前唯有死亡才能为爱赎罪。
看过,2016-12-05 10:03:33,4.0,7,意料之外的好看~！尤其是对于颜狗的我来说，服装造型简直太美了，玛丽昂每一套出来都不忍惊呼~第一次觉得丝质睡衣是那么的美。故事也很好，没有bug，最后部分哭成狗我会说吗！反正各种和自己的点，推荐给喜欢外表及内心的你们~
看过,2016-11-30 14:02:59,3.0,3,以后周三是普通2D进口片的专用日吗==看的时候笑了。Robert Zemeckis也太爱前面搞一段复古小风情后面才开始讲正事了的套路了（这和他去年的The Walk一模一样）。有一版的海报封面上的皮特感觉好像在演----《沙漠女王》。总的来说，四平八稳，没有惊喜也没有扑街。
看过,2017-01-06 04:38:32,2.0,10,剧本的双商同时下线……皮特和马良毫无化学反应……（有些片子看完会突然明白主演怎么会出轨，甚至觉得情有可原，有些片子则让你对于他们的出轨莫名其妙，甚至怀疑只是炒作手段……）
看过,2017-02-21 21:10:58,2.0,1,马良很漂亮。但是为什么片子这么难看？片中所有人都是阿甘那样的智商吗？
看过,2016-12-08 02:23:10,2.0,5,无聊苦情的戏码，不厌其烦的去印证爱。
看过,2017-05-09 21:37:33,2.0,1,论喜剧效果，这片比史密斯夫妇好笑多了。拍的匠气，特效假到不行
看过,2016-11-30 16:45:39,4.0,2,确实和同题材相比难算经典，也提前猜到了结局，但最后居然流了两滴眼泪。《间谍同盟》这个翻译有点儿误导，明明就是爱情片，就叫《同盟》可能好点儿？第一次get到marion的美，皮特还很帅啊哪里僵了🙄️
看过,2016-11-26 19:41:12,3.0,7,披着间谍片外衣的爱情片，风格复古令人眼前一亮，但高潮欠奉，马良在片子里很美，就是和皮特没啥子火花🔥。。汗
看过,2016-11-30 18:21:21,3.0,2,Marion怎么这么美
看过,2017-02-28 23:33:22,1.0,2,结局走向太无聊了，马良再这么发展下去就是欧洲赵薇了啊。
看过,2017-02-01 10:19:37,0,1,电影真的很难看，衣服确实挺好看。
看过,2016-11-14 21:55:10,4.0,14,皮特皮特皮特！！
看过,2016-11-30 20:37:20,3.0,3,被预告片骗了，还以为是爱情动作片，没想到是爱情片，皮特和马良的对手戏毫无火花，导致整部电影就跟一潭死水一样，导演对爱情戏的把控能力不足在以往的电影里就领教了，在这么一部纯粹的爱情片里更是把缺陷放大了
看过,2016-11-24 06:30:10,3.0,12,前半段让我想起几天前的#摩洛哥#之行，后半段看得我想睡觉，剧情老套不说#布拉特皮特#这脸拉皮去皱做的也太明显了吧，演的跟面瘫患者似得，反衬#玛丽昂歌迪亚#演的不失水准，还有皮特的法语博得在场法国人一片笑声
看过,2017-03-02 13:51:03,4.0,4,所有谎言最后的结局不是真相，是爱不爱我。
看过,2016-12-01 01:37:58,2.0,1,我不懂为啥女主要死
看过,2017-02-18 12:33:09,2.0,1,太无聊了，叙事直接也没点激情，干巴巴的发展而且皮特和马良真的没有火花，其实可能是皮特更老了吧，一脸沧桑老成持重的样子。马良的造型十分漂亮，倒是养眼。
看过,2016-12-02 20:40:17,0,3,从来没觉得布拉德皮特帅，除了这部...
看过,2016-12-03 19:31:58,3.0,1,2.5 意淫式剧情，bug多得漫天飞舞，既然爱情大过天早干嘛了呢赶紧脚底抹油啊，白苦了这么乖不吵不闹的娃早早没了麻麻，不辣的某人整个儿拉着脸没有表情的也是不容易，马良衣架子prprpr，古迪苦逼有思想准备出场仍心痛炸了，估计大家都是被泽米吉斯名号吸引了来的吧，结果曾经的大导已不复当年勇
看过,2016-12-01 07:59:46,3.0,2,如果说布拉德·皮特的传统是演完间谍或者特工片就离婚的话我只能说这片演晚了。还有，这是个悲伤的故事。@不沾边的龙
看过,2016-11-30 10:24:52,3.0,5,全片走到后半段冗长到难以忍受 即使已经能预料到结局很悲伤 剧情很虐心 但是在女神一人我饮酒醉撒酒疯和男神一脸没从在海边片场走出来状态的双重夹击下 本来能搞成2016版的魂断蓝桥的结果搞成好莱坞圈钱版东风雨 怎么说呢 人到中年 别闹离婚。
看过,2016-12-06 15:02:50,4.0,3,无视了那些乱七八糟的豆瓣短评，幸好去电影院看了。虽谈不上经典，但泽米斯基导演的水准保证了是一部中上水平的可看之作。
看过,2017-02-06 02:13:05,3.0,2,全程“演戏感”巨重 就这样都能说他们有火花？疯了吧
看过,2016-12-29 16:17:38,3.0,2,挺流畅的商业片，摄影、美术、服装各部门都有质量保证，剧情虽然很容易猜出来，但节奏不差。离佳作还差一口气的地方是皮特的角色太英明神武了，在这种严肃题材里面就像是从外星空降来的。
看过,2017-03-06 01:15:42,3.0,1,泽米吉斯功力还在，其实片子很顺，前面太“正常”了，所有人都在期待后面的反转，然而反转后照着特别光伟正的人物形象去写，少了些细处的深入
看过,2017-03-17 04:52:06,3.0,1,前半段五星到后半段两星……皮特贡献出了“大家都知道我离婚我难过我最近心情不好”的呆鸡演技…歌迪亚全程碾压。后半段无神无形无火花…应该给服装师加🍗啊喂。
看过,2017-02-11 11:56:09,3.0,1,宏大的背景之下，这个平淡的间谍夫妻的故事根本衬不起。沙尘暴天的车震拍的很美，空袭中诞生的婴儿也让人无限感慨。假戏真做的爱情在政治背景下注定是牺牲品，论中年夫妻如何互信坦诚的过好小日子。玛丽昂的演技明显要好于皮特，长得帅难道就不需要演技了么？面瘫是怎么回事儿？
看过,2016-12-01 21:49:12,4.0,1,有点革命之路的感觉
看过,2016-12-01 19:11:34,3.0,3,两个人包场了，马良真美，又有女人味又美，魅惑众生那种，而皮特老了，脸也僵了，在电影里倒是演了一个绝佳的好男人，英国好男人。
看过,2016-11-30 19:45:48,3.0,1,三星全给玛丽昂
看过,2016-12-01 09:34:42,3.0,5,将战争对普通人的影响，缩小的一个家庭的层面。但整体比较平庸，没有太出彩的设置。皮特求证了半场电影的真相，根本没太大意义。既然已经做好了要逃跑的准备，其实只要直接去问玛丽昂就好啦。反而给皮特设置那么多内心挣扎戏，他却完全传达不出，实在是个遗憾。
看过,2017-02-28 20:45:17,2.0,0,披着谍战外壳的爱情片，好虐，略失望。
看过,2016-12-01 15:54:20,4.0,4,这其实是打着谍战幌子的爱情片啊。泽米老司机近年来回勇，前作 The Walk 拍得就不错，这部也是稳稳的复古学院派，起码他故事讲得娴熟，你不会因为技术上失误而被打断。问题一是在于皮特和马良化学反应不够，演技也不匹配；问题二是出在对结局的处理，年轻观众如我是讨厌目前这个的。
看过,2017-03-05 01:57:46,2.0,1,比茱莉配德普那部还没有火花。。。
看过,2017-03-05 21:04:53,3.0,1,皮特的演技真的是和面部皮肤一样直线下垂。。
看过,2017-03-15 23:28:36,2.0,1,故事根本撑不起一部电影呀……
