看过,2017-06-28 00:13:57,3.0,30,叶德娴才是这片子的灵魂啊
看过,2017-07-04 17:27:29,3.0,6,制作无可挑剔，但是很好奇这剧本（故事编排、人物塑造和角色动机都莫名其妙）是如何说服Ann导的。
看过,2017-07-07 10:09:45,3.0,9,散文诗
看过,2017-06-21 23:25:23,5.0,18,虽然我没觉得电影好到惊人，但绝不至评论说的这样不堪。剧本本身是散，但拍出来的完成度远超预期。革命并非只有轰轰烈烈，导演不想塑造英雄，一群本非焦点的平凡人成为主角，观众自然觉得不习惯。我头一回觉得Ann真的放开创作了，她在构建她的理想世界。那种一条主线通大路的故事，不如去看建军大业啦
看过,2017-06-27 14:18:54,2.0,145,支离破碎无勾连，大导也不能这么随意啊，好歹形散而神不散也行啊但也没啥神。。。霍建华还是回去演面瘫电视剧吧，周迅一般，彭于晏还可以，叶德娴满分。王菀之有点小惊喜竟然可以演傻姑。其他人。。也就是个韩剧中的酱油角色的演技。
看过,2017-06-30 14:49:23,2.0,107,代导作品，不多说，完全没有一点点许鞍华的影子，不知所云，霍建华我求你别再来辣眼睛了
看过,2017-07-04 00:54:32,4.0,10,看的國粵語版本，一班香港演員的casting入型入格，時代群像刻畫尤其有味道。每一場戲的導演處理都在水準之上，連動作戲也不馬虎。唯一問題仍然是許最不擅長的劇本，結構和節奏上都不乏改進空間，劇本給周迅的空間有限，更不用說年紀和廣東人形象上就先天不適合，難怪被葉德嫻搶光風采
看过,2017-07-01 23:12:25,3.0,14,最后那个从1944横摇到2017的镜头特别棒，把对于片中那些热血儿女为了国家抛头颅洒热血的致敬很巧妙的表达了出来。许鞍华在生活状态上的表现一如既往出色，相比比较主干的情节就缺失了，周迅霍建华彭于晏等主角的刻画也偏薄，且基本放弃了春夏的角色。另外，娴姐什么时候成了港独？瞎高潮什么？
看过,2017-06-18 18:38:21,5.0,327,霍建华的成长进步有目共睹，演技一直很好又非常敬业，这次的电影又是抗战剧，非常喜欢！
看过,2017-07-10 22:13:03,3.0,6,纽约AMC看的。很通俗，漂亮的人都是好人。
