看过,2017-12-12 13:26:44,4.0,0,可以的，除了全程有点紧促外..
看过,2017-12-04 00:35:27,5.0,2,坚决执行党中央打满分的任务。
看过,2017-07-02 13:54:11,4.0,1,七天伤亡五万人，湘江之战是很悲壮很感人的故事，这部戏文戏可以，但武戏欠火候。
看过,2018-03-18 19:36:58,3.0,0,20180318，看完妖猫后使劲想前一个看的啥，就是没想起来。妈呀哈哈，碰巧又翻到了，可喜可贺。终于明白啥叫实践才是硬道理了，纸上谈兵终是假啊。尤其是“我要和李德同志离婚！”，妈呀，立场就是正！当时为啥结的？
看过,2018-01-29 21:10:33,3.0,0,"两边都是活靶子对打么
另外很重要的一点！组织的命令哪怕是错的也要服从！！！"
看过,2017-06-29 08:51:43,5.0,1,看过之后真的特别佩服老一辈的革命家，正是有了他们才有了现在的一切
看过,2017-07-05 16:22:03,4.0,1,有看到好多说什么被逼去看的我只从他们的话里看到了炫耀.傲慢，比竟一般人谁会逼？想我这种普通人上映5天了才知道，找来找去找到一家寒酸的连装修都只装修放映厅8排厅影院里看的。顶着中午的大太阳转了2次车去看了我感觉是  值得，精彩有感动有，激动生气伤心感动和笑影片都有带给我
看过,2017-12-24 14:39:03,3.0,0,那会的国人真是勇敢，退无可退的情况下逼人奋勇。
看过,2017-06-28 23:57:28,4.0,1,历史要铭记！不能忘记先辈们用鲜血给我们带来和平稳定的生活的事迹！
看过,2017-07-04 22:04:40,3.0,0,没有气势恢宏，也没有内涵深刻，一般
看过,2017-06-29 09:14:10,4.0,1,很好看的战争题材剧，演员的演技到位，比那些打着抗日题材的雷人剧好看多了
看过,2017-07-09 08:07:12,2.0,1,场面宏大，人物性格鲜明，凸显主旋律
看过,2018-01-08 14:49:43,5.0,1,敦刻尔克就五星    血战钢锯岭就五星     拯救大兵瑞恩就五星？      血战湘江就是垃圾？   战狼就是垃圾？  
看过,2017-06-28 21:10:16,4.0,2,标准的红色电影，虽然主旋律性强了一些，但是体验还可以，张一山点赞，演什么像什么。
看过,2017-06-28 23:05:05,3.0,1,感觉还可以，我个人还挺喜欢看这种战争片的，就是有些地方有点太假了。
看过,2017-12-28 15:37:40,5.0,1,好看的战争片，打五星，鼓励、鼓励国货!
看过,2018-02-23 19:20:55,2.0,0,突突突，突突突
看过,2017-06-29 13:54:30,5.0,2,老妹说，颜值不够演技来凑，😂不过我倒是喜欢看演技在线的，挺不错的。
看过,2017-12-23 14:22:29,4.0,0,那些评论一零的是傻逼吗？
看过,2018-01-10 19:18:02,1.0,0,"
201801100夜看。"
看过,2017-06-29 09:46:54,4.0,1,战场就是人间炼狱，太残酷了……一根弦从开头绷到最后，主旋律拍成这样挺不容易的，真没想到是个女导演，大段的方言好评
看过,2017-08-24 16:48:40,2.0,0,不好看啊
看过,2017-12-21 18:26:42,4.0,0,真实 完整 感动 莫名其妙的低分
看过,2018-03-27 21:51:41,2.0,0,就算是主旋律电影也应该认真的讲故事呀…为什么此片中红军都用上德制轻型冲锋枪了？为了视觉场面而不尊重战争的实际残酷，我们不缺少好故事为什么就是讲不好嘞…
看过,2017-06-29 08:20:49,4.0,2,看了觉得挺震撼的，反映了当时的历史，有一种坚强的精神感染着我
看过,2017-06-28 21:08:03,5.0,1,在影片中还原这段英勇悲壮的真实故事，是对我们最好的传统教育，值得观看
看过,2017-12-16 17:43:22,4.0,1,勿忘历史
看过,2017-07-19 23:41:48,0,0,针对意识形态评价不太好吧，打分尽量是要看过的。
看过,2017-12-18 23:47:37,1.0,0,对于这种渲染内战的片子，一律一星
看过,2018-03-31 09:22:34,4.0,0,艰险之路
看过,2017-12-23 15:45:46,3.0,0,"老毛神话的太严重。
湘江的水真的红了。"
看过,2017-06-28 22:33:21,4.0,2,不忘革命先烈的初衷，拍的还行阿～还可以。
看过,2017-06-28 23:54:57,4.0,5,比较标准的主旋律电影，走的也是励志热血路线，保剑锋演军人也还是那么帅！
看过,2018-03-18 19:52:47,5.0,0,"中国革命要走什么。
  这电影给一分的都特么汉奸"
看过,2017-06-29 12:47:52,5.0,1,很不错的抗战片 而且有有张一山哎！！！酷死了 
看过,2018-02-15 15:56:09,0,0,我爸看得挺激动的。红军路过村里，老乡送红军那儿还是有些感动
看过,2017-12-11 18:41:59,3.0,0,我不明白那些喷子，说这是烂片毫无意义，你有本事能说个一二三出来？因为头脑里都是屎所以就开骂打差评，可怜。
看过,2017-06-29 08:46:14,5.0,1,冲着张一山去看的，还行吧，挺有那个时代的感觉。
看过,2017-06-29 08:48:54,4.0,2,还不错，不要忘记先辈们的贡献，值得一看！
看过,2017-12-14 14:05:12,0,0,艺术手法展现湘江战役，演员还算认真
看过,2018-03-27 16:27:47,5.0,0,百姓箪食壶浆 晏如也
看过,2017-06-28 21:41:24,5.0,1,非常感人非常震撼的一部剧，不爱看历史剧的我都喜欢上了，不错
看过,2017-12-19 15:24:05,1.0,0,一如既往的烂片。粗糙的制作，不对路的枪械，啼笑皆非的称呼。。。烂片。。。
看过,2017-06-29 09:57:10,4.0,1,战场即炼狱，红军涅槃重生，激荡人生，为信仰而战，红军精神，好样的！
看过,2017-06-29 05:57:31,4.0,2,血肉淋漓，突然感觉自己生活在21世纪很幸福，国泰民安！演员演技都还不错，值得一看
看过,2017-06-28 23:17:28,4.0,2,全程没快进，不拖拉剧情跌宕起伏，环环相扣，演员表现超好看的入神
看过,2017-12-08 22:20:08,4.0,0,一部电影，应该带着对历史的尊重，对伟人的敬重去看，应该感谢导演呈现了当时的历史画面，应该去体会人物的内心。不被认可、绝处求生、坚持、果敢…每一种品格都应被尊重。
看过,2017-12-07 19:32:33,4.0,0,真令人感动落泪的长征红色电影！
看过,2017-06-28 23:21:58,4.0,2,刚好看了一点，感觉还不错，来给个评分！
看过,2017-12-09 01:33:05,4.0,0,老一辈人流的鲜血，才铸就了今天的辉煌，要知道战争是非常残酷的！国家的安定繁荣都是爱国人士用鲜血换来的！
看过,2017-08-02 19:49:07,3.0,0,真的不太推荐，剧情是硬伤，但拍的还不错。
看过,2017-12-15 20:58:42,2.0,0,虽然很一般 但是百姓们主动给红军们塞食物 他们不要的场景 真的有感动到我
看过,2017-06-29 11:14:28,4.0,2,电影很刺激，很热血。激励了我们一代代人
看过,2017-06-28 22:58:01,5.0,1,讲的是那个年代的故事，有些东西没有经历始终体会不到当时真实的感觉，但是民族的感情却是共通的，所以即使很多人说他垃圾，但是也不妨碍看完。
看过,2017-12-26 22:46:34,5.0,0,没拍好 剧情还是激昂的
看过,2017-06-28 22:38:09,3.0,2,冲着张一山去看的 不错 值得一看的红色电影
看过,2017-12-31 23:04:26,5.0,1,"铭记历史。
对于主旋律片子多些宽容吧，其实拍的真的不差。"
看过,2017-12-09 21:37:01,5.0,0,刚看完，我觉得拍的挺好的，紧凑直接，估计打低分的大部分都没看就直接打的
看过,2018-01-26 17:57:58,3.0,0,一般，
看过,2017-06-28 22:34:19,4.0,2,场面有些震撼，从未如此感受现在的我们有多幸福！
看过,2017-06-29 14:02:09,5.0,2,我个人觉得这次电影蛮好看 是我喜欢的类型
看过,2018-01-27 17:50:16,3.0,0,在部队看这样的主旋律片还是比较有感觉的，虽然全片充斥了各种爆炸大场面，极力想表现出湘江战役的惨烈，但很可惜，太过杂乱无章了，人物塑造也没有亮点。不过冲着自己的身份，给个及格吧。
看过,2017-06-28 23:27:55,5.0,2,一直对战争片不是太感兴趣，不过这部让我感到意外，值得一看！
看过,2017-12-27 17:13:02,5.0,0,没有死去的那些人，中国真不知道是个什么样子呢！
看过,2018-03-10 15:19:59,3.0,0,讨厌现有的人只要主旋律和歌颂就觉得假大空，可不管现在如何，当时的党和人民确实是在枪林弹雨之中换来的我们的幸福，怀念他们尊重他们记住他们是我们的责任，就电影本身来说，过多刻画左倾错误，人物刻画线比较散，不太清晰，战争场面让人感受到了那种绝望和心痛，但战争场面过多，总体来说很感动
看过,2017-06-28 22:32:46,5.0,2,1934年 湘江边一场血战 ，一场悲壮的战役，很好看 ，值得一看
看过,2017-08-25 22:01:40,3.0,0,个人角色的深度挖掘不够
看过,2017-10-26 21:10:34,5.0,0,全程硬碰硬，历史题材不能按平常电影评说，继续吧…
看过,2017-06-29 10:08:14,4.0,1,现在是危急时刻，没有退路，我们必须英勇献身！
看过,2017-12-18 23:17:40,1.0,0,"就红二师那个团抢界首渡口，半道阻击敌人那段，简直了。
一个营的人笔挺地端着枪杵在路上，可以搞退三个团。"
看过,2017-06-29 08:53:58,4.0,1,战争片一直很喜欢，电影反映了真实沉重的战争，值得大家买票观看。
看过,2017-07-24 13:07:07,2.0,0,怎么才能拍出集结号的战争电影。
看过,2017-07-03 05:38:37,3.0,0,董勇算是实力派演员了，表现的很有张力
看过,2017-07-01 17:42:26,4.0,1,四星是送给历史。
看过,2018-01-06 20:26:58,5.0,3,看完《血战湘江》，我就想问三个问题：第一，这么好的片子，为什么打分这么低，豆瓣有没有公正评分？第二，这么好的片子，排片率为什么这么低，甚至我们根本都看不到预售的拍片，这里面有什么问题？第三，这么好的片子，到底是谁故意让它消失在公众的视野，到底是谁在操纵？
看过,2017-10-01 21:04:02,4.0,0,场面还挺大的，不过还是有很多吐槽点的。但评分太低了吧好歹还算是可以看的啊
看过,2017-06-28 22:47:05,3.0,0,战争冷血的，保卫国家的人是温暖的
看过,2017-06-29 08:53:17,5.0,1,这阵容强大，演技在线，红军的万丈豪情值得敬仰。
看过,2017-07-21 19:21:36,4.0,0,中华人民共和国万岁
看过,2017-12-19 11:26:40,5.0,0,强烈推荐！！！
看过,2017-09-08 16:57:41,3.0,0,除了部分过分地渲染，整体来看还是把红军血战湘江的框架真实呈现出来了，先辈为了社会主义新中国牺牲太多，我们要珍惜
看过,2017-12-15 21:52:16,5.0,0,"一边看着《血战湘江》，一边哭，不能自已。


在南京死难者国家公祭日第二天观看，特别有体会。"
看过,2018-01-18 20:48:41,3.0,0,还可以
看过,2017-06-30 18:21:39,2.0,1,刚看完，真心不推荐，政治性太强，不合乎我们广大群众的胃口。
看过,2017-07-08 21:00:40,2.0,0,感觉没有成功刻画出战争年代的那种艰苦的时代，没有体会出真实的感情。
看过,2017-06-29 12:45:28,5.0,2,喜欢，超级感人，证明了最后一滴血的大无畏精神可谓可加
看过,2017-12-10 23:25:22,1.0,0,无话可说
看过,2017-07-07 09:54:47,1.0,2,国军士兵也是一群无辜青年  内战应该去反思而不是去歌颂
看过,2017-07-15 16:12:05,4.0,1,从头哭到尾…然后还是坚定做一枚小粉红了…网友对于主旋律的排斥我理解但不明白。许多东西是真的 不论被美化丑化 它都是真的。而人们大都爱站在高台上理所当然的指手画脚 却不去理会台子是谁给他们搭的。意淫可以 但没必要污毁。这世俗实在太难容。
看过,2017-12-08 20:44:19,1.0,0,中国人打中国人，有什么好看的
看过,2017-12-13 15:37:53,5.0,0,谁吸我们的血，就革谁的命。辛亥血，南昌血，湘江血，血骨不息先烈永存！
看过,2017-12-15 00:13:06,5.0,0,我看到了信仰的力量!
看过,2017-07-07 18:43:49,5.0,1,无理由好评，不过这类型的片子只有口碑没有票房
看过,2017-06-29 10:44:46,5.0,1,看着挺振奋人心的
看过,2017-06-28 11:02:58,1.0,0,不给这个分你对得起团团吗？
看过,2017-06-29 04:53:33,3.0,0,剧情演技都挺好的，三星以上，就一个问题，我居然在电影里看到了汉阳造连发！？是我眼瞎了么？
看过,2018-03-28 11:39:14,2.0,0,共同抗日？台词都错了
看过,2017-07-02 18:05:54,5.0,1,"全程含泪看完……演员很棒，致谢！场面震撼、气氛非常紧凑、很有价值观、感人至深、实属震撼！我觉得影院应该多排这样的片。很久没看过。
"
看过,2017-06-29 11:50:26,4.0,2,非常不错的红色电影，作为当过兵的人，看得我热血沸腾！希望这类优质影片再多点~
看过,2017-06-30 23:08:41,2.0,1,吓人
