看过,2018-03-03 21:34:25,1.0,0,一颗尴尬的心无处安放！
看过,2018-03-18 12:26:39,4.0,0,有点雷 
看过,2018-03-05 21:01:58,1.0,0,跟我大伯母一起看的，连她都觉得用嘴堵病毒是件匪夷所思的事情，所以…此片，你们懂的！！！
看过,2018-03-04 09:54:08,0,0,你捅他啊，捅我干啥？！……
看过,2018-03-01 12:05:03,1.0,0,看了二十分钟，实在受不了了，装逼，弱智，各种不合理的场景跟错误的军事常识
看过,2018-03-22 07:12:15,3.0,0,3分？？？我要去看看。。。
看过,2018-03-28 18:43:37,1.0,0,画面场景剧情假的吐导演一脸血，第一集学生被挟持，学生把炸弹一脚踢开，开挂啊！男主中毒还免疫，科幻片啊！监狱老大咋没咋就相信男主这枚间谍，脑袋是瓢啊！……
看过,2018-03-31 20:18:28,1.0,0,一星给剧里漂亮的女演员，情节真是太糟糕了，尤其大结局什么鬼！
看过,2018-03-28 07:06:54,1.0,1,杨烁掉粉之作 还有牟星。。。实在看不下去了了
看过,2018-03-15 09:54:54,3.0,0,热血电视剧，真的很好看
看过,2018-03-11 23:36:35,3.0,0,虽然很假，不过喜欢演员呀，而且我老公之前也当过武警，也在警院呆过
看过,2018-04-07 19:42:14,2.0,0,节奏还是可以的，有些场景还是会有一些紧张感，只是没想到是个烂尾剧。看了结尾有点不舒服，是那种本来想喝碗浓浓的鸡汤结果喝下了一碗油哄哄的白开水的感觉，难受
看过,2018-03-29 13:08:47,4.0,0,四星完全是给刘闯这个演员的演技，不是给剧情
看过,2018-03-01 02:13:09,1.0,1,基本上是没法看，太假了
看过,2018-03-01 02:37:54,1.0,1,神剧
看过,2018-03-01 09:08:52,1.0,1,我昨晚又看了一遍《我是特种兵》
看过,2018-03-01 18:28:09,1.0,1,明知道对方有卧底还去交易，现在犯罪分子智商都这么低了吗？
看过,2018-03-01 20:30:19,1.0,2,武警队长都能临时被临时拉壮丁式的进去参与这种跨国际的恐怖活动。这种有毒气体的交易箱子不是防弹的。在国外转战这么多年的雇佣兵，半集就领盒饭，最刺激的竟然是传播这么迅速的病毒，竟然用嘴和收就行再次密封，确定嘛！！而且按照剧情来看，队长还是在保持呼吸的，这种病毒不会伴随呼吸在进行传播？
看过,2018-03-01 00:52:43,1.0,1,一无是处
看过,2018-03-01 20:11:36,1.0,1,一个恐怖分子叫小猫，跪了
看过,2018-03-01 02:46:58,1.0,1,我好心看军事片，你给我拍喜剧片！
看过,2018-02-28 21:17:18,1.0,1,神他妈一样地狗血，垃圾。
看过,2018-03-01 13:38:19,1.0,1,确实很差，脱离生活，不建议观看
看过,2018-03-01 18:56:06,1.0,1,拍的什么鬼东西……
看过,2018-03-01 20:32:14,1.0,2,看完第一集，我大猛哥把英军sas黑的体无完肤
看过,2018-03-01 18:13:50,1.0,1,这电视剧真的烂到家了！
看过,2018-03-18 12:04:16,0,0,太牛了 
看过,2018-03-19 23:10:41,1.0,0,真不想给一星😔从台词到人设都通通爆炸，编剧成功塑造了一部玛丽苏神剧。比突击再突击查了个红军长征。
看过,2018-03-07 14:31:14,1.0,0,能拍军事题材拍成言情玛丽苏网大的架势也是少见
看过,2018-03-03 21:28:18,1.0,0,乱演一气 乱演一气 乱演一气
看过,2018-03-03 09:23:32,2.0,0,看得人尴尬
看过,2018-03-20 00:40:25,1.0,0,从《特1》、《特2》过来的。这部剧是个啥？1星给小包总了…
看过,2018-03-13 19:46:06,1.0,0,看得我尴尬死了。
看过,2018-03-08 12:31:54,1.0,0,不要带着智商看这剧。
看过,2018-03-21 22:10:29,1.0,0,居然还达到了3.2分，奇迹，比我预想的要高很多分啊。
看过,2018-03-31 08:51:09,2.0,0,拍得太没水准了吧
看过,2018-03-18 20:41:08,1.0,0,自己卖75万的房子，对方硬要120万买，卖房子的居然一丝怀疑没有就卖了。我真服了导演和编剧！
看过,2018-03-18 12:38:35,1.0,0,糟糕的台词
看过,2018-03-31 13:32:08,1.0,0,请问能打负分吗？台词到编剧到演员，这是个搞笑的片子吧？
看过,2018-03-13 20:36:58,1.0,1,我瞄见我一个2b朋友看到18集了…
看过,2018-03-29 10:33:49,1.0,1,各种后期抠图 各种逻辑漏洞 各种穿帮镜头 各种跳跃剪辑...
看过,2018-03-19 16:00:01,2.0,0,好多槽点。比如为啥除了杨烁都操着一口并不标准的地方口音，情景喜剧吗？比如动不动就煽情，比如里面女演员都不招人待见，比如男女主角根本没有cp感。。。正当我想弃剧的时候，伞兵出现了。。。唉。。。没办法。。。我果然还是真的爱特1
看过,2018-04-02 08:20:49,1.0,0,被这个抠图恶心到了。。。真的太假了，包括剧集的其他东西也都太假了。
看过,2018-04-01 03:36:56,1.0,0,真心。。。一言难尽
看过,2018-03-04 16:58:03,1.0,0,对不起，给你一分是真的不亏！剧情狗血，台词尴尬，道具乱用，BGM乱用😌
看过,2018-03-10 00:49:21,0,0,你把观众当傻子骗呢？
看过,2018-03-09 23:39:58,1.0,0,唯一1分给情怀，其他啥也不说了。说实话，现在我连1星也不想给了。
看过,2018-03-14 20:19:48,1.0,0,什么玩意
看过,2018-03-21 22:39:55,1.0,0,别侮辱广大群众的智商了好嘛，求求了吧
看过,2018-03-11 00:06:33,1.0,0,导演真是一部比一部退步，替身明显，剧情狗血，各种穿帮。以为观众都是傻子？
看过,2018-03-21 12:45:18,1.0,0,小庄之后再无特种兵～哎～一声叹息。一部比一部差。《特2》看的就不舒服，紧接着就让你呕吐，《火凤凰》神马鬼？哎呀，我去《利刃出击》向谁出击？观众呗，你以为K2呀，笑死个人儿。恰同学少年小庄谷智鑫，小庄之后再无特种兵呀！
看过,2018-03-26 23:50:57,2.0,0,无话可说 军事故事在电影界大放异彩的时候电视剧依然很烂而且还在退步 太失望了 
看过,2018-03-01 17:33:43,2.0,0,感觉还是缺了点真实性，毕竟无人机声音真的很大
看过,2018-03-10 21:15:35,3.0,0,最近几年国产电视剧几乎不看了，剧情能接受就能接受，较真太累，台词挺逗的，看个热闹，希望能抗过十五集吧。
看过,2018-03-06 12:41:11,1.0,1,不能更脑残了，简直入不了眼。
看过,2018-03-12 06:30:03,1.0,0,第一集看的就上吐下泻，太水了。发觉里面竟然还有士兵突击老马，亮剑的骑兵连连长。这部剧让我知道了导演的作用原来这么大
看过,2018-03-14 20:15:27,1.0,1,cnm什么几把玩意，队长吸了三分钟致死几万人的病毒十几个小时还不死，牛逼
看过,2018-03-11 22:14:37,1.0,0,这是什么，为什么要侮辱我
看过,2018-03-02 00:19:06,1.0,0,不行不行，再看5分钟要得尴尬癌。
看过,2018-04-04 18:05:49,1.0,0,ojbk就这么决定了，再看这个就跟你离婚
看过,2018-03-04 14:52:18,1.0,0,这剧情真的是一言难尽，别侮辱中国武警了
看过,2018-03-06 14:48:53,1.0,1,狗屎
看过,2018-03-24 20:48:27,2.0,0,不好看
看过,2018-04-03 18:26:24,4.0,0,老爸看的不亦乐乎啊，结果评分这么低的么。。
看过,2018-03-19 15:06:12,3.0,0,后面正常了一丢丢，加一星吧，谁让我喜欢我烁哥，还开了个会员。。。
看过,2018-03-20 11:05:34,1.0,0,哈哈哈哈哈这部剧真的神了，比抗日神剧还神
看过,2018-03-13 01:58:11,1.0,0,可以打零分么？哎，学生时期，还看过他几本小说。现在看来当初我真是日了狗。。。这tm侮辱人的智商呀？小时候过家家警察抓小偷，都比这真实好吗？
看过,2018-03-01 12:43:08,2.0,0,两星给杨烁
看过,2018-03-04 21:16:16,2.0,0,穿着吉利服在房区跑来跑去 蛇局啊
看过,2018-03-17 23:31:32,1.0,0,你怕是逗我哦 剧版红海行动？演的啥？ 啥？快进都看不下去！
看过,2018-03-27 21:20:00,2.0,0,还好吧看得乐呵呵的
看过,2018-03-29 22:51:36,1.0,0,我们国产剧就只能拍这种吗？！！！
看过,2018-03-23 00:38:53,1.0,1,侮辱军队
看过,2018-03-23 20:35:10,1.0,0,垃圾中的垃圾，太恶心了
看过,2018-03-09 20:31:25,4.0,0,向骑兵连连长致敬。从亮剑之后第一次看到您演得剧
看过,2018-03-05 11:08:11,0,0,什么烂剧啊 就地枪毙吧
看过,2018-03-04 23:33:15,1.0,0,拍的什么傻逼玩意。。。
看过,2018-03-06 10:08:21,1.0,0,我没看过也来评了，只因为武警求放过
看过,2018-03-28 00:31:03,2.0,0,有点凌乱，配置不低，而且开头挺吸引人的，怎么就越演越莫名其妙了呢，有点假不符合逻辑呀
看过,2018-03-26 07:00:53,2.0,0,以前看这种类型的片子大多以艰苦训练，出色完成任务为主，当然也会有人牺牲，这部简直太雷了吧，男主炸弹都炸不死子弹更加对他没用，简直就是超人了吧，还有这是什么剧情太狗血了吧！编剧是怎么想的？
看过,2018-03-21 14:09:25,1.0,0,史上最雷军旅剧
看过,2018-03-26 00:17:32,2.0,0,世界都是海州的。。
看过,2018-03-05 21:24:38,2.0,0,一部现代版的神剧…有这个觉悟就很好理解这片子的水平了…每一次任务的反派，都是智商欠费的，能集齐这么多智商欠费的对手，也是挺不容易的。
看过,2018-03-04 22:29:21,1.0,0,怎么没有0星呢
看过,2018-03-27 20:51:09,1.0,0,刘猛越来越辣鸡，辣鸡的不要不要的。
看过,2018-03-02 23:06:18,1.0,0,神剧亮了 一分给硕哥
看过,2018-03-13 20:23:25,1.0,0,剧情不是很吸引人，本来是为了杨烁去看的，还是失望了
看过,2018-03-17 23:03:58,1.0,0,一颗星只给那些辛勤劳动的演员们！恳请刘猛导演不要再拍军旅剧了……简直就是在瞎胡闹、瞎扯蛋、瞎忙！……跟本就是不过脑子，简直就是军人的耻辱！……简直是在侮辱全国观众的智商和糟蹋老百姓的血汗钱！国家有关部门怎么就没人出来管一管呢！？嗨！
看过,2018-03-12 16:07:29,1.0,0,一向喜欢军旅片的我都不知道该怎么说这部剧了。。。
看过,2018-03-15 22:38:35,1.0,0,一部我是特种兵让刘猛吃尽了甜头，然后就开始搞23456，然而越感越垃圾！太假了！还是喜欢小庄
看过,2018-03-24 14:01:02,1.0,0,作为喜剧还是挺合适的！逗君一乐
看过,2018-03-07 17:49:47,4.0,0,只能说我对军旅题材毫无免疫
看过,2018-03-03 13:34:02,1.0,0,"太尬了 看不下去了为啥没有评分啊 想看看多低分"
看过,2018-03-04 11:43:19,0,0,emmm⋯⋯第一集看著就不合常理吧⋯⋯
看过,2018-03-17 22:57:56,1.0,0,为武警部队政治部感到。。。。。。
看过,2018-04-02 19:48:37,4.0,0,自从士兵突击以后就一直没太关注大陆关于军事题材的电视剧，偶然遇到这部军事泡沫剧，看得我呵呵一乐。剧情幽默诙谐，并且与时俱进，富有创造力，很适合年前一代观众的口味。演员阵容很不错，看了后很轻松。推荐一下
看过,2018-03-21 13:00:50,2.0,0,额，真的不知道怎么说，两星自己想吧。
看过,2018-03-02 00:33:39,1.0,1,我就说一句  tm假期就剩2天了还要浪费我40分钟！？
看过,2018-03-17 05:40:26,1.0,0,这种剧简直是侮辱军人
看过,2018-03-13 19:16:15,1.0,0,太尬了。一星半
