看过,2018-02-20 21:05:52,5.0,1,人性的复杂正是在那些看似无聊的斗嘴、戏谑、掐架、脏话、沉默中一一呈现。不掩饰人性不歌颂人性，摆出来让你去品尝。其实结尾应该是不辣拉响了最后一颗弹弹，没有人记得他们，功勋赫赫与他们无关。不管历史还是现实走到最后的永远是唐基们，龙文章是梦。孟烦了是我们大多数人的样子。
看过,2010-03-20 18:04:34,3.0,0,只看到20集 期待太高失望了
看过,2017-08-14 19:22:16,5.0,3,这几年，看影视剧和书，一到动情处总会哭，可能真是岁数渐长，有过生离死别，成了一家之主，有了孩子，把命看得更重了。
看过,2018-03-10 21:50:41,5.0,2,唯一能看下去的抗日剧。有笑有泪。龙文章太有魅力了，又带点猥琐神秘。所有人都很棒，迷龙七哥小太爷兽医不辣师座等等。
看过,2017-08-10 18:08:43,5.0,4,“什么都不要，就要安逸”，兰晓龙的剧对人的关注太深入了，像把观众一层层地剥光。每一个演员都让人忘了他们本身，他们就是角色是龙文章，是烦啦，是阿译……真的值得一遍遍地看，为剧情，为台词，为了剧中的大叔们。
看过,2010-09-19 10:15:42,4.0,0,文艺战争片铁血真吐槽。
看过,2017-06-01 23:08:35,0,0,最喜欢的国产连续剧，一部值得一看再看的良心之作。只是生不逢时，被严重低估了！对战争场面的描述毫无避讳，像钢锯岭一样冷静直面。每一个演员的表演都是那么出色，或许神经质但放在那样的大环境里，背井离乡随时变成孤魂野鬼，谁也没法冷静。
看过,2016-12-30 18:39:17,5.0,3,不管这帮犊子逼逼了多少，全剧最让我流泪的一句话是：少年中国有希望！，配合小书虫的死亡，服用效果更佳。
看过,2017-08-20 21:36:39,5.0,6,35岁前靠上辈子活，35岁后靠这辈子活
看过,2010-04-16 14:42:44,4.0,0,除了顺溜其他都可以
看过,2009-03-16 12:55:26,5.0,0,"有点意思了
虚与实，灵雨肉，智慧与豪气，冷眼与缜密，狡黠与哲理，蓝色星空，黄色大地。很牛逼。
"
看过,2018-03-16 09:15:11,5.0,1,最近才入了兵团线的坑 除了剪辑和最后结局没拍出来 其他部分 比如立意 绝对是满分佳作！！！
看过,2011-02-11 15:48:00,4.0,0,春节期间和我娘通宵看完的咯。
看过,2013-10-24 20:23:24,5.0,2,好看，精彩，除了这两个词不知道还有啥可形容的，原著小说已列入想读书单。这部戏评分低看过的人都觉得艰涩难懂，其实最大的原因就是节奏稍快，但这也是此剧精彩的原因，此剧需要静下来细细观看，看过此剧后我懂得朋友曾说过的【好东西不舍得一下子看完】了，因为看完会觉得心里空落落的
看过,2012-11-25 23:51:42,4.0,0,其实，我的团长我的团演的出色的地方并不多，大部分剧情我都是当基情片和喜剧片看的，但是因为同类型出色的电视剧少之又少，所以出色地方并不多的我的团长我的团也就鹤立鸡群了
看过,2009-05-11 00:13:25,5.0,1,买了碟陪他在家看。痞气，义气;真性情，真汉子。第一次认真的、连续的看这样的片子，以为会厌烦，却一发不可止的连续通宵的啃了下去……
看过,2013-05-19 16:38:11,5.0,3,有人本性基本一生未变，有人涉及自身利益却忘掉昨日口号。这是一个复杂的故事，却只扣最简单的人心。这里没有荣誉，没有英雄，有的只是做人根本，一个关于是否实现许诺的故事。
看过,2009-03-29 00:22:12,4.0,0,说实话我觉得里面的很多人都演得太用力了，但是故事和台词真好，那真让人欲罢不能
看过,2009-08-04 15:33:08,4.0,0,能看得出编剧的良苦用心，他试图去说明一个深刻的问题，一个不少人不敢提及的话题，只是，限制太多了，节奏太慢了，抛去“士兵突击2”的炒作，这部戏的受众还是少数
看过,2016-10-07 15:02:53,4.0,2,剧情很精彩，可是人物很做作，所以减一星
看过,2013-11-02 15:32:06,5.0,2,"中国电视上虽然最多的电视剧就是抗日片,却没有一部片子像这部一样认真的反思战争,让我们知道生命的可贵,战争的残酷.我们的电视上全部都是戏法娱乐一样的演绎战争.把战争当儿戏一样.这里才是真正的战争,如果拍的再精细一些,或者拍成电影,绝对不亚于《拯救大兵瑞恩》这类的美国大片。"
看过,2013-05-30 13:03:20,5.0,5,少有的全面描写国军抗战的电视剧，沙盘推演一节尤为精彩，近乎还原了松山战役。
看过,2017-02-12 18:33:38,5.0,8,居然能好看到这个程度！
看过,2009-06-06 09:09:39,3.0,0,打仗的士兵说话跟书生一样
看过,2017-04-23 23:02:31,5.0,1,又看了一遍，印象更加深刻…小时候看没留下多少回忆…如今返观，从头哭到尾！他们个个是那么的真实，仿佛自己也置身其中一般，去腾冲和顺古镇的时候莫名的感动！在腾冲的远征军纪念馆，在那些烈士的无名碑前……就跟电视里一模一样，炮灰团…没人知道他们的名字…电视、小说里给了我们应有的寄托！
看过,2010-02-02 20:52:14,3.0,0,不如士兵突击啊
看过,2015-07-21 13:07:55,5.0,2,哇哇，神剧
看过,2017-09-01 21:04:32,4.0,1,之前跟着爸爸一起看的   很喜欢
看过,2010-04-22 13:49:09,0,0,你要是让我来啊，谁TM不愿意来啊~
看过,2012-12-18 23:18:52,0,0,delay很严重地也没看完
看过,2018-03-15 02:05:10,5.0,1,看到二十集左右我想打十星！希望群口相声永远不要停啊！【39集来来回回点开好几次不敢往下看，小太爷您呐，就是想要不说想做不敢还想太多嘴巴毒心肠软矛盾又拧巴的草包一个，像极了现代人，好吧至少像我【哭着看完，没放小说结局真仁慈，遥远遥远的以后会不会有人记得我在这个寂寞的星球曾这样的活过
看过,2015-12-24 17:21:04,3.0,0,是一部很特别的剧。但是并不是我的茶。很喜欢12－13集审判龙文章的群戏。但是后来变的有点审美疲劳。弦绷得太紧，无止境的虐。没有节奏感。超出了我可以承受的极限。
看过,2010-06-19 18:50:25,3.0,1,"1.太冗长拖沓,砍掉1/3不错;2.剧本太晦涩,很多台词都很生涩,不知所云看上去很无聊3.士兵突击是赔本赚吆喝,这个赚钱砸招牌.4.女人戏烂.5.整个片子有为戏而戏的感觉.6.不喜欢烦啦的装B和死啦的矫情7.段的角色有故作深沉莫名其妙兼迫害妄想症之嫌8.剪辑的故弄玄虚卖弄技巧成拙"
看过,2017-09-18 11:14:39,5.0,2,怎么说呢，这部剧生不逢时，放现在绝对火爆
看过,2013-08-22 23:45:02,4.0,0,挺好  但赶脚缺点什么
看过,2010-04-22 21:40:33,4.0,0,一言难尽，但我确实狠狠地哭过，笑过，骂过，伤心过，绝望过……
看过,2009-03-16 10:13:43,5.0,0,十年前看，只是打打杀杀。十年后看，才看懂：抗日战争的情节只是一个放大镜，把这个民族看得清清楚楚：1.死都不怕，就怕不安逸。2.有些人逞一时之气壮烈了，如今毛都不是；有些人蝇营狗苟一生，结果功德圆满鸡犬升天…3.中国的历史从来都是成王败寇，哪怕数以百万记的人命只不过是点缀。
看过,2009-03-27 16:42:27,4.0,0,士兵是个喜剧，团长是个悲剧；士兵是温暖的，团长是冷冽的；士兵是个童话，团长是个传奇；士兵告诉我们，不抛弃不放弃是我们的法宝，团长告诉我们...它什么也没有告诉我们，它留给我的只有幻灭，和伤心至死。它就像一部电视剧版《等待戈多》，我喜欢这个剧本，电视剧里的人物演绎得很有劲，但导演在节奏，情绪，影像的把握上有些失控了，使它失去了传世的机会。
看过,2010-01-17 18:02:24,4.0,0,事情应该是它本来该有的那个样子。
看过,2009-03-29 09:20:28,5.0,0,"如果我是导演
感情会很精彩
妖孽！！！！
蔡康永来当个副导演就好了。。。
腐女的无限遐想。。。
"
看过,2009-03-22 20:25:14,5.0,0,红日是看着好评去看的，结果烂得一塌糊涂，团长是听着差评去看的，结果出乎所料，除了有些时候的拖沓，还算是一部好片，毕竟是电视剧，不是电影..这里是战争，不是讲故事..
看过,2009-03-13 18:48:39,0,0,附带要提的事是:使我看这剧的某二人在收到风声后/这剧被炒热前就把40多集干掉了.
看过,2012-12-29 15:40:24,3.0,0,太拖沓了，28集弃……虽然全部卡司都是我的爱。
看过,2013-11-27 12:49:09,4.0,1,话剧表演荧幕化
看过,2009-04-09 10:52:48,5.0,1,是不是人生都是这么悲壮？痞子式的悲壮更让我们伤感，最后一集和33集哪个才是真正的结局？我不愿意说，说了，会留下英雄故去的遗憾。
看过,2009-03-20 14:04:57,4.0,0,"题材不错，演员也可以，但似乎太冗长了点，相比士兵的横空出世，团长还是弱了些
我喜欢刘威葳这个康剧的亮点"
看过,2018-03-06 20:19:28,3.0,1,当年抗战片太多导致有点排斥虽然现在也不少。因为士兵突击想补完，但是，看不下去了，不晓得为毛，还是看不下去，继续啃书容易些。
看过,2017-05-06 23:56:06,5.0,4,我们长得是不好看，但你不能把我们当劈柴烧啊
看过,2010-07-29 16:12:43,5.0,0,兰晓龙的剧本写得很深，感觉每个地方都有隐喻，不那么好消化，得慢慢看，慢慢想，我想，我从中学到的是生命。
看过,2017-09-27 00:56:47,5.0,0,这剧给满分，这是中国最好的抗战剧没有之一。是的，亮剑也比不上这部。这部剧把士兵对抗敌人时的奋力搏命写出来的同时，更多写了中国军队里士兵的怯懦、怕死、自私等等，但丝毫不妨碍观众对剧中人物的喜欢，因为有缺点才显得人真实和鲜活。PS. 剧中很多隐喻和话剧式表演，会对普通观众不友好。
看过,2012-07-04 15:53:40,4.0,0,兰小龙格局有限掌握不了大背景下的大场面，剧本太矫情，过于虚幻。
看过,2013-08-29 12:46:41,5.0,1,中国少有的比较真实的战争连续剧 不做作很真实 对人物的刻画非常细致 性格鲜明 最喜欢上海人林译 懦弱的外表下 是一颗纯洁无畏的心
看过,2009-03-26 23:17:15,5.0,0,终见埋没历史之冰山一角
看过,2018-03-05 19:44:44,5.0,2,书看了三四遍吧，哭成傻狗，看过的那版电视剧没了那个残酷的结局，又总觉得缺了什么
看过,2009-12-23 17:32:57,5.0,2,中国电视剧制作的巅峰。
看过,2011-04-05 05:11:37,3.0,1,越来越装的兰晓龙。
看过,2016-10-07 13:57:55,4.0,0,电视剧比小说真的温情太多了，其实康洪雷也不敢拍的让观众有代入感吧，我甚至觉得南天门上的战争时那所有的背景音乐都是不合格，更甚地说音乐多余，因为没有什么能表达出地狱感……我在看小说的时候觉得晓龙太过残忍，对这个世界的怨恨也太多，甚至最后绝望到麻木……
看过,2012-06-19 12:58:57,5.0,0,一种无法言语的悲壮。看的时候被那些插科打诨吸引了去，看完之后却被他们团长他们的内心所震撼。
看过,2017-05-25 22:49:17,5.0,1,"郝兽医死的时候泪流满面。
战争中的人性就是这样，哪有那么多的视死如归啊，谁不怕死？命这么金贵呢，但国破家亡，又有谁愿意做个亡国奴呢？庆幸生于和平年代，但永不忘任人践踏之耻，民族复兴或许就在我们这一代了！"
看过,2016-08-27 22:29:33,3.0,0,有内涵，有意思，但节奏太拖沓，缩短到三十集以内。。。另外龙文章的台词念的有些夸张，表演有点过。。很喜欢迷龙。
看过,2009-08-26 22:09:38,5.0,0,今天第二次看完这部连续剧 又一次为结尾的改动而遗憾
看过,2009-04-30 14:05:57,4.0,1,我什么也不了解 只知道感动~
看过,2011-04-08 13:53:07,3.0,0,"看到最后每太懂，完全是冲着士兵突击的班子去看的
"
看过,2009-04-23 13:15:55,4.0,0,"刚看了一点,很有血性."
看过,2009-05-10 18:30:35,3.0,0,"喜欢里面的人,但是剧拍得太玄乎."
看过,2009-09-09 14:19:41,4.0,1,人最可怕的，就是有了不该有的希望。
看过,2013-03-02 22:06:56,3.0,0,说实话有许多地方没看懂，比如说：“岂曰无衣？与子同袍。”，比如说烦啦的损。这部电视剧就是在借国军的事从正反两面来唱红歌，我觉得原著小说一定不是这样的。
看过,2017-02-26 11:11:11,5.0,2,虽然每个人都叨逼叨逼的很啰嗦，灰头土脸的不好看；虽然铺垫多节奏慢，结尾却仓促得让人想砸电视机；虽然主角不是瘸子就是疯子，既不伟大，也不英雄。但它真是好电视剧。和平真好！
看过,2009-03-20 23:21:31,4.0,0,有点拖沓，总体不错
看过,2017-03-29 21:33:00,3.0,0,团长这种属于典型兰晓龙式神经质剧本，喜欢的人会很特别喜欢。不喜欢的人无法忍受。各人物特点鲜明，性格吸引人。
看过,2009-06-02 14:28:10,5.0,0,"一段几乎不被记忆的历史，
用一种诙谐幽默的语言方式记叙表达的战争历程。。。。"
看过,2018-03-04 22:42:22,5.0,2,我从来没想过我会看 抗 日 剧呀 难能可贵的真实 演技极具感染力
看过,2009-04-14 20:26:33,4.0,0,实在想给5颗星。。。但拍摄手法和各大电视台的剪切实在叫人受不了。。。
看过,2017-07-01 13:00:02,5.0,1,以虚构的方式呈现真实的历史
看过,2018-03-12 03:22:49,5.0,2,第一个看完感慨台词如教科书一般惊艳的电视连续剧，很久以前看的，却久久地热爱里面的每一个人！
看过,2017-11-15 01:28:10,5.0,3,岂曰无衣，与子同袍。
看过,2018-01-30 01:38:33,5.0,3,"一群可爱的“人渣兵痞”，看到最后是倒吸凉气的心痛。
龙文章生不逢时，这部剧也是。"
看过,2017-02-21 22:24:48,5.0,0,太唏嘘了。群像剧，里面的每个人物都塑造的好可爱啊。小太爷的独白简直戳心，团长真是让人敬重又心疼。不得不提一下王大治的不辣啊，实在是太可爱了。两个女角色，演的也都好棒，小醉好纯啊。
看过,2009-09-20 17:22:36,5.0,0,其实等到很久以后，能回忆起来的也只是那些小事....这是一部用很多的小事串联起来的回忆！
看过,2018-04-06 15:35:17,5.0,1,热泪盈眶！看似嬉皮笑脸，其实内在的三观及正！只有把人物塑造得鲜明，真实，我们才能从影视剧里真正感受到“革命先辈”的含义，无论是什么党，他们都是最可爱的人！
看过,2011-09-11 14:24:00,3.0,0,跟舞台剧似得拖沓夸张，看的很累。想喜欢但是喜欢不起来。
看过,2009-12-18 20:30:23,4.0,0,Only Paranoid can survive.
看过,2017-07-31 23:40:14,5.0,2,同类题材剧中的翘楚之作，起初慢热，后面越来越有味道，回放镜头如果可以少点会更佳，收割下兰晓龙编剧，写小人物写普通战士真是绝了！
看过,2015-01-09 02:47:54,5.0,1,我是憎恶一切的孟烦了，心里却无时无刻盼望着一个死啦死啦来救赎……
看过,2010-12-01 21:06:31,4.0,0,有点神经质的一部电视剧
看过,2009-03-19 20:51:37,0,3,好电视。我喜欢这个结尾。不象宿命。
看过,2017-04-15 21:34:26,3.0,0,"看剧情简介，不小心被剧透了。
这真是个奇怪的抗日片啊，哈哈哈。越看越感到有诗意。
42集看哭了，真揪心。"
看过,2010-04-13 13:10:00,4.0,0,本来不太待见士兵突击的人，但这片子剧本够扎实，很多东西看得出电视剧没来得及拍出来
看过,2013-02-28 00:54:42,5.0,0,特别喜欢小太爷，张译的声音特别温暖动听。印象最深的是兽医跟日本娃说，娃你自己捂着你伤口等你的医生来啊。当时就泪奔了，老戏骨不愧是老戏骨
看过,2009-04-09 14:51:21,5.0,0,剪辑有些问题，结尾很遗憾，不过暇不掩瑜。
看过,2016-09-01 00:47:17,5.0,0,兵团线里最喜欢的就是团长，真实的让人心酸，士兵突击里许三多这样的人应该很少见吧甚至我怀疑都没这样的人，生死线就不说了，四道风就是雷剧不可或缺的角色…
看过,2018-03-05 15:47:59,5.0,2,不说了，我去刷小说了。
看过,2017-08-01 11:45:11,1.0,0,都叫我多看几遍就懂了，但谁也说不上所以然来
看过,2009-03-17 08:11:53,5.0,5,细评：剧终细说我的团长我的团
看过,2014-05-08 16:09:00,5.0,1,反复看了多遍，台词十分考究，兰不愧是读莎剧出身的。这剧高明就高在孟烦了那股尖酸阴郁的戾气，有这么一个不断反驳着、怀疑着、苦笑着世事的人物，而不仅仅闭眼高歌战争的所谓”壮怀激烈“。孟洞察命运而逃避命运，龙预见命运而平静迎接，虞与命运慷慨宣战，却没认清自己，预计错了命运。
看过,2016-08-29 08:25:03,5.0,1,疯子。看到结局他们活下来就完了，我觉得不应该是这样。再去看书，死啦死啦自杀了，迷龙死了，烦啦和张立宪投诚，这才是该有的结局。厚着脸皮也要活下来的死啦死啦最后自杀，是绝望了。
看过,2009-03-31 17:38:56,4.0,0,有点拖沓，缩减到20集，效果会好很多
看过,2012-08-12 23:22:17,5.0,0,希望能多多介绍韩国片，呵呵。。。。
看过,2018-02-26 12:58:19,5.0,4,看完之后做梦都想去禅达，明知是戏，但是还是想去看看，看看龙文章的疯魔，孟烦了的彷徨挣扎
看过,2017-04-19 00:08:35,5.0,2,良心剧，值得多次刷！
