看过,2016-12-08 15:55:26,3.0,0,我的眼泪是笑容，陪你一直到天明。
看过,2010-10-22 15:11:32,0,0,太牛逼了。
看过,2015-05-02 10:18:19,5.0,0,杨烁可真帅，都能演武松了
看过,2010-02-02 14:57:25,0,0,总觉得继承了《团长》的风格，就是龙文章演的太差了！
看过,2012-04-01 16:21:37,0,1,48集长怎么了，谁规定集数多的就拖沓不能看啊？《团长》就绝对对得起！但你这玩意也太...那个了，节奏混乱，逻辑不通，难怪康洪雷不拍。影视剧的灵魂是题材和编剧，兰晓龙你在这里太弱了。
看过,2014-09-15 06:10:48,5.0,0,最美的台词 最惨烈的告别
看过,2010-02-24 12:52:16,5.0,0,大爱
看过,2010-02-16 15:12:58,4.0,0,……说实话是为了看李晨……
看过,2010-10-26 13:48:10,5.0,0,我爱死这个湖南人了！
看过,2010-03-31 05:53:31,5.0,0,正在看，很好，发觉这里面的 四道风 像 士兵突击 里的 伍六一
看过,2009-12-19 18:37:18,5.0,0,心惊胆颤  热血沸腾  无奈和希望并存  泪水和笑容同现
看过,2011-01-20 00:12:20,5.0,0,看得我太难过了，欧阳真是个打不死的小强，怎么折腾都死不了。我爱老四啊！炸都没炸死居然被流弹给打死了！太可气了！
看过,2010-01-03 17:26:09,5.0,0,我爱男人戏！
看过,2010-01-15 01:02:21,5.0,2,"""我总觉得胜利不是这个样子"""
看过,2010-04-13 22:29:46,4.0,0,台词与其他电视剧不太一样。
看过,2016-04-04 17:03:56,5.0,0,最爱小何和六品
看过,2012-01-02 17:29:36,5.0,0,花了三天时间看完，演员个个都很到位，整整48集全部看完
看过,2013-06-04 23:02:37,4.0,0,太惨了……片尾曲好听
看过,2010-02-20 01:26:41,5.0,0,我爱他们！我爱这些理想的人们！
看过,2010-01-09 22:11:55,5.0,0,结局没有我想象中的美好，赚了我不少眼泪。在龙乌鸦快要死的时候，突然就喜欢上了他。其实我最喜欢六品。三个女演员没一个讨我喜欢。
看过,2011-01-21 19:15:36,4.0,0,围巾很重要。
看过,2014-10-09 17:58:02,5.0,0,当年最爱。记得当时还为龙文章写了文，手写的，现在找不到了，遗憾。后来买了小说，随机的书签也是龙文章。
看过,2012-04-16 23:41:33,4.0,0,还不错吧 后半部有点儿扯
看过,2014-03-02 19:10:34,5.0,0,英美剧编剧中男神女神有点多，但韩剧编剧女神是《仁显》宋编，国产剧编剧男神是兰晓龙无疑，认证。
看过,2017-12-21 07:56:16,5.0,1,"如果自己生在那个时代，会如何应对。剧中的小鬼子是可怕可恨的，剧中的许多中国人也是可怕可恨可怜的。
最后几集真的是哭惨了，他们都太惨了啊太惨了"
看过,2017-08-27 19:33:37,4.0,0,805 廖凡 张译演技可以忽略颜值
看过,2010-01-17 01:33:48,5.0,1,看到第24集，人大概该死了，不看了。
看过,2010-02-23 02:42:28,0,0,没有你们的胜利 算什么胜利...
看过,2013-11-16 21:57:54,5.0,0,看过，不怎么记得剧情了，但隐约觉得很好看，热血，催泪。
看过,2010-06-09 20:55:44,5.0,0,浪漫主义下的真实。抗日片首次正视并触及日本文化的试探。
看过,2010-09-22 23:15:38,5.0,0,兰小龙的三部曲都很不错。
看过,2018-03-29 11:30:23,5.0,0,动作戏略狗血，但剧情戏太好 尤其是开头几集 和最后机场劳工营，恍惚间有点《行尸走肉》和 《肖申克的救赎 》的味道
看过,2017-10-17 07:06:44,5.0,0,这部戏中每个人物的塑造都很立体很有个性，虽然我非常不喜欢廖凡的那个角色，但不代表他演的不好，杨烁的四道风真的有感动到我，深深地。
看过,2010-02-12 18:56:54,5.0,0,太杯具。。。
看过,2017-01-07 22:34:40,5.0,1,四道风和欧阳的每一场对手戏都流畅，有活力，即使是生离死别。杨烁跟四道风融为一体成为角色本身了，欧阳彻底改变了我对廖凡的印象，以前总觉得他很吓人，看来是演戏对象有问题，换了小四就是各种惯着各种宠，这CP无敌了！张译是个不错的演员。
看过,2010-10-22 19:44:58,4.0,0,好故事，好演员，但缺了个好导演，节奏太过缓慢，jjww的谈情说爱占了太大篇幅，白瞎了个好故事……看到30集以后基本上都快看不下去了……
看过,2010-02-07 22:11:58,5.0,0,废寝忘食
看过,2017-02-16 18:01:39,5.0,0,耐看，看好几遍了
看过,2017-05-27 00:30:01,0,0,四位男主角都棒呆啊，只可惜现在路线完全不一样了。。
看过,2010-04-09 23:40:54,5.0,0,何莫修~~~~~
看过,2011-10-08 21:47:06,5.0,0,他们穿山入林，绝尘而来。欧阳、龙文章、何莫修、四道风。（其中比较喜欢龙乌鸦、小何、六品、唐真这几个角色。）
看过,2011-06-18 16:56:25,5.0,0,为毛看生死线的人不多
看过,2011-01-14 09:28:31,5.0,0,爷们！！
看过,2012-12-08 01:36:33,5.0,0,很优秀的一部作品！
看过,2010-02-03 00:10:29,3.0,0,前几集还是很吸引人的，可后面的就忍不住要快进了。不过，四道风还是演的不错的。
看过,2017-07-25 21:07:59,5.0,0,结局虐到。张译很可爱。
看过,2010-07-30 18:23:18,3.0,0,喜欢片尾曲，可以一看，但过于拖沓，细节重过情节的需要。
看过,2009-12-29 18:07:45,5.0,0,国家爱兄弟情
看过,2016-09-07 23:25:30,5.0,2,良心之作
看过,2010-06-09 13:45:50,5.0,0,一直没敢看剧透，别死啊小四。我就不买碟，天天2集2集的看。折磨啊~我爱四道风。我爱最开始的四道风，纯粹、快乐！
看过,2010-12-30 11:02:19,5.0,0,在这里突然大爱廖凡
看过,2010-01-15 20:31:50,4.0,0,脏兮兮。
看过,2010-03-02 14:16:06,2.0,0,没看完 看到一半，有点无聊了
看过,2016-10-03 18:11:46,4.0,1,啊啊啊剧情进展太慢了啊！
看过,2014-05-26 04:12:25,5.0,0,看了好几遍，还买了书看，每个人物都令人感动
看过,2010-03-26 14:37:45,5.0,1,一部靠慎密绝妙的构思和又合情合理逻辑构成的“名著”。剧中闪烁的智慧比三国还要让人拍案，情与义的流露水浒更摄人心魄，对爱情执着比红楼还要感天动地，情节的令人意想不到让西游也黯然失色。一句话，每个中国人都绝不能错过的经典！比士兵突击带给我们的感动还要深刻，尤其41集之后越看心里越难受
看过,2014-08-03 22:29:05,5.0,0,建议打个标签只有男性可观剧。40集之后弃剧了，原因是悲剧程度心里接受不了，真的好像刀割一样痛，看个电视让自己这么难过只有弃了。
看过,2017-05-23 18:46:56,5.0,0,很不错 电视剧比电影牛逼系列
看过,2010-08-17 01:57:03,5.0,0,我说把这种片子当成腐片的，你们能醒醒么，士兵突击你们当成腐片就算了，这种片子你们有脸把他当成“和谐的腐片”来看？！
看过,2016-04-29 22:23:12,4.0,0,总体来说不错，仍然脱离不了把敌人拍的很傻
看过,2011-05-24 22:29:27,5.0,1,比团长看着累心
看过,2010-09-05 23:30:31,4.0,0,被“一颗种子感动”，这片子有点蛇尾了。太长了
看过,2010-12-30 22:39:14,5.0,0,看完之后胸口像被掏空了一样
看过,2013-08-11 00:44:56,3.0,0,信仰没有错！虽然情节有些假
看过,2016-12-19 14:52:49,4.0,0,8.5。。。。每个人都刻画得很丰满，演员演技都没得说，特别是张译，结局很残酷也更现实
看过,2017-02-03 17:05:24,2.0,0,抗日神剧一部
看过,2010-01-07 22:11:22,5.0,8,近期看的最好看的电视剧
看过,2011-11-13 17:58:25,5.0,0,两年过去了，这部电视剧始终让我难以忘怀。另外片尾曲超好听。
看过,2010-01-30 23:44:15,4.0,0,很久没看过这种男人戏了. 个个角色都可爱.
看过,2009-12-18 16:21:40,5.0,0,这片有点像 加里森敢死队+越狱+风声
看过,2011-06-13 10:35:03,4.0,0,最后两集，含泪看完。借用欧阳的话：你们都不在了，这叫个什么胜利。
看过,2010-01-16 22:10:22,0,0,战争中没有剧里那样的神仙
看过,2011-01-27 17:29:42,5.0,0,看上瘾了，子弹后爱上这样男性荷尔蒙在飞的片子
看过,2014-07-17 16:35:05,3.0,0,其实不错，但总是觉得还不够劲。
看过,2011-05-22 18:03:03,5.0,0,真正的抗日战争是这样的。
看过,2010-01-17 20:40:14,5.0,0,249你敢不敢写出更萌的男人来？
看过,2010-02-03 23:53:57,5.0,1,把我给哭惨了。
看过,2013-08-22 10:54:32,5.0,0,从来都不大喜欢战争题材的影视 可这部可谓奇迹 满分都无法超越我的感受 哭死人
看过,2012-04-06 02:10:59,4.0,0,"总体来说把爱国、爱人民、爱兄弟等等的多种感情表达的淋漓尽致,情节安排也不错,蛮吸引人的。只是四十八集的长度对我来说实在是挑战了。另,何莫修的人物刻画应该说是最成功的了吧。不仅表现了他的成长,还刻画的如此真实!"
看过,2010-12-10 00:39:42,4.0,0,四道风最帅
看过,2015-06-01 23:39:11,5.0,0,2015 6.1 再见 大陆剧最爱的男主角之一|2012 3.02 repost：从来没有大陆的戏追得这样疯 编剧好 相当有感觉|2014.12.19 回溯：我是孔笙骑兰晓龙推龙文章一生粉，让我那年寒假哭得缓不过神的良心剧。摧残心灵就看它，感觉自己棒棒哒，这片倒带再放N次温故知新都值，每次回溯都是洗礼。
看过,2017-06-19 20:06:23,4.0,0,相当不错的一部剧
看过,2010-03-11 14:48:14,0,0, 对于每天晚上的电视剧是多如牛毛，但是真正的好作品确实是没有几部，能让你看上就爱不释手的就更凤毛麟角了，最近的新剧《生死线》是一部值得细细品位的电视剧，虽然拍的也是二战期间我党的与日寇的较量，但不再是描写一些大人物，而是小人物，近距离的与敌人的厮杀，死亡只是瞬间。对于影片中的演员
看过,2010-02-08 02:40:04,5.0,0,有笑有泪，家国人情。生死大义，还彼微言。堪称完美的“兰氏出品”。
看过,2010-02-23 10:31:06,4.0,0,现在，老实说，电视剧拍得还是不错，剧本也行，就是节奏太慢，三十几集能缩到二十五集以内就会更精彩。我正想再大大声对编剧导演们说一次，能不能把创作基准放在平均智商上，不需要那么多的解释来浪费菲林。
看过,2014-11-01 10:45:53,5.0,0,兰晓龙你又赢了
看过,2017-05-26 23:02:28,4.0,0,喜欢廖凡，演的实在是太棒了！很男人！
看过,2010-07-18 20:11:18,4.0,0,最后两集我不敢看。
看过,2017-04-19 14:41:16,4.0,0,何
看过,2015-12-08 14:00:06,0,0,看了前十集，不是特别喜欢。戏剧性有点儿太强，有的时候觉得太over。或许也是最近不太有看这样的电视剧的心情吧。
看过,2011-08-07 09:34:27,0,0,谢谢我还没开始追等我有时间再说。。。
看过,2017-03-05 21:37:28,5.0,2,最爱的国产剧
看过,2015-12-26 23:09:55,4.0,0,我才知道是山影的啊，难怪！今年四道风也回来了
看过,2014-05-14 16:32:12,5.0,0,发现兰晓龙有比《士兵突击》更好的作品
看过,2012-02-26 18:50:20,5.0,0,何其悲壮惨烈啊！他们都是英雄，他们很是牛逼！
看过,2011-06-24 21:40:08,5.0,0,这三部曲的最后一部非常，好。原著、编剧、演员。我最喜欢的国内主旋律大片（没错就是大片）就是它了，同题材无出其右。老段你也应该在啊
看过,2010-02-07 21:49:46,5.0,0,一边看一边哭。难受。
看过,2010-02-12 23:01:48,5.0,0,老四死了，欧阳活着。龙乌鸦死了，六品活着。小昕死了，爹爹活着。小何死了，然后活着。
看过,2016-08-17 17:43:14,5.0,1,被杨烁圈粉，演得多好，偏偏要到偶像剧才火，多悲哀。李晨明明可以是个好演员，如今人设怎么会崩成这样。
看过,2010-02-11 00:30:54,4.0,0,人似沙鸥
