看过,2011-10-02 17:19:27,4.0,0,
看过,2012-08-16 11:41:22,5.0,0,和平比战争来的更加可怕
看过,2012-06-14 20:42:25,5.0,0,血淋淋的现实，真实的场景，鲜活的历史。
看过,2016-08-10 00:07:06,5.0,0,Apocalypse: The Second World War
看过,2012-06-11 21:46:18,4.0,0,影像很珍贵
看过,2014-05-16 20:35:08,5.0,0,我觉得最好的二战纪录片。
看过,2016-10-30 14:43:16,3.0,1,二战彩色纪录片让人眼前一亮，配乐更是经典，内容带着法国人特有的莫名其妙的傲慢，就二战而言，一个号称欧洲第一陆军的国家，开战六个礼拜就缴械投降，有什么资格去黑牺牲了两千多万军民打赢了战争的苏联？
看过,2012-06-12 19:02:20,5.0,0,耳熟能详的历史 更直观真实的感受
看过,2012-01-29 20:39:45,5.0,0,如果你觉得二战的历史在书上没讲清楚的，请看这部片子。不容错过。
看过,2011-10-02 14:22:45,5.0,0,"库尔斯克一战之后,仿佛丢失了观摩激情.闪电战失效,海陆空围堵,元首重复着[不是投降而是牺牲]的口号,逃过第五次暗杀.隆美尔自杀.同盟军靴踏进议事厅的那一刻,我亦不再留恋.要之,今日观毕得以圆满!(配乐师是川井大神"
看过,2011-10-02 15:09:49,5.0,1,为啥不提中国，中国在二战期间也贡献了很大力量啊，为嘛没提，为嘛，为嘛~！？
看过,2011-04-07 00:08:50,5.0,0,确实是十分出色的纪录片，组织得好。
看过,2014-06-13 11:09:40,5.0,0,没有太平洋战场啊。
看过,2013-06-04 22:01:47,5.0,0,只是对中国战场只字未提！
看过,2012-07-18 23:21:11,5.0,0,战争让人们的仇恨得以宣泄而出。
看过,2016-11-06 11:09:26,4.0,1,如果加入中国战场的史料，绝对可打五分。毕竟，缺少了中国战场的二战不能算是完整的二战。
看过,2012-08-07 07:27:45,5.0,0,我只能说碉堡了！
看过,2010-05-12 00:43:19,5.0,0,我要收藏！！！
看过,2015-07-27 11:49:30,5.0,0,生命拍下的珍贵资料
看过,2011-09-20 17:43:56,5.0,0,一部精彩绝伦的佳作！一部精心制作，大量使用绝密档案、新闻素材及平民纪录影像的二战纪录片。经色彩还原后的画面，仿若将你置身残酷战争现场，客观而发人深省的解说，警醒世人，以此为鉴。好消息是，中央电视台已经引进了该片，不用费力去找高清。这几天又复播了一遍，纪录片频道每日正午播出。
看过,2014-06-03 12:00:41,5.0,0,非常非常好的纪录片，值得观看。
看过,2010-05-04 03:31:18,5.0,0,NGFANS有480p的下载，还可以。
看过,2014-02-26 09:30:24,5.0,1,以真实的片段记录二战！唯有太短、太笼统的缺憾！
看过,2012-06-17 17:44:15,4.0,0,有点虚高，内容还值得挖掘
看过,2012-06-26 23:31:31,0,0,可能是最好的二战影像
看过,2012-01-12 00:31:10,5.0,0,第一次看到人的分量重于战争本身的二战纪录片。
看过,2016-10-23 08:51:54,5.0,0,历史永远要比电影精彩。数字修复加重新上色的画面令人惊艳，欲罢不能，好看好看。
看过,2012-07-15 00:26:37,5.0,0,真实的摄影还原  简洁的推进介绍 一口气看完让人热血沸腾的！！！  PS：  丘吉尔：跟丫死磕！  斯大林：跟丫死磕！  罗斯福：跟丫死磕！
看过,2013-03-13 21:10:17,5.0,0,真实的影像资料让人触目惊心
看过,2011-10-10 01:27:50,5.0,0,真实的纪录片远比书本看到的历史来的激烈
看过,2013-01-20 19:25:35,4.0,0,即使眼睛看到了，就一定是真相么？战争和历史是永远无法用影像和言语去评价的事，甚至亲身体会的人，也不能感受全部真相。客观视角是不存在的，我们从未了解真相，我们只能自以为无限接近真相。（同样的影像，听说央视引进版还把解说词改了，呵呵呵呵~）
看过,2012-06-25 00:24:56,5.0,1,法国人的视角 时而宏阔  时而微小
看过,2013-06-06 10:43:19,5.0,0,震撼！配乐让此片上升了一个级别！
看过,2014-01-22 20:41:53,4.0,0,影像资料十分珍贵，讲述得也很清晰，主要是欧洲战场的战役，太平洋战争涉及较少，中国人民为反法西斯战争的重大贡献也没有特别提及。做为英国制作的二战纪录片，难免有美化英国之感，但也尽量做到了客观公正
看过,2013-07-12 23:08:18,5.0,0,再次看到了战争的残酷与对人类无情的伤害，但疑问的是中国为什么几乎在整部记录片中消失了一样仅在结束时日本投降一段中被提及…是中国在西方人眼中压根算不上二战的主要战场还是那时中国没人拿着摄像机记录过什么？！
看过,2015-05-19 11:04:39,5.0,0,意义非凡的纪录片，大历史线程下不停用个人的笔记、录影勾勒细节，直观感受战争以及结束后的历史回声。
看过,2014-03-18 18:47:17,4.0,0,貌似就是央视的彩色二战的原版，进度有点太快
看过,2012-06-17 13:35:18,5.0,0,再精彩的史诗小说也精彩不过历史，因为小说是一个人的想象力，而历史，则是无数人的想象力
看过,2013-10-06 20:49:56,5.0,0,真是而残酷
看过,2012-07-26 15:53:18,5.0,0,  买到了这个的蓝光碟，第一次感受到在广州这个鬼地方的好处。
看过,2012-09-26 18:27:31,4.0,0,"看不同人的眼睛,看罗斯福与斯大林的JQ与爹一起哈哈大笑,看希特勒问道""巴黎在燃烧么""   唯一遗憾就是 要是能在电视上放法语原版的就好了 "
看过,2016-09-24 11:24:49,4.0,0,平铺直叙
看过,2010-06-20 22:05:13,4.0,0,虽然大部分是修复的画面……不过还是很珍贵
看过,2010-02-03 23:25:25,5.0,0,"probably the best documentary on WWII, enlightening, touching, absorbing!!! "
看过,2012-06-17 14:49:36,5.0,0,很喜欢天启这个名字
看过,2013-07-08 23:08:51,4.0,0,二战的开端，觉得信息的范围还是有点窄，令人惊奇的是BGM居然是川井宪次，难怪有高达的感觉...
看过,2014-03-15 19:40:21,5.0,0,战争带来毁灭
看过,2014-12-28 15:17:52,5.0,0,日本干不干珍珠港美国最终都会参战，孤立主义已经过时，帝国崛起的利益需求驱使美国要更多地渗入到各个战略地区。二战只有一个结果：“轴心国必须无条件投降，不会有谈判”，大势如此。
看过,2011-10-22 15:23:41,5.0,0,超真实的记录 大致了解二战的过程 可惜没中国的部分
看过,2011-09-28 17:26:49,5.0,0,影视艺术概论课上看的【爽儿蓓蓓其实我觉得这门课还不错...
看过,2018-02-12 22:31:10,5.0,0,和平
看过,2017-04-04 12:18:50,5.0,0,平实讲述二战，所有战役都是点到为止
看过,2014-04-14 14:58:04,5.0,0,！！！！！
看过,2013-06-02 17:59:52,5.0,0,彩色的看得太爽了！
看过,2017-05-16 10:18:02,5.0,1,值得更多的星。非常值得一看的二战纪录片，竟然能在CCTV看到，不过有删节。有些战役看得人无论精神还是肉体都感到了疼痛啊！
看过,2013-11-19 01:52:41,5.0,0,光是这些影像就够打五星
看过,2012-06-15 20:16:40,5.0,0,各种影像资料，真是好！
看过,2011-09-22 17:02:02,5.0,0,我心目中No.1的记录片
看过,2013-08-20 21:40:57,5.0,0,人类应该永远记得的那段历史。
看过,2017-04-15 14:42:01,5.0,1,希望世界和平
看过,2014-01-18 22:44:55,5.0,0,“地球唯一喜欢战争的民族，往往最残忍的暴行都出自声称自己为自由战士的人们。”我忽然想起电影战争之王里面的这句话。二战中的种种，有太多的是非对错，但真正遭受苦难的却是手无寸铁的平民。很珍贵的影像，向当时身处险境拍摄的人们致敬。只是，历史永远由胜利者来书写。2014.01.18
看过,2012-06-16 22:12:57,5.0,0,善恶从来就是相对的阴阳两面。这就好比是几个人想打架，拖了整个世界陪他们玩儿，悲剧的总归是我们这等屁民。反正看完的结论就是：谁都不是好东西。PS:几乎没有中国战场部分，但是我想即使有，不被天朝砍掉的可能性也微乎其微。
看过,2011-02-16 17:59:28,5.0,0,无法超越了
看过,2011-07-29 16:26:43,5.0,0,看了半天，动都没动
看过,2011-12-28 11:59:04,5.0,0,绝对五星，绝对震撼
看过,2011-03-01 09:05:18,5.0,0,只有这么少人看过，太可惜了，我是从不爱看战争片的女同胞，可一下子就被CCTV纪录台的《天启》吸引住了，上网一搜，原来是国家地理频道的节目《二次大战启示录》，PPS上有，所以用每天看两集，三天看完，真是好看啊，历史真是让人很感兴趣的东西。
看过,2018-01-12 21:38:33,5.0,0,所谓的德日意，或许可以再加上维希法国 。二战应该始于西班牙内战和中日战争，而余续直到希腊内战、中国内战、朝鲜内战，这么说至今还没结束。
看过,2013-10-26 14:54:13,5.0,0,忘不了的是影片中那些普通人的笑脸。里面有一集讲到中途岛战役很有意思，日本打算突袭中途岛，结果这个计划被美国破解了。在两个国家交战前夕，双方都做好了痛击敌手然后流芳百世的准备，于是都请来了记录者，日本请了位画家，美国请了电影导演。最后美国守住了中途岛。
看过,2012-07-18 19:38:07,5.0,1,全彩色的胶片复原了二战的影像，每一集都是用了“华尔街日报体”配合法语温和的解说，反衬片子里一个个残暴的镜头。唯一的瑕疵就是前五集都给人感觉轴心国所向披靡，却在最后一集一溃千里。
看过,2017-06-03 20:59:17,5.0,0,Apocalypse - La 2ème guerre mondiale (2009)
看过,2010-09-24 12:28:36,5.0,0,配乐可以加4颗星
看过,2012-12-10 10:17:53,5.0,0,好~
看过,2015-06-15 21:10:22,5.0,0,可能人类真的是一场瘟疫吧，地球在打了些许嚏喷、发了几次烧之后终于决定不再姑息这个问题。认识且承认自己生来就是个bug不容易啊
看过,2013-11-02 22:23:16,5.0,0,神作
看过,2011-04-22 10:31:57,5.0,0,战争的反思。怎么开始，如何结束，战争史政治的延续。地图分析图好漂亮！
看过,2013-08-01 22:10:50,5.0,0,视角已经极客观了，很多珍贵的彩色影像，没有在军事战略等细节上花太多篇幅，如结尾所说，献给被极权统治戕害的人们，最好的二战纪录片。
看过,2018-02-26 20:29:17,5.0,0,又重温了二战史，胶片上色。法国人的视角，不偏重军事，关注普通人的感受，最后致敬了在战火里冒死拍摄纪实电影的摄影师们，真的很伟大
看过,2011-06-12 08:37:46,5.0,0,人心深处的自我毁灭倾向。
看过,2013-07-15 20:24:53,5.0,0,还不错的纪录片....
看过,2015-11-11 20:23:33,4.0,0,虽然不遗余力的黑毛子，当我看见西伯利亚的军队踩着雪橇拿着枪从雪山上冲下来的时候，还是跪服了。红军万岁！！！意识形态不要太恶心~~毛子不好，西欧米帝就很人性化了吗？半斤八两
看过,2011-12-24 14:56:35,5.0,0,片中的许多片段之前就已看过
看过,2012-02-02 10:25:38,5.0,0,确实是非常精彩的纪录片，喜欢英国和苏联不屈的精神。法国太懦弱了。
看过,2018-03-14 19:47:34,5.0,0,本二战爱好者没事做就会翻出来看的纪录片之一
看过,2011-03-11 09:37:33,5.0,0,这是目前为止，看到过的最好的二战纪录片。
看过,2010-08-09 15:04:12,5.0,0,珍贵的影像记录 非常值得一看 最后的制作花絮没有中文字幕啊 后悔法语木有学下去 遗憾 ps：川井宪次的配乐不错 
看过,2016-02-12 21:55:52,5.0,0,很震撼！而且这部6个小时的二战纪实片竟然全部是彩色高清影片！看的时候百思不得其解，当时的战地记者到底什么装备？最后还是在花絮中找到了答案：数码修复+上色，外加5.1声道的音效。真的比过去模模糊糊的黑白记录片好看多了，我用了近8个小时把电影一口气看完，过瘾啊！
看过,2013-05-10 13:22:51,5.0,0,原始素材经数码修复、上色后，呈现给观众的高清彩色二战纪录片，同题材中观赏性最强，网上流传最广的是法语版，建议看英文版，央视纪录频道放过，片名《天启》。
看过,2012-08-26 12:12:05,5.0,0,震撼心灵
看过,2012-06-12 20:05:33,5.0,0,cctv9。不过有时间应该看下原版。
看过,2012-10-20 08:17:46,5.0,0,很棒的二战纪录片 超多当时的记录 思路也清晰看得懂
看过,2012-06-17 21:22:47,5.0,0,看了两遍中央九的阉割版就已经觉得很精彩了，完整版一定更震撼，只是不知道去哪找。
看过,2017-04-18 19:17:07,5.0,0,ʕ•̫͡•ʕ*̫͡*ʕ•͓͡•ʔ-̫͡-ʕ•̫͡•ʔ*̫͡*ʔ-̫͡-ʔ，撸了两日，感触颇深。
看过,2012-08-21 22:06:26,5.0,0,看了那么多电影或多或少提到二战 这部纪录片终于把我破碎的影像记忆和忘得差不多的历史课本联系上了
看过,2011-09-29 22:19:24,5.0,0,非常棒，有这么多音像资料
看过,2015-06-15 20:35:41,4.0,0,彩色影像资料，文案很渣。
看过,2012-08-18 18:38:05,5.0,0,我看过的最注重人性角度的二战纪录片，全片全部真实镜头+一流配乐，效果十分震撼。片中许多镜头第一次看见，确实开眼界
看过,2014-02-06 22:20:08,5.0,0,阴雨天，在家一天看完这部六集纪录片。画面震撼，视野开阔！二战，永远说不完的话题！致敬那些在战场上留下影像志的摄影兵们！
看过,2012-06-13 21:10:25,4.0,0,二战就是德国带着小弟日本打了英国法国及其一帮小弟，继而在地球上横行霸道，又想打苏联和美国。结果苏联和美国带领英法以及一众小弟群殴了德日。
看过,2013-04-23 12:49:32,5.0,0,经典
看过,2013-01-13 13:08:59,5.0,0,珍惜和平
