看过,2018-01-28 17:16:38,2.0,54,假大空自恋心灵鸡吧汤，台词太可怕了，什么都能往真实上拗？都说黄晓明油腻，我觉得这事儿也不能全赖他吧，那种台词谁说不油腻啊
看过,2018-01-10 03:39:02,5.0,169,谢谢你，我人生中宝贵的一课。
看过,2018-01-12 00:05:21,3.0,195,很高级的一碗鸡汤，看完觉得人无永恒，只有精神薪火相传。在物欲盛行的今天，这部电影的意义大于形式。四个故事都很喜欢，但想吐槽故事之间的联系和转场实在太硬了，手法相当笨，像是学生的作品。
看过,2018-01-14 01:05:38,2.0,138,知识分子再次深刻地感动了自己。
看过,2018-01-16 23:28:08,3.0,57,3.5。相比《芳華》，我其實更喜歡《無問西東》。電影中很多地方都蠻觸動我，尤其是王力宏一段，不禁讓我想起齊邦媛在《巨流河》中寫下的故事。電影本身有很多問題，但予我而言，技巧好不好都是次要的，有人覺得矯情幼稚，但我卻在電影裡感受到了這部戲的善意和真心。
看过,2018-01-12 13:08:28,5.0,508,当时看琅琊榜，就挺喜欢黄晓明的，胡歌的梅长苏是一种“陌上人如玉，公子世无双”的感觉，而黄晓明的萧平章则是一种“名师大将莫自牢，千军万马避白袍”的气概。这是两种完全不同的演绎，都很喜欢。如今《无问西东》他饰演的陈鹏，则是“深情予你目不移，无论变换与沧桑”。
看过,2018-01-10 23:00:50,2.0,164,立意在，譬如好心的被利用、小事的变相发酵、道德的双标，本是可以让人警醒的地方，但全化作那些过于直白的说教，太让人发笑。再好的演员，都念尬了。在片头片尾糟糕的陈述外，中间章子怡的一哭与一笑，赢回了不少分数。与之对戏的黄晓明，也淳朴可爱起来。米雪很棒。张震、王力宏等人都被剧情拖累。
看过,2018-01-12 14:35:04,5.0,530,为章子怡去的，却意外被黄晓明圈粉，他演的陈鹏这一节可以说是很抓人了，感受到了晓明哥的演技，电影还不错值得一看
看过,2018-01-12 17:59:05,3.0,175,谨以此片献给珍贵的你/谢谢你提醒“珍贵”
看过,2018-01-10 21:11:13,2.0,166,5年前的章子怡，一定不会拿着剧本和导演说，你相信你镜头下的角色们吗？信念感你有吗？
看过,2018-01-24 01:25:03,2.0,39,好奇心忍不住，看完翻肠悔肚。力宏回眸一笑，观众差点呕吐。配角几句台词，喷饭外加捧腹。粤语听水批斗，还算难得之处。可圈亮点罕见，尴尬桥段无数。阅毕友圈好评，怀疑谁人盲目。摄影浪费胶片，配乐煽情过度。力宏子怡教主，表演毫无进步。即使小四张震，也就只剩耍酷。西东献礼清华，东西让人尬哭
看过,2018-01-10 21:47:04,4.0,231,说实话超出预期。能把多线叙事讲的清楚不乱在国产片中算不易，而且四条线的交接算是比较自然不做作；后半段略命题作文，配乐有点太满了..感觉埋了很多清华内部彩蛋，需要t大的来做个总结哈哈。整体来讲挺理想主义的一部片子，喊出遵从内心做自己容易，但生活里真这样还是蛮难的。子怡本人很美。
看过,2018-01-11 01:47:27,4.0,249,不怕不识货；就怕货比货，章子怡真的碾压全场啊。喜欢导演，喜欢传递的价值观，更喜欢侧面描述那个时代的勇敢，比隔壁刻意美化的芳华不知道高到哪里去了。ps，求求黄晓明不要笑了。
看过,2018-01-17 00:09:26,3.0,28,王敏佳这张拼图终于补上，她属于前章子怡时代，用本能去诠释毁灭、陨落和稍纵即逝的美好时光，起始有多炽烈，终点就有多黯淡。看她恣意抬脚，骄矜奔跑，雪白的胳膊上沁出一粒红，疼痛记忆被唤醒，这真是专属女性写意的高级盛宴。
看过,2018-01-10 22:14:44,4.0,154,其实不知道该怎么评星的电影，有不完美的地方，但很多段落确实打动了我。就像那句“这个时代不缺完美的人，缺的是真实，是真心，正义，无畏和同情。”导演很有意思，也很真诚。敬畏章子怡，宫二快用六十四手打死那丑陋的时代和人性吧。
看过,2018-01-14 14:29:21,4.0,73,我应该生在70年代，或者更早，因为骨子里我是一个特别怀旧的人，也因为喜欢那个时代，所以这类电影比较容易打动我。
看过,2018-01-14 00:05:02,5.0,180,很好看的电影，钢琴响起，章子怡背对镜头蒙上脸颊的那段，不知道为什么眼泪就控制不住了。说这部片讲故事方式差，我一点不认同，正因为这种拼接模式让观众有动力去追寻电影的答案，才会让一个“老套”故事变的更加具有吸引力。
