看过,2015-06-22 18:20:37,4.0,1,不说历史只说电影，军事历史题材拍的还是蛮好看的，最后有点掠主旋律了，哈哈。
看过,2014-12-16 23:59:45,3.0,0,文戏太弱，武戏太乱，煽情靠音乐，仰拍和慢镜头用的泛滥，嘈点甚多，BGM太糟，分分钟出戏。作战布局全无，战场基本看天命。主角有buf，一个打十个，敌方总犯二，队友神助攻，真·大韩版抗日神剧。
看过,2015-06-29 21:18:10,3.0,0,朝日双方书写时处处都是中文，而且还都挺典雅的……韩国人拍出来的日军也颇有神剧色彩，牛气冲天但是实际能力其实完全处于下风，战船虽多但是一撞就碎，火枪不错但是没有火炮连弓箭都打不过……大名与海盗王各自为战一盘散沙这倒是符合历史。李舜臣的pose摆了不少，情节到处都是狗血啊……
看过,2015-03-28 14:18:42,4.0,0,完全不符合史实，但赢在渲染人物性格和悲壮情怀上。天时地利人和是亘古不变的赢点，李舜臣赢的并非战力，而是在趋势而动，虽然战术的设定未必是以主将以身犯险来唤醒官兵的勇气，影片成功地把韩人千年来的悲情感给调动起来，海战最后落脚点在赢得百姓的尊重和信任以此回归主旋律成功的塑造了一个神话。
看过,2015-01-16 22:25:26,2.0,0,你妹的你确定日本人能听得懂片里那些咖哩啡讲的日文...前一个小时完全看不懂有讲的必要...海战也是各种看不懂怎么取的胜各种金身不败无敌状态...其他将领是干嘛时而袖手旁观时而友情赞助啊...本土票房最高是为何啊...还不如直接手撕鬼子呢...
看过,2015-02-20 22:01:39,4.0,0,战争场面的塑造。
看过,2015-05-24 10:10:58,5.0,0,导演亲自参与大陆版阉割就是不一样，相信前面的节奏已经足够紧凑。上映第二日还是周末，我所去的艺术影院只排了两场，但所幸都是原声。一百人的厅上座率达到50%，那个恐怕自己会睡过去的姑娘最后看得津津有味。大银幕上看原汁原味的韩影是最享受的。
看过,2014-12-29 01:05:49,3.0,0,有几点印象挺深：日军服饰、烟熏装、把大炮和火箭当狙击枪使，最最最重要的是韩国人难得拍了个不自黑的电影
看过,2017-11-11 05:32:22,3.0,0,持续一小时的海战，场面是不小，我就想说这朝鲜的船都是什么木头造的，真TM结实啊？
看过,2014-12-15 00:48:44,4.0,1,4.0（满分5），被打动的流泪好几次，风萧萧兮易水寒。即使最后龟船出现和最重要的一场情绪感染被删依舊不会太影响整体感觉，但被删总有些遗憾的。。前面被删后面也被删。。如果不删必须4.4，等同一步之遥。
看过,2015-09-07 20:34:46,3.0,0,No.43 基本就是崔老师的表演，但总是感觉戏说的成分更多一些
看过,2015-03-05 14:10:55,3.0,0,神机箭
看过,2016-03-16 12:54:49,2.0,0,提不起看的兴趣。
看过,2015-05-01 20:46:42,2.0,0,看评价以为很好看很刺激很精彩。结果一个都没有
看过,2016-11-26 07:51:30,3.0,0,HÂO-HAO看特效BA°...BIÉ分神関注別DI°點...
看过,2014-12-13 00:41:31,3.0,0,故事总结一句话，李瞬臣大败海贼王。
看过,2014-12-19 23:37:17,4.0,0,这场战役韩国人确实曾经手撕鬼子了……
看过,2015-11-24 20:04:01,3.0,0,这种题材你还准备怎么样，你还能怎么样。
看过,2015-01-08 03:25:11,3.0,0,占影片一半时间的海战戏，有场面，有节奏，跌宕起伏，张弛有度。而通篇弥漫的民族危亡时破釜沉舟、视死如归的气概，令人热血沸腾。在儒家文化圈，中韩在民族自豪感方面的演绎真是相似。
看过,2015-01-02 19:21:24,3.0,0,表演很不错。
看过,2015-04-01 23:38:47,5.0,0,比国内的抗日剧好看，一位仁勇智俱佳的将领，里面的战术很有意思。比如令旗兵经常被射杀，看潮也重要。
看过,2015-04-19 23:19:19,3.0,0,爱国就要表现得很壮烈。恐惧变勇气。
看过,2014-12-26 17:19:39,3.0,0,中规中矩的民族主义历史片，一个小时的大铺垫，一个小时的大高潮，结尾卖关子告诉你会出续集走着瞧…
看过,2015-01-03 15:45:12,4.0,0,海战拍得精心刺激，明知是主旋律，但无法不被其吸引。前面拍得冗长了些，不太吸引人。7.5
看过,2015-01-26 22:44:28,4.0,0,棒子国的电影，要说精彩还真是天朝很多都比不上的。20150126
看过,2015-04-27 01:18:45,4.0,0,最大的硬伤是纸上写着的那句“万历三十年”。
看过,2015-03-06 10:19:12,3.0,0,韩国的漩涡，想起日本的神风。看韩版手撕鬼子，依然还是那么过瘾。
看过,2014-12-21 12:50:54,3.0,0,工艺不错，但剪了20分钟，迟到20分钟，然后还是个中文配音版…… 自然跳戏，回头下完整版再议，不过韩国人民的爱国情绪真的是很容易被点燃，和他们的足球差不多，缺谋略技巧，凭一股子横冲直撞的蛮劲和勇气，也倒是能嗨起来。
看过,2015-06-14 09:18:14,2.0,0,不明觉厉，一定开挂了。。。。
看过,2014-12-30 09:47:44,3.0,0,韩国的抗日神剧，服装道具不错
看过,2015-01-14 21:52:47,3.0,0,三星半吧，演员是自带慢动作在砍杀吗？崔岷植那山根横纹，耳垂皱褶，心血管疾病要注意啊。
看过,2015-01-28 00:07:14,4.0,0,干的漂亮
看过,2014-12-13 22:47:58,4.0,2,要说剧情呢 没了解过这段历史 那些脱世的剧情不发表意见 不过全程落泪3次我实在不知道自己怎么了。。。在今天1213这样的日子  没有亲身经历过的沉痛总是容易被消磨 
看过,2014-12-07 20:21:49,3.0,1,《鸣梁海战》铺垫文戏据闻被砍二十分钟，这或是直接导致前篇人物塑造稍显苍白的因由，而在海战对决上，诚然能尚算精彩，但在远景宏观特效可能还是碍于成本和技术的限制，有着较为明显的微瑕，至于煽情一直是韩国电影所善，更何况这样一出民族英雄的国戏。
看过,2016-04-10 01:25:38,3.0,1,柳承龙和赵镇雄说日语台词竟然完美同步 6.9/10
看过,2014-12-19 19:07:24,3.0,0,海战看着挺燃的，但部分煽情，还是太猛了些。
看过,2014-12-15 23:17:07,3.0,13,应该叫鸣梁海瞪，瞪来瞪去，中间睡过去，醒来还在瞪，赫然被双方将军们瞪哭了。
看过,2014-12-15 22:53:16,0,0,崔大叔太帅了，一个人撑起了整部戏。别的人，尤其是日本那边感觉像是演舞台剧一样的台风怪怪的。杀马特海贼王那边的人一定要话那么重的尤其是下眼线吗！！那个狙击手真的是直到最后一刻才发现是男的。僧人开始动手那一刻太热血。整部戏都很热血，至于史实，我真的不知道啊！！！单论片子真的很燃！！
看过,2014-12-27 11:16:25,3.0,0,韩式主旋律。
看过,2015-01-08 15:25:26,3.0,1,话说我干嘛要花两个小时看韩国棒子的爱国主旋律电影手撕鬼子啊………
看过,2015-01-18 21:07:37,3.0,0,剧本实在是很一般，爆兵一波流，制作也说不上多精致，不过尚可一看
看过,2014-12-16 21:13:40,3.0,0,水可载舟亦可覆舟在傲娇的大韩民族眼中显然是不能用在自己身上的 bug算什么！我们拼的是民族气节！不得不承认影片的配乐与节奏把握很到位 成功营造出了战争的紧张与棒子们积极的作战精神 后半段的海战更是尿点全无 
看过,2014-12-29 23:02:42,3.0,0,先有宇宙还是先有韩国人？
看过,2014-12-17 21:36:57,4.0,0,场面真是屌，产业的力量
看过,2014-12-29 18:04:35,3.0,0,★★★☆ 历史科普了一下鸣梁海战与露梁海战的区别，好像前者确实与天朝没什么关系，确实以少胜多。片中一大堆大发熕、佛郎机、鸟铳、火箭，真是热兵器爱好者的菜。
看过,2014-12-14 22:20:11,3.0,1,删了将近20分钟，观看过程居然毫不受影响，可见前面的文戏有多贫
看过,2015-05-08 20:19:04,3.0,0,很普通啊，娱乐效果还不如赤壁呢，至少煽情上做的很到位。以少胜多看上去也很简单，没什么技术，靠的是船坚炮利，至于白刃战就很狗血了
看过,2015-08-01 20:50:45,5.0,0,及其惨烈的背水一战，大快人心！
看过,2015-04-10 00:03:36,3.0,0,一部片靠一场戏撑起来也是醉，虽然n多说不通的但也算是全程无尿点了。
看过,2015-01-02 21:29:29,3.0,0,很少了解的一段历史
看过,2014-12-16 15:05:36,3.0,0,韩剧也学我们抗日神剧啊
看过,2014-12-16 11:12:25,3.0,0,公映
看过,2014-12-14 19:15:50,3.0,0,八百里开外一箭射爆鬼子的眼睛。某2场景还是蛮感人的。日式铠甲帅！
看过,2015-03-12 21:56:33,4.0,0,跟明朝那些事儿里说的一样 龟船什么的 。并且真的太不容易了。战争真的太不容易了。
看过,2015-11-18 23:57:19,2.0,0,照比导演本人的前作《最终兵器：弓》简直差得太远了好吗！基本就是一通胡打加上几句故作深沉的台词，故事和人物塑造毫无层次。其实在这种抵抗侵略的语境下单调地鼓吹爱国主义倒是也没什么过错，但是跟《弓》那种对庶民真实感情和魄力的书写相比，这部就是冗长的一坨废料。
看过,2014-12-17 01:24:07,3.0,0,high太久也会累的
看过,2016-07-19 23:57:11,3.0,0,这种主旋律越来越不讨人喜了，看完才知道棒子这也是强行把自己捧上神坛，＂扭曲历史＂还这么激情，跟我天朝抗日神片有点共鸣，不过…至少人家在海战的场面和故事上下了不少工夫，国人还是多学学吧。
看过,2014-12-12 19:14:43,3.0,0,文戏还是不行，海战挺帝国时代的
看过,2016-03-05 15:54:40,3.0,0,韩国人的抗日神剧。
看过,2015-01-03 22:13:46,3.0,0,精彩部分全部在后半段，紧凑悲壮的海战看得出韩国电影人的诚意，但是前面铺垫太长对于一个中国观众来说就显得太闷了，毕竟不熟悉韩国的历史背景，这种电影最多也就是当一部普通的商业片来看，没有情怀上的共鸣，总给我一种拿给吴宇森拍就是《赤壁》，拿给戈尔·维宾斯基拍就是《加勒比海盗》的感觉。
看过,2015-01-03 15:53:16,2.0,0,最后只有一个4D影院在上，注意力全部集中在不要被前面的水柱喷到上去了
看过,2015-01-21 13:20:59,3.0,0,其实还不错吧就是容易出戏
看过,2014-11-19 18:47:46,4.0,4,均衡的两幕，上半部表现战前的压抑绝境，下半部是60分钟置之死地的残酷大海战，于史实略有出入，煽情也在所难免，但仍然是好看的。海战部分，硬桥硬马，并不含糊其辞，前半部的压抑气氛，个人触动更多。导演金韩民前作《最终兵器：弓》，也很不错。
看过,2014-12-13 23:10:39,4.0,3,我大明属国的这部古代海战非常不科学，但是满得溢出来的配乐和澎湃的勇气真的让电影特别的热血（燃到忘了倭寇为毛没有大炮？）。在民族主义抬头的当下中国，哪个导演能拍出这样一部商业水准和煽动水准都高的抗日神剧，很有可能会得到圣上赏识。
看过,2014-12-13 23:15:11,4.0,1,7.5。主题明确，层层披露以少胜多、以弱胜强的过程，激动人心，无有冗节。唯一疑问，反派刻画似前重后轻？
看过,2015-01-23 13:54:35,3.0,0,你能告诉我 最后的神龟船怎么蹦出来的么？。。
看过,2017-08-12 23:07:42,4.0,0,基本按照韩国方面的史料呈现了这场奇袭 因为有朋友为电影提供了日本军队的盔甲而感到各位接近
看过,2014-12-15 22:45:42,5.0,0,秒杀我朝的战争片。这真的是韩国拍出来的，确定不是好莱坞？韩国的主旋律爱国电影真TMD煽情，牛！
看过,2015-05-08 18:15:56,4.0,0,一场海战燃到底，我国要拍个这种程度的主旋律，估计全场要泪崩了。太热血了（乱什么的都忽略了，被崔眠植大叔的魅力击倒）
看过,2014-12-12 23:42:55,3.0,0,终于明白此片为何可在天朝上映，面对小日本我们的情绪真是一样一样的。电影前戏也是铺垫得过长还没说明白，后面高潮戏也就那么回事，看得很不走心，不知是什么原因。这片在韩国能票房冠军，我真不觉得十三钗南京南京比它差啊。
看过,2015-04-05 11:19:06,3.0,0,好人好相，坏人坏相
看过,2014-12-28 20:56:24,3.0,0,有点拖沓 天朝版剪掉20分钟应该不影响观看
看过,2014-12-14 17:54:04,3.0,0,循规蹈矩有理有效，阵势兵法过关斩将带出的游戏感很燃，其实也没有什么历史叙事可言，虽然感觉是有企图的。院线删节版。柳承龙太委屈...权世仁很像黄轩啊...
看过,2018-01-18 12:01:35,4.0,0,海战部分占时长的一半多，很精彩。看演员表才发现有赵震雄，倒回去再看了一遍才认出来_(:з」∠)_
看过,2015-03-07 23:43:56,4.0,0,他为啥赢得不这么传奇呢
看过,2015-05-03 13:36:52,2.0,0,剧情推进半点悬念没有
看过,2015-06-17 03:25:30,4.0,0,前半段史诗，后半段是屎。崔岷植依旧值得一看
看过,2015-02-01 22:18:20,3.0,0,看到了历史课本里的龟船！
看过,2014-12-18 22:59:23,4.0,0,相比同期上映的国内战争片太平了轮真是好太多 太平轮就是渣
看过,2014-12-14 14:46:51,3.0,0,虽然意淫过度，但是人家电影工业水准摆在哪，不服不行。
看过,2014-12-16 17:13:39,3.0,0,人物太苍白，尤其是日本方面，真不用找柳成龙、赵振雄这样的演技派，完全没的发挥，而且还说日语。。。我是受够了韩国演员说普通话了，他们说日语的水平，我可以想象得到。。
看过,2015-01-04 19:22:37,4.0,0,一场海战被韩国拍成了一个故事 还这么精彩扣人心弦！那段海战绝对堪称经典！
看过,2015-01-04 16:42:33,3.0,0,关于历史的真实性不做评价，单从电影的变现力尚属不错，崔岷植不愧老戏骨。
看过,2015-01-31 12:22:42,4.0,0,本片历史演绎的不算过分，题材和构思一直是国内编导欠缺的，希望合拍的续集能有所突破，也算普及被遗忘的历史
看过,2015-04-22 14:09:16,3.0,0,额。。剧情太肉了。。到后40多分钟海战才还有些看点。但是到了后边bug又太多。。看来韩国这观影人次主要是民族情绪在里面。
看过,2015-01-11 23:56:22,3.0,0,韩国主旋律，很多的细节有经不起推敲的地方。此外，韩国人演日本人，和中国人演日本人一样，一眼就能看出个假来，气质不对。
看过,2015-05-23 09:19:11,4.0,0,技术层面上，牛笔，韩国人拍战争片水准真高，虽然也有比如让敌方显得太菜太二的此类电影常见问题，但是拍的就是故事顺畅，场面宏大，激动人心啊。同时水战，再看看吴宇森拍的那玩意儿，差距太大了。
看过,2014-12-31 15:20:21,3.0,0,受不了崔岷植那张故作深沉的脸，战争片还是交给中国人拍吧
看过,2014-11-19 17:03:19,2.0,1,抗日神片思密达
看过,2014-12-31 19:42:12,2.0,0,唉，抗日神剧，韩国出品，喜欢YY的，又何止我们
看过,2015-10-25 01:11:08,4.0,0,基本圆满解释以少胜多的不合理，不做作，值得一看
看过,2015-01-03 10:58:05,3.0,0,爱国主义主旋律造就的票房神话。更多的是小宇宙爆发开挂式的英雄，真正的战略战术没怎么表现。特效也好，场面壮烈也好，整体还是显得平庸。
看过,2014-12-12 15:22:36,4.0,1,个别煽情镜头略长，如果我是韩国人的话，可能会看不厌。总体来说，拍得相当用心，对日军的表现甚至比日本人自己的历史片还精细。我国导演拍不了这样的历史片，原因在于心都已被污染了。
看过,2014-12-13 19:10:37,0,0,再看抗日神片就戳死我自己，即使是为了崔叔
看过,2015-03-22 15:30:12,2.0,0,看了《看见恶魔》、《亲切的金子》……后对大叔怀有恐惧
看过,2015-01-23 22:39:27,4.0,0,棒子的抗日神剧，正面人物中只死了一个还是向我开炮，但至少没有手撕鬼子的桥段
看过,2015-03-14 12:09:32,4.0,0,这是第一次去电影院看的韩片
看过,2015-01-09 10:10:02,2.0,0,除了海战戏在谋略和场面上值得一看外，其他方面没有任何看点。简单粗暴的韩国抗日神片。对于不了解那段历史的中国观众来说本片只是一场以少胜多的海战而已
看过,2017-02-20 17:51:33,3.0,0,2014.12.12@万达CBD
看过,2014-12-13 15:24:58,4.0,1,这是我第一次看，韩国古装电影，此片应是韩国的抗日神剧，此片比起年初题材相似的300勇士要强得多，实景混合CGI的效果，绝对比仅运用其中一部分要好，不知是不是被剪得原因，李舜臣的英雄气概看不太清楚，不过用实景拍摄来突出肉搏的暴力美感，冲击力远超特技。
