看过,2017-07-20 22:25:44,4.0,13539,用最贵的演员，露最少的脸。——《诺兰哈迪传》
看过,2017-07-21 13:05:40,5.0,12362,没有慷慨激昂，没有热血沸腾，没有英雄的冲锋，没有人性的光辉。只有惊恐的士兵，泥泞的海滩，阴暗的天空，草芥的生命，求生的欲望，沉闷的气氛，压抑的绝望。战场就是炼狱，生命就是这么卑微不堪 #你热爱战争的唯一原因是没参加过战争#
看过,2017-07-20 13:43:34,5.0,6742,不懂干嘛都说当悬疑片？根本就是一部很写实的战争片。那些讲拍出盗梦空间感觉的朋友，我合理怀疑你两部电影都没看过。
看过,2017-07-13 10:56:38,5.0,5355,我预测，这将是2018年第90届奥斯卡最佳影片、最佳摄影、最佳导演的片子。诺兰大神功课做得足啊，学习了《党同伐异》《日出》《大幻影》《死囚越狱》《扒手》《恐惧的代价》，所以拍出了《敦刻尔克》。因为视听语言把握得好，所以故事讲得好。hope与home，愿每个生命都能得到拯救。审视当下，珍惜和平。
看过,2017-07-19 17:08:22,4.0,4345,喜欢这个抛弃了繁复叙事、投身极简主义的诺兰。没有背景没有铺垫，第一个镜头就将观众拖入战场。一周、一天、一小时，三条故事线反复绞杀心灵，不用血腥暴力也能呈现战争带来的压迫感。IMAX+70mm=最佳观影方式，轰得想喊救命...（推开眼花缭乱的小鲜肉为汤老湿打call!!）
看过,2017-07-21 11:34:57,3.0,3726,你们逃走了三十万，成就了一个非凡的行动；我们仅仅南京就殁了三十万，在中国人的历史面前，再大的IMAX屏幕和音响，都微不足道。
看过,2017-07-19 23:22:59,3.0,3177,的确是尊重了史实，这也导致主线只是了无新意的流水账，拯救观感全靠一手诺兰式“伪震撼”：用夸张极端的音效+BGM+运镜堵塞观众的大脑，只留下眼睛和耳朵，强行把20分的剧力在感官上虚高到90分。同时本片在表达上又极度匮乏，对人与战争的思考几乎完全没有，可以说是外强中干到了极致。
看过,2017-07-18 08:18:00,4.0,2813,四十万人去哪了？
看过,2017-07-21 00:16:04,2.0,2411,哇竟然整部戲鋪滿音樂，是從頭到尾舖滿！！根本沒有東西看，一直靠配樂強行製造緊張感，強行煽情，配樂聽到想吐。這部戲充分暴露了諾蘭一直以來想兩邊討好，一方面想扮大師（去戲劇化），一方面又想追求極致通俗效果來討好觀眾（猛加音樂）的矛盾。不可否認視覺和執行力依舊一流，但卻僅此而已
看过,2017-08-02 16:07:37,4.0,2275,三条故事线，不同时间长度，却有意平行剪辑，造成假象。这一回没太多叙事花样，也没什么视觉奇观。主要还是还原恐怖气氛，营造当时的绝望与紧张感。这里有英雄也有被吓破胆的普通小兵，小兵代入感更强。音乐对影片情绪有强烈的推动，也让结尾更加释然。结尾滑翔真的很美。算诺兰一次新的挑战。
看过,2017-07-20 22:58:46,5.0,2333,诺兰对卡梅隆说：“我来教教你怎么拍沉船。”
看过,2017-07-23 09:00:50,3.0,1715,太一般了，就不要吹什么史上最好的war movie，我还真的可能找不出什么比它更差的来，imdb上诺兰粉都已经失去理智，希望豆瓣的各位不要因为追捧一个导演而人云亦云。全片最可爱的还是汤老师，依然带着面罩没什么屁话，一如既往fuckable
看过,2017-07-23 02:22:33,3.0,1446,英国人真喜欢排队啊。。。
看过,2017-07-13 16:22:50,5.0,1362,一个《敦刻尔克》，生生拍出了《盗梦空间》的即视感。把尽人皆知结果的一个历史事件拍的全程悬念迭出，让观众屏住呼吸看完全场，恐怕也只有诺兰了。。。
看过,2017-07-20 12:53:30,3.0,1212,"外网评价虚高得一塌糊涂………虽然喜欢汤甜的空战戏份，但我看不得这么色调清新精致煽情的战争片，觉得特别假。也不喜欢结构和节奏。
诺吹勿扰，非粉非黑，不要觉得你喜欢的东西别人就一定得喜欢。
还是建议去看，但不要信评分，用你自己的感受和判断力。  "
看过,2017-07-20 18:04:51,5.0,1061,反正我是不知道，一个能实拍就不用特效呼你脸，说不拍续集就不拍续集，从来不拍3d圈钱，平日里也低调重家庭几乎看不到对他私生活的报道，还从来不拍烂片的导演，为什么会有黑？还想怎样？
看过,2017-08-06 19:36:04,4.0,883,无聊是真无聊，主旋律是真主旋律；但是这个牛逼至极的结构足够诺兰及其粉丝吹上十年的，也够电影学院学上十年的。仍然是在时间切分上面做文章，但是竟然还能玩出新花样真是不得不服。就凭诺兰对时间的理解足以牢牢霸住一个当代大师的位置。
看过,2017-07-20 23:29:02,5.0,794,我是诺吹。不是吹牛逼的吹，是英吹斯汀的吹。这个时代再没有人能做到他这样，拿着主流资本，做出来的却完全是独立实验。它可以是一次极简主义感官体验，可以是对历史的存在主义修复，也可以是一种对当下英国脱欧的巨型隐喻。它可以是来自电影本体的很多种成果，这就是它的有趣，英吹斯汀的吹。
看过,2017-07-13 16:01:17,5.0,922,之前还担心电影只有107分钟会不会太短，因为诺兰之前的电影时间都很长可以把故事讲的细致入微，不过这一次他把握的很足，在该有的时间点插入什么样的故事，麻雀虽小但五脏俱全，时间虽短但该有的故事都讲的很全面了，并且不会再有多余时间去讲述别的事物，而且整体节奏还很快，一部成功的实验影片。
看过,2017-07-21 01:32:31,3.0,861,诺兰吹还是请休息吧，这片根本没跳出他的套路题库，不过反正他拍什么你们都夸神作神作。法国人看完该气疯了，猴屁股拯救青蛙。而汤老师再次被蒙脸。
看过,2017-07-20 08:50:55,4.0,585,多线叙事的优缺点在这里都很明显：成功撤退是史实，故事的悬念就不能用结局来制造了，三条线如何交汇才是重点；而在几个故事中来回切换次数多了，吸引力到后来远不如开头，只能通过回到诺兰最喜欢和擅长的——传统的家庭观念、孤胆英雄的奇迹等等来激发情感，所以战争背景比较模糊，当是冒险求生片吧
看过,2017-07-20 09:07:47,5.0,756,我不管，反正诺兰是我心目中的最佳导演，《敦刻尔克》是我心目中的2017年度最佳影片。
看过,2017-07-22 03:57:43,2.0,633,@phenomena 70mm胶片。期待降了又降还是觉得失望不已。像米其林餐厅用顶级食材做出一盘毫无味道的菜，寡淡得令人费解，除了耳鸣般烦人的配乐再无其他印象。喜欢的都在汤老湿那条线，战机逆着阳光掠过沙滩，转瞬即逝的平和安详，和本片的优点一样难得。我可能还更愿意看their finest里他们拍的那部片。
看过,2017-07-20 05:41:24,4.0,371,Meh
看过,2017-07-23 09:06:33,3.0,530,5分钟的故事拍成2小时，没干货，四五个人看完都这种感觉
看过,2017-08-22 21:02:57,5.0,368,【A+】可能是诺兰剧本最“薄弱”的一部，但极简的故事对应的是极其强大的视听，以一个独特且微观的视角，用只有电影才能做到的手段完美表达了战争给普通人带来的恐惧情绪。不再具有精巧但匠气的情节设计，却更纯粹，更成熟。曾被吹捧上神坛的伪神，已化为真正的大师。
看过,2017-07-28 10:44:25,4.0,349,期待看战争叙事人性情怀的观众大概要失望了，影片重点更在重现撤退的惨痛与残酷。三个视点，三条交织的时间线，有英雄主义但保持在了情理之中。最大优点是主观与客观镜头的转换剪辑，无论空战还是逃生，都在转换中营造出了精彩的紧张感。Hans Zimmer的配乐也功不可没。
看过,2017-07-20 19:12:02,3.0,362,诺兰自己做减法，但叙述还是玩结构，以前的问题更加暴露。寂寞的音乐从第一秒就满到电影结束。突然想想，在那样的配乐烘托下，完全没有高潮可言。
看过,2017-07-13 18:46:47,4.0,394,从导演到剪辑到摄影再到配乐，诺兰再次证明自己是这个时代最伟大的电影制作人！！！
看过,2017-07-21 12:21:06,1.0,408,爱国主义加成对别国观众没用，平行剪辑基本没用，很多地方差一口气对人物刻画不够。相比导演其他片，很失望
看过,2017-07-23 01:59:57,2.0,376,"5.7/10,刻意去除對白並不代表沉寂敘事，想試行極簡風格卻加入大量配樂，前者失去人物堆砌，導致情節薄弱，後者造成失去危機，形成空洞。構圖亦是一大浪費，某些手持攝影，淺景深等，失去人物與環境的連繫，空戰場面過多奇怪角度，剪輯亦失去了流暢度，缺乏生死的緊繃感"
看过,2017-09-06 19:29:53,4.0,267,一开场看到这么多卷毛蓝眼英俊小哥哥心想大事不妙，又要来那套把美丽的东西毁灭给人看了我不要啊呜呜呜。结果诺兰这个死颜控，根本没舍得杀俩就全部送回家了，好吧算你干得漂亮。
看过,2017-09-01 18:56:49,4.0,225,诺兰电影生涯的最佳。他终于有了难得的电影意识。通篇是飘散在空中具有极强摄影机意识的穿梭散点视角，塑造了力量感涌动的诗化空间，得到了点马利克细细红线的神韵。音乐用的极好，它不是配乐而是与画面平行的另一个延续性视点。汤姆哈迪最后的亮相个人英雄范儿爆棚。年度十佳。
看过,2017-07-25 14:39:18,5.0,254,4.5星。倒不至于说神作（神不神作重要吗？），别被前期的各种宣传口号蒙蔽。虽然如此，依旧称得上是杰作，之前一些朋友说得对，特别古典主义，没有什么花样机巧的东西，海陆空三个视角，也是三个故事线，感觉电影的重心不是演员不是剧情，而是整体的一个氛围，作为历史大事件的厚重感。
看过,2017-07-29 21:51:30,1.0,275,沙马兰只是个孩子，诺兰幼稚得像个孩子
看过,2017-07-22 04:26:38,2.0,261,太匠气，所谓的实验性，只是把三条大部分时间毫无关联的故事线平行到一起强行拼成三段式的框架，问题是每一条线的紧张感都不在于调度和故事，而是从未断绝的烦躁配乐；本质上这个故事冲突极弱，无功能的人物用来拼凑剧情，但伟光正的结尾又让他们不了了之，招牌的平行剪辑也比巅峰期笨拙不少
看过,2017-08-02 18:51:13,3.0,217,給Gespenst老師猜對了，這片並沒有比1958年米高梅版的《敦克爾克》（Dunkirk）更好；至於要我來說，差距的關鍵只有一個，即諾蘭與華納顯然都沒有搞懂，何謂真正的狼狽。
看过,2017-09-01 13:31:52,3.0,212,诺兰心心念念从小听到大的故事，被他以个人化的方式叙述了一次。没有铺垫，直接进入高潮，然后把高潮不停拉伸。配乐高于叙事。
看过,2017-09-07 19:13:20,4.0,165,        影片绝对是诺兰的一次个人化表演！三条不同时间线的主观战场体验，将反战主题体现得非常独特。赞！
看过,2017-07-23 01:36:55,2.0,241,"1 week 1day 1hour的敘事是不錯，但每線內容貧乏，使三線重疊時達不到效果。
同類的眼高手低之處不少"
看过,2017-07-23 01:34:47,3.0,217,场面其实比预想(宣传)的小，三十万人的包围圈稀稀拉拉的，不觉得有三十多万人被围也就体会不到当年英国民众那种“日，全国小伙子都被困海峡对面了”那种感觉。最失败的是片尾让演员念丘吉尔的演讲，怹老人家当年的录音还在，那种慢条斯理但是跟丫死磕的气概，比这个不知高到哪里去了。
看过,2017-07-24 08:42:52,4.0,211,年度绝望大戏，画面的美都排不上了，想象导演和负责电影原声的作曲人说，我要电影从头至尾都是不安与绝望。好的战争电影应该是这样的吧，不是英雄主义，而是让你真的永远不想战争发生。
看过,2017-09-02 14:52:13,4.0,152,还是诺兰式的压缩时间和平行剪辑，这次像以前诺兰电影的第三幕，整部电影都是平行剪辑，可以说他把第三幕扩展到了100分钟，不一样的尝试是他这次选择了极简主义的路线，隐去了作战双方比较宏观的呈现，将视角锁在了英军的救援，用IMAX摄影机来呈现视觉上的宏大，据说画面的大和清晰可以给人VR的错觉。
看过,2017-07-23 10:23:11,4.0,181,这也要玩时间线！医生你说这病还有治吗？最大的优点是PG分级，老少咸宜。缺点是怎么也看不出这事涉及几十万人，用一个师的格局讲三个集团军的故事，总觉得哪里不对。德军就是“自然灾害”般的存在，这其实是个灾难片。还有白瞎了我汤老师。
看过,2017-07-22 11:05:06,5.0,178,其他导演还在玩长镜头的时候，诺兰和季默已经在捣鼓长配乐了。 来温哥华的九年里在电影院看的第500部电影，怎么可以选错。
看过,2017-07-18 04:19:57,5.0,196,70mm一刷，IMAX 70mm二刷。不要当作战争片，要当作悬疑片看！一周、一天、一小时三段主线插叠，部分同时空事件复调，因撤退主题明了所以不乱，却更有效的把各高潮均匀铺开，一直让人紧绷，结构很高级。IMAX70很儿戏，全片约50处明显切回70胶片，很不适，且音效大到聋。
看过,2017-09-01 22:33:45,3.0,176,梁山好汉鲁智深有句话说得好：嘴里能淡出个鸟来!
看过,2017-09-11 19:11:27,4.0,116,撤退的意义不在于输赢，而在于求生。诺兰迷恋小鲜肉，颜值高的都活下来了…
看过,2017-07-18 04:13:27,3.0,185,三星半 ／ 二刷 诺兰粉表示失望／7.17法国首映及诺兰见面会／一场从未如此艰难的回家之路 敦克尔克带给30几万幸存者的可能是永远的噩梦／说不出哪里不好 可能是期待太高 没有特别惊艳 / 基本上预告片有哪些电影就是哪些了
看过,2017-09-01 22:37:26,3.0,104,“诺大师”终究还是个匠人，为了玩结构可以抛弃人物、故事、情感和逻辑，三条不同时长的线索被生硬地绞碎拼贴在一起，凑成的是一种维尔托夫式的“真实”，以貌似强烈实则无厘头的节奏和悬念掩盖他对二战的浅薄理解。其实我觉得干脆拍成默片更好，更大胆，更纯粹，观众也落个清静。算部及格的商业片吧。
看过,2017-09-01 22:14:07,3.0,117,汤老师和抗日神剧有什么区别？？？
看过,2017-08-22 18:34:54,4.0,110,说实话，还是诺兰的老套路，先搭一个酷到不行的架子，看似要革一切类型片的命，结尾还不就是狂风骤雨的煽情。可，这一套确实管用啊。《敦刻尔克》给“胜利的战争”带来新的注解，不再是看敌军死伤人数，而是看我军存活人数。
看过,2017-09-01 23:53:23,5.0,138,看得喘不上来气儿。另：里面的男孩子都真好看啊。
看过,2017-08-26 13:13:55,5.0,118,陆地、海洋、天空，三条线索有着各自的时间跨度，一周、一天、一小时，像三条弹簧被拉到不同长度后，以不同的速度回缩并在一个点相遇。三条线索交叉推进，因为时间跨度不同，要做不同的详略处理，也使得线索间产生了时空与人物状态的颠倒、反复、预知、互补效果，借此逐渐拼起了完整多角度的“大撤退”
看过,2017-09-04 18:14:43,0,102,可以确定的是我真的看不了战争片，每一个群演在海里没有回应的呼救；众人朝着海浪走去，做无意义的挣扎；像狗一样躺在沙滩上忍受饥饿和寒冷。人的狂妄自大和渺小无力都体现在战争里，看完足够抑郁一天。
看过,2017-09-01 23:03:22,2.0,99,无聊透顶，功利至极。最大价值是文青又有了彰显品位和互相吹捧的机会了
看过,2017-07-19 20:37:55,5.0,127,与其说这是部电影倒不如说是个需要亲身体验的装置艺术。当70mm胶片放映机投满IMAX屏幕糊你一脸，当汉斯季默的配乐震得全场座椅都在抖的时候，你就知道语言文字有多苍白了。一定要去你所在地最大的IMAX屏幕看，一定。
看过,2017-09-01 15:49:29,5.0,106,有一种很厉害的滤镜叫做诺兰滤镜，怎么可以把这些男孩子拍的都那么好看？！摄影机简直和Fionn谈了一场恋爱吧！空军组帅到人神共愤，落日余晖中的老湿美到喷泪！
看过,2017-09-02 19:19:50,5.0,84,四星半。战争恐怖片，里面能看到人类伟大的瞬间，渺小的瞬间，恐惧的瞬间，勇往直前的瞬间，愤怒的瞬间，宽容的瞬间。全部在地狱大门打开时，喷涌而出。你会看到每一个冒死坚持的背后，都站着更多生命。旧日世界死去的时候，以更好的方式诞生吧，我想这是每个人的希望…
看过,2017-07-22 08:03:25,5.0,129,看完一开始不知该给什么评价，缓了一阵子，终于意识到它给我留下的最深印象是：不要战争。即便我除了茫然、恐惧、无力、绝望还见到了坚韧、勇气和希望，我仍然万分不愿它们出现的背景是战争。于是，我决定给电影五星。
看过,2017-08-03 23:02:20,4.0,73,4.0。1.这一次，你们的诺神做了减法；而寂寞大师的配乐成了抒情诗。2.历史海滩上的士兵群像，看似微渺如蝼蚁，却又充满实感。3.年代感很棒。
看过,2017-07-21 10:54:42,2.0,115,视听语言的运用依旧是典型诺兰式的极度夸张 但是由于一心想在故事线的叙述上忠于史实和避免个人英雄主义伟光正鸡汤 对战争和人的内在联系连蜻蜓点水还都不到 所有触发观众感同身受的点在我看来完全无感 文化差异怎么解决？ 在暑期档一众爆米花片里洗洗眼睛算是不错的选择 但是吹成神作就真没什么意思了
看过,2017-09-02 23:01:59,5.0,87,看完之后感觉自己还停留在那个法国小镇
看过,2017-09-01 15:24:04,4.0,98,陆军怂逼，上哪哪挨炸。海军废物，只能派老百姓划小船。空军勇敢，打到没油。
看过,2017-07-18 08:10:15,2.0,87,前CN M-C/九十分钟绝境，二十分钟奇迹（70mm声效依旧棒..）
看过,2017-09-03 17:29:53,5.0,72,诺兰真是一位蒙太奇大师啊，这么简单的逃荒故事，让他拍得跌宕起伏，令人窒息，无视时间线的三条平行主线，用故事张力叠加的方式汇聚一处，再加上剪辑、音效和汉斯大神的配乐，紧张气息和绝望的情绪被轰到极点。全场观众都屏气凝神，都是抻着脖子看，都没玩手机的，这点我是最服气的
看过,2017-09-02 20:25:27,4.0,84,不少人都说音效很震撼，完全没当回事儿的我买了第二排……到现在还有点儿耳鸣，听不清别人说话。
看过,2017-07-21 01:11:04,4.0,82,诺兰对寂寞大师配乐的依赖，已经到了光靠画面和音效表现剧情，便会缺失大部分情感力量的程度了。诺兰精通电影的时空概念，他的视听精确却不精致。三段式交叉剪辑让整部电影恍如一段极长的高潮，可惜真正的高潮却模糊化了，所幸的是这电影独特的角度和深刻的主题足以撼动所有经典战争片的历史地位。
看过,2017-07-29 23:28:14,4.0,70,诺兰摆脱所谓大神包袱、尝试成为大师的第一步。生存即胜利、家人即家的主题并不超脱，重点在于以强大的临场感营造代替了传统好莱坞对历史的表现模式，通过观众对事件深入/全面的自发代入，实现殊途同归却更加干净自然的表达。虽然极简主义的视听实验被配乐拖后腿，但单从观感来看已然是高辨识度佳作。
看过,2017-09-01 12:29:39,3.0,72,差不多就是灾难片。意识形态诉求挺明显，对战争本身没啥反思，反而是有点陈腐的帝国骄阳召唤。汉斯季墨配乐的落脚点，好像是纯粹为了证明这是一部大片。
看过,2017-09-07 17:30:05,5.0,66,和战狼2比起来，高下立见。战狼2到底是爆米花电影里的五星。
看过,2017-09-04 22:50:54,5.0,88,最动人的一幕，无疑是老将军眼含热泪，注视着一批批赶来搭救的渔船，人性的光辉，最终打败战争的残酷。却不敢想，现如今，一点蝇头小利都要争的你死我活的年代，如果发生同样的事，会不会有这么多人舍身忘死去救人？到那时，大约才可证明，我们到底是不是一个高贵的民族。
看过,2017-08-15 00:29:59,3.0,83,故事的推进方式和剧本本身四星，但是妈啊…配乐简直负五星！音乐满到纯粹是在轰炸…配乐间隔的空白屈指可数，最长也不超过一分钟（我没法停止数这个），我相信很多人不晕3D，但是这片子的配乐加上大量为装而装的航拍POV（特指把imax当gopro用的）镜头啊…我晕到快吐…不给一星我算客观了
看过,2017-07-24 09:10:09,4.0,90,当初标记想看时，说了一句“补了一下Dunkirk evacuation的历史，弱弱能预感到诺兰死都不会放弃的平行剪辑会出现在哪里了”，结果猜中了两条线。想象中的泪点结果被拍的很克制，倒是汤老师最后深藏功与名的那个回眸戳得太狠…
看过,2017-07-20 15:42:14,3.0,78,平庸的PG13战争电影，很文艺，没有大场面，前半段台词极少是一个亮点，部分密室撕逼戏也是玩黑暗骑士的双邮轮老梗，诺兰最爱玩的多线叙事把故事切割得支离破碎，角色塑造严重不足，一小时四十五分的片长撑不下诺兰的野心，汉斯季默全程梦游
看过,2017-07-22 00:12:49,4.0,88,战争中，没有人是懦夫，只要能活着回家的，都是英雄。
看过,2017-07-24 15:40:11,2.0,91,不想主旋律，不想靠血腥吸引眼球，结果又要在结局带出伟光正的希望和正义，结果贞节牌坊立不成，潘金莲的风骚入骨也欠奉，抢戏的配乐搭配糟糕的叙事让人极度厌恶，但都比不上蹩脚的空战和万众欢呼的奇迹，温吞带来灾难性的不适感，坦白说，要不是香港电影院观众素质极高，在国内是要会现场找人撕逼的。
看过,2017-07-20 07:45:44,5.0,78,巴黎第一天上的晚上就去看了...以为是看枪战片，结果是用写实的拍摄方式，从求生、救生两条相交再相离的线来表达战争中人们的求生欲和牺牲精神。另外...男主角实在是太像ex，明明都不讲话两个月了还是发了消息告诉他...要剁手啊！！！
看过,2017-09-01 19:53:22,3.0,51,导演（编剧、摄影、剪辑、配乐……）的强力意志，观众在哪？
看过,2017-09-01 21:17:02,3.0,61,好了上面一条太政治不正确，但真的觉得纪录片都比这有情绪，纪录片应该还不会用这么用力的配乐
看过,2017-08-30 22:38:26,5.0,67,我知道为什么评论两极。因为它和传统的战争片太不一样了，也太不主旋律了，根本想不到可以这么拍，以及这也能玩出叙事花样！和导演有所共感的人应该会相当激动和喜悦。
看过,2017-09-02 14:37:57,4.0,39,这些年一直搞不懂，诺兰到底是因为什么封神的？因为他导演的电影票房最高？因为他导演的电影艺术水准极高？因为他导演的《盗梦空间》和《星际穿越》是不容置疑的神作？很显然，这些问题的答案都是否定的。想了半天，貌似只能这样解释了：诺兰是一个大众认为他拍的电影艺术水准很高的电影导演……
看过,2017-09-05 20:08:58,4.0,55,于战争中，一切个人的努力，用尽全力的求生，声嘶力竭的呼喊，超强的意志力，巨大的生存欲望，全部不值一提。通俗点说，前一秒“一定要活下去！下一秒“啊！”死了。怎么说呢，但愿再无战争吧。
看过,2017-07-28 23:47:47,5.0,70,"“他还好吗？那个小男孩……”“……还好。”莫名催泪。人类为什么要彼此憎恨呢？他们只是想回家啊。影院冷气十足，音效震耳欲聋，使我一直沉浸在对冰冷大海和猛烈炮火的恐惧中。“So far.""""So far?""""I'll stay here for the French ."""
看过,2017-09-01 18:31:40,5.0,61,四星半。反个人英雄主义（英雄不会死更不会被俘），反常规叙事（多线交叉），反高潮（因为每一秒都是高潮），反煽情（戛然而止）…诺兰用最不战争片的方法拍了一部战争片；没有任何铺垫没有任何后话，仅仅交代了这场“撤退”本身，如果说作为导演的斯皮尔伯格是聪明的那个，那诺兰必定是最勇敢的那个。
看过,2017-09-03 10:11:12,3.0,39,对战争深恶痛绝，对战争片也比较抵触，这算是恨屋及乌。我对战争片的评判，凡是看完能让人产生反战情绪，反省战争之殇的片子就算好片。本片在诺兰的片子里稍显单薄，但对比某部“虽远必诛”，又如云泥之隔，高下立现。
看过,2017-09-02 01:02:45,4.0,38,每个人的童年里总会出现一个同龄人，在大家还流鼻涕满脸灰时，人家早早学会模仿大人模样，用牙膏涂白球鞋，红领巾一尘不染，绘声绘色地开始国旗下的演讲。譬如诺兰就是，成熟却没有惊喜。
看过,2017-09-04 15:33:48,5.0,67,汤老师，我爱你！
看过,2017-07-27 06:07:58,5.0,59,敦刻尔克之于诺兰，就像史崔特先生的故事之于大卫林奇。如果你是抱着再看一部蓝丝绒的心情去看的史崔特先生的故事，你一定会失望。但很多年以后再回味，那真是一部好电影啊。
