看过,2017-09-11 22:01:11,2.0,23,两星是关于立场的问题。如果这样叙事和拍摄手法“高超且巧妙”（其实恰恰过于单纯和平庸）的电影，能普遍得到商业与艺术完美结合的高度评价的话，那只怕真正的好电影，又远离了我们一步。
看过,2017-09-01 09:56:33,4.0,45,汉斯·季默适当“默”一下就更好了。
看过,2017-07-15 00:17:15,5.0,195,在北美看了，很震撼人心。这部电影看来只有诺澜能够导出来，就像多年前看大兵瑞恩的感觉，多次激动到眼泪溢出。诺兰，是下一个斯皮尔伯格！
看过,2017-08-30 23:39:37,5.0,63,在学校里学“敦刻尔克大撤退”时，战争事件只是书上的铅字，离我的距离几乎是永恒。而最让我震撼的是最后年轻的士兵们终于撤回英格兰时，他们所返回的生活，几乎就跟现在任何一个英国乡村的生活无异。死亡和生存，战争与和平，如同空降般将我和历史从未有过地紧密连接起来，就是这部电影带给我的震撼。
看过,2017-09-03 23:38:05,5.0,38,共享经济在二战期间的大型应用 好几场戏设计得真好 后半程哭着看完 浪漫得恰到好处 诗意得干净利落 少一笔不明就里 多一笔故作苦情 当四十万人无法回家 家为你而来 冥冥之中有神有爱 我要学游泳 原谅了诺兰又炒冷饭
看过,2017-08-22 21:40:33,4.0,61,"《敦刻尔克》拍得极其克制又温暖，诺兰果然没打算给我们看一部意料之内的片子。
撤退的士兵难过地问：你对我们很失望吧。
对方却只是拍了拍他的肩膀。
瞎了眼的老爷爷在街头欢迎他们回家，他不解地说，我们只是逃跑了。老爷爷心疼地摸了摸他的脸。
——在战争中，能够活着就是最大的胜利啊啊。"
看过,2017-09-02 00:12:02,4.0,45,我们是逃兵还是勇士，他们是寻死还是救人。这一周，我们用肉身去挡子弹；这一天，他们乘小艇去闯战场；这一刻，他用油箱去搏命运。那些年轻的面庞涉世未深，对生命渴望对信仰坚定，对未来犹疑。筑起一道防线，心里却一溃千里；祖国就在对岸，梦里却遥不可及。这是军事史上的奇迹，也是电影史里的奇作。
看过,2017-08-16 21:15:42,3.0,58,这次的诺兰炫技到了极致，一手剪辑出神入化把一个二十分钟能讲完的故事说了快两个小时，故事内核也很浅薄甚至有些牵强。当然这是一部很成熟的电影，但我看得很累，所以我不喜欢。
看过,2017-09-01 21:25:51,4.0,44,前半程闷到困，后半程发力，不同时空交织在一起汇成完整故事。演技在线，镜头很赞，汉斯季莫也尽力了，但故事一般。这是孕育了胜利，改变人类历史的撤退。英国所有能漂浮的东西都去了敦刻尔克，无数平民出海再没回来，还有数万法军死守防线…虽然每句台词后都有故事，但影片太含蓄，力度不够，整体一般
看过,2017-09-03 21:01:54,5.0,50,甩战狼一百个建你大业
看过,2017-09-03 00:17:44,3.0,50,说实话，有点像过家家。另外我对诺兰所有的电影都抱同样的看法：一个工程师，能搭建精巧的结构，如果有幸升任市领导还可以带头搞市政规划，但要搞精神文明建设，他还是只会用最庸俗的方式。
